line	page	week	num_likes	domain	outlet	title	description	contenttype	image	url	text	id	right_of_center
1011	DieLinke	1	0	change.org	Change.org	Die Mütterrente verfehlt die wirklich Bedürftigen. GrundsicherungsempfängerInnen bleiben außen vor!	Mit großem Populismus wurde das Projekt Mütterrente, also die Verbesserung der Anrechnung von Kindererziehungszeiten vorangetrieben und zum 01.07.2014 nunmehr Gesetz. Die Realität jedoch zeigt, dass diejenigen Mütter, vielleicht auch Väter, von den Segnungen des Gesetzes nicht profitieren, die in...	change-org:petition	http://d22r54gnmuhwmk.cloudfront.net/photos/5/cc/np/lMCCNPIoawWuSxU-1600x900-noPad.jpg?1423837551	https://www.change.org/p/die-mütterrente-verfehlt-die-wirklich-bedürftigen-grundsicherungsempfängerinnen-bleiben-außen-vor	Liebe Change.org-Nutzerinnen und -Nutzer, wir setzen auf Change.org Cookies ein, um Ihnen möglichst viele interessante Inhalte anzuzeigen. Weitere Informationen. OK, das habe ich verstanden Zum Hauptinhalt wechseln 	1011	False
1970	DieGruenen	1	0	neues-deutschland.de		Grüne wegen Spenden der Rüstungsindustrie in Erklärungsnot (neues deutschland)	Eigentlich sind die Schlagzeilen über die Großspenden der Wirtschaftslobby an die Parteien - nicht an alle - schon gelaufen. Nun aber kommt das Thema noch einmal hoch: wegen einer Südwestmetall-Überweisung an die Grünen.	article		http://www.neues-deutschland.de/artikel/957304.gruene-wegen-spenden-der-ruestungsindustrie-in-erklaerungsnot.html	Grüne wegen Spenden der Rüstungsindustrie in Erklärungsnot Südwestmetall-Verband überweist Rekordsumme von 100.000 Euro / Auch Waffenhersteller im Industrielobby-Verband Berlin. Eigentlich sind die Schlagzeilen über die Großspenden der Wirtschaftsverbände und Unternehmen an die Parteien - nicht an alle - schon gelaufen. 2014 erhielten Union, SPD, Grüne und FDP weniger solcher Großspenden über 50.000 Euro, die beim Bundestag extra angezeigt werden müssen - die Summe: 1,52 Millionen Euro. Im Jahr davor waren es noch 3,5 Millionen Euro, eine Differenz, die in einem Wahlkampfjahr durchaus üblich ist. Warum endet dieser Text denn jetzt schon? Mittendrin? Ich möchte den Artikel gerne weiterlesen! Um den ganzen Artikel zu lesen, benötigen Sie ein entsprechendes Abo. Wenn Sie schon eins haben, loggen Sie sich einfach ein. Wenn nicht, probieren Sie doch mal unser Digital-Mini-Abo: 	1970	False
1975	DieGruenen	1	0	faz.net	FAZ.NET	Arbeitsmarkt: Gabriel gesteht Fehler bei Hartz IV ein	Durch die Reform habe sich der Niedriglohnsektor ausbreiten können, erklärt der Wirtschaftsminister in einem Interview. Außerdem seien Menschen, die nach vielen Arbeitsjahren ihren Job verloren hätten, unfair behandelt worden.		http://media1.faz.net/ppmedia/aktuell/3128487502/1.3350983/article_multimedia_overview/wirtschaftsminister-sigmar.jpg	http://www.faz.net/aktuell/wirtschaft/wirtschaftspolitik/gabriel-gesteht-fehler-bei-hartz-iv-ein-13350980.html	Gabriel gesteht Fehler bei Hartz IV ein   Beitrag per E-Mail versenden Arbeitsmarkt: Gabriel gesteht Fehler bei Hartz IV ein Arbeitsmarkt Gabriel gesteht Fehler bei Hartz IV ein Von Durch die Reform habe sich der Niedriglohnsektor ausbreiten können, erklärt der Wirtschaftsminister in einem Interview. Außerdem seien Menschen, die nach vielen Arbeitsjahren ihren Job verloren hätten, unfair behandelt worden. Ein Fehler ist aufgetreten. Bitte überprüfen Sie Ihre Eingaben. E-Mail-Adresse des Empfängers (Mehrere Adressen durch Kommas trennen) Ihre E-Mail Adresse Ihre Nachricht (optional) Sicherheitscode Um einen neuen Sicherheitscode zu erzeugen, klicken Sie bitte auf das Bild. Bitte geben Sie hier den oben gezeigten Sicherheitscode ein. Veröffentlicht: 03.01.2015, 04:25 Uhr Arbeitsmarkt Gabriel gesteht Fehler bei Hartz IV ein Durch die Reform habe sich der Niedriglohnsektor ausbreiten können, erklärt der Wirtschaftsminister in einem Interview. Außerdem seien Menschen, die nach vielen Arbeitsjahren ihren Job verloren hätten, unfair behandelt worden. 03.01.2015 Wirtschaftsminister Sigmar Gabriel © dpa Wirtschaftsminister Sigmar Gabriel Bundeswirtschaftsminister Sigmar Gabriel hat Fehler bei der Einführung von Hartz IV eingeräumt. Schon vor zehn Jahren hätte es einen Mindestlohn geben müssen, damit „dieser unfaire Niedriglohnsektor sich nicht derart ausbreitet“, sagte Gabriel der Zeitung „Bild am Sonntag“ einem Vorabbericht zufolge. Gabriel machte noch weitere Fehler aus: „Wir hätten diejenigen, die jahrzehntelang gearbeitet haben, dann unverschuldet arbeitslos wurden, nach Auslaufen des Arbeitslosengeldes bei Hartz IV nicht genauso behandeln dürfen wie denjenigen, die nie gearbeitet hat“, erklärte er. „Der Wert der Arbeit muss erhalten bleiben.“ Gabriel stimmt Gewerkschaften zu Sigmar Gabriel: Der neue Genosse  der Bosse Die Reform ist laut Gabriel grundsätzlich der richtige Weg gewesen. „Vorher war es oftmals lukrativer, Arbeitslosenhilfe zu kassieren und zusätzlich irgendwo schwarz zu arbeiten statt einen normalen Job anzunehmen“, sagte Gabriel dem Blatt. „Der Erfolg ist ja sichtbar: damals hatten wir fünf Millionen Arbeitslose, heute sind es zwei Millionen weniger.“ 	1975	False
1980	DieGruenen	1	0	sueddeutsche.de	Süddeutsche.de	Migranten bei der AfD – Die Deutschenversteher	Sie stammen aus der Türkei oder Tansania - und sind Mitglieder der Alternative für Deutschland. Ausgerechnet da? Zwei Mitglieder mit Migrationshintergrund erklären, warum.	article	http://polpix.sueddeutsche.com/bild/1.2283652.1464770079/940x528/migrantenbei-afd.jpg	http://www.sueddeutsche.de/politik/migrantenbei-der-afd-die-deutschenversteher-1.2283582	"Migranten bei der AfD - Die Deutschenversteher 29. Dezember 2014, 21:18 Uhr Migranten bei der AfD Die Deutschenversteher Katarina M. findet, gut ausgebildete Migranten sollten in ihre Heimat zurückkehren. (Foto: Florian Peljak) Feedback Anzeige Auch in der AfD gibt es Mitglieder mit Migrationshintergrund. Meist stammen sie aus dem akademischen Mittelstand und haben kein Problem mit der harten Zuwanderungspolitik ihrer Partei. Daran ändern auch Aussagen, wie die des Vizevorsitzenden Alexander Gauland, der die Partei als ""natürlichen Verbündeten"" der Pegida-Bewegung sieht, nichts. Von Roland Preuß Roland Preuß Der gebürtige Münchner arbeitet seit 2001 bei der Süddeutschen Zeitung, seit 2005 als Redakteur in der Innenpolitik. Roland Preuß beschäftigt sich vor allem mit Bildungsthemen sowie Migrations- und Integrationspolitik. Nach dem Studium in Freiburg und Edinburgh besuchte er die Berliner Journalistenschule (BJS). Autor des Buches ""Guttenbergs Fall"" (zusammen mit Tanjev Schultz). Träger des Medienpreises der Caritas München-Freising (mit Matthias Drobinski) und des Goethe-Medienpreises für wissenschafts- und hochschulpolitischen Journalismus (mit Tanjev Schultz, 2012). Mail schreiben Katarina M.* war ""Referentin für Frauen- und Lesbenpolitik"" an der Uni Mainz. Sie hat zwei Kinder von zwei Männern und sie redet darüber ganz offen. Dem konservativ-traditionellen Familienbild wird sie damit nicht ganz gerecht. Über ihrem hellbraunen Gesicht erhebt sich ein schwarzer Lockenturm. Man sieht, dass ihr Vater aus Afrika stammt, aus Tansania. Dass M. in der Alternative für Deutschland (AfD) ist, vermutet man eher nicht. Eine Migrantin in einer Partei, die für eine harte Zuwanderungspolitik steht, in denen Führungskräfte mit Sprüchen gegen Migranten rechtes Publikum einfangen? Ja, sagt M., gerade wegen der Zuwanderungspolitik arbeite sie nun in der AfD mit. Allerdings gerade mit ""großen Schmerzen"". Denn es gibt Grenzen, was sie noch mittragen kann. Asylbewerber als sozialer Bodensatz? Diese Aussagen nennt M. ""unglücklich"" Mit Mitte dreißig saß M. noch bei den Grünen . Die waren freundlich zu ihr, eine Art ausgleichende Gerechtigkeit für die Widrigkeiten da draußen in der vorurteilsbeladenen Welt. ""Nett waren die alle"", sagt sie. Doch überzeugt haben sie M. letztlich nicht. Denn die offenen Arme für Einwanderer erfuhr sie als bloße Theorie, ihre Kinder schickten diese Grünen lieber nicht auf Schulen, wo viele Migranten hingingen. Sie sagten das bloß nicht. Zehn Jahre später klickte sich M. durch die Internetseiten der AfD. Die erschien ihr nüchterner, realistischer. Sie wolle, dass man Zuwanderung vernünftig steuert und sie wolle Asylbewerber arbeiten lassen, sagt M.. ""Ich fand es klasse, dass die sich trauen, das Thema anzufassen."" Und natürlich zweifelte sie, dass es mit dem Euro so weitergehen kann. Die AfD-Unterstützerliste mit allerlei Professoren darauf tat ein übriges: Im Mai 2013 trat sie bei. Man kann sagen, dass M. selbst reichlich Praxiserfahrung gesammelt hat zum Thema Migration. Sie stammt aus Ostdeutschland , zu DDR-Zeiten lernte die Mutter ihren späteren Vater kennen, er war Gaststudent aus Ostafrika. In der DDR war sie das ""Negerpüppchen"". Die Familie zog zum Vater nach Tansania, da war sie neun Jahre alt. Mit 19 ging es zurück ins frisch vereinigte Deutschland. Sie betrachtet das Thema auch von der anderen Seite. ""Stärkt diese Länder"", sagt sie mit Blick auf Afrika. ""Denn was passiert mit den Ländern, wenn die oft gut ausgebildeten Auswanderer alle weg sind? Man könnte sie herkommen lassen, gefördert durch Stipendien, aber nach dem Studium wieder zurückschicken, damit sie ihre Heimatländer mit aufbauen."" Anzeige Der schärfste Konkurrent des Migranten ist der neue Migrant Migranten sind nicht automatisch die Freunde anderer Migranten, ganz im Gegenteil. Die einen grenzen sich gegen andere ab, viele sind dagegen, dass noch mehr Migranten kommen. Das hat einen handfesten Hintergrund: der schärfste Konkurrent des Zuwanderers auf dem Arbeitsmarkt ist der neue Zuwanderer, der womöglich für (noch) weniger Geld arbeitet. Alteingesessene Deutsche werden kaum verdrängt. Warum sollten da Einwanderer selbstloser sein als andere Menschen? M. passt aus einem weiteren Grund in die AfD. Die studierte Übersetzerin arbeitet in einer Münchner Unternehmensberatung. Sie ist akademischer Mittelstand, wie so viele in der Partei. Von Asylbewerbern oder Tagelöhnern aus Bulgarien trennen sie Welten. Man trifft sich mit ihr in einem bayerischen Restaurant, sie bestellt Gulasch mit Knödeln. M. ist Stammkundin. Die bayerische AfD schickte nach der Anfrage eine ganze Liste von Mitgliedern aus allen Erdteilen, Ingenieure, Anwälte. Das ist die weltoffene Seite der Partei. In der AfD-Parteispitze sympathisiert man mit Pegida Doch es gibt auch eine andere. Man findet sie in Äußerungen von Führungskräften wie Martin Sichert, dem Nürnberger Kreisvorsitzenden. ""Warum sind es immer die Türken, die Kanakensprache sprechen"", soll er im Internet verbreitet haben. Ein Parteiausschlussverfahren gegen ihn scheiterte aus formalen Gründen. In Brandenburg stimmte die AfD-Fraktion im Kreistag Dahme-Spreewald ausgerechnet mit der NPD zusammen für die ""konsequente Abschiebung"" von Asylbewerbern. Auch die Stoßrichtung der Parteispitze ist klar, etwa vom Vizevorsitzenden Alexander Gauland, der mit den Islamgegnern der Pegida-Märsche sympathisiert: ""Wir sind die ganz natürlichen Verbündeten dieser Bewegung"", sagt er. Parteichef Bernd Lucke grenzt sich von Rechtsextremen ab, er fordert eine Fachkräftezuwanderung nach kanadischem Vorbild. Aber er spricht von bestimmten Zuwanderern auch als eine Art ""sozialer Bodensatz, der lebenslang in unseren Sozialsystemen verharrt"". Hält man das aus als Migrant? ""Luckes Aussage war unglücklich"", sagt M.. Aber im Grundsatz stimmt sie seiner Linie zu. Sie will das Asylrecht nicht verschärfen. ""Es gibt aber Menschen, die hier keiner haben will."" Von Pegida hält sie wenig. ""Ich verdamme diese Demonstranten nicht, aber die meisten sind vermutlich von Angst und Ressentiments getrieben."" Sätze wie die von Sichert hält sie für ""gefährlich"", das Verhalten der Brandenburger Parteifreunde für ""politisch total ungeschickt"". Diese Probleme habe die Partei vor allem in Ostdeutschland, in Bayern dagegen ist sie nie angefeindet worden wegen Herkunft und Hautfarbe. Sicher, auf ihrem ersten Parteitag im Mai 2013 in Ingolstadt staunten die vielen grauhaarigen Herren. ""Die haben befremdet gekuckt, aber gesagt hat keiner was."" Aber ansonsten? ""Große Offenheit"", sagt M.. Rechtsextreme Einstellungen in Deutschland gehen zurück. Außer bei den AfD-Sympathisanten. Im Vergleich zu den restlichen Befragten tendieren Anhänger der euroskeptischen Partei auffällig oft zu Rassismus und Menschenfeindlichkeit. Überholt werden sie nur von der NPD. mehr ... ""Zuerst hat man mich schief angeschaut"", sagt Tuncay Deniz über sein erstes Parteitreffen. Da ging es dem Deutsch-Türken so wie M., trotz aller Unterschiede. Mit sieben Jahren kam er nach Deutschland, heute ist er Ingenieur am Münchner Flughafen , seine Frau aus der Türkei arbeitet bei der Allianz. Man trifft sich in einem schicken Café am Flughafen, Deniz trägt einen grauen Anzug und Pastell-Krawatte zum silbergrauen Haar. Früher hat er mal die Grünen gewählt, mal SPD, zuletzt FDP. Was treibt ihn zur AfD? Die Wut auf die Merkel-Regierung, sagt Tuncay. Die Probleme im Land würden totgeschwiegen, die Eurokrise, die Armut von Alten und Kindern, der Geldmangel an den Schulen. Es sei wie bei einem lausigen Fußballspiel gewesen. Die unzufriedenen Zuschauer stürmen den Platz, greifen sich den Trainer - und merken erst dann, wer da alles steht: der Anwalt, der Facharbeiter und eben auch der Ingenieur mit türkischen Wurzeln. Entscheidend ist, dass sie gegen den Trainer, also die Regierung Merkel sind, nicht wo sie herkommen, meint Deniz. ""Ich habe mich nie integrieren müssen. Ich habe mich einfach angestrengt"" Das ändert nichts daran, dass da einige Parteimitglieder manche Mitstreiter gar nicht erst auf dem Platz sehen wollen. ""Natürlich stört mich das"", sagt Deniz. Aber seine Erfahrung in der Partei ist eine andere: Die AfD wählte ihn vor der Bundestagswahl zum Direktkandidaten für München-Ost, ein Wahlkampf-Flyer zeigt ihn auf der einen Seite, auf der anderen lächelt Parteivize Hans Olaf Henkel. Für Deniz ist die AfD eine Partei der ""ökonomischen Vernunft"". Bald danach kommt die Zuwanderungspolitik. ""Mich stört, dass viele Migranten immer noch nicht in der Lage sind, richtig Deutsch zu sprechen"", sagt Deniz. Überhaupt, die Migranten und die Integration. Viel anfangen kann er damit nicht. ""Als Migrant habe ich mich nie gefühlt, ich hab mich nie integrieren müssen, ich habe mich einfach angestrengt."" Das erwartet er von anderen auch. Weshalb er sich von Lucke gut vertreten fühlt. Und die Bürger versteht, wenn sie Menschen, die aus wirtschaftlicher Not kommen, ablehnen. Beim Thema Zuwanderung drehen Tuncay und M. die Debatte um. Sie fordern nicht mehr Verständnis für Zuwanderer, sondern mehr Verständnis für die, die schon da sind. Es sind Deutschenversteher. ""Die Leute haben Angst, sie fühlen sich in ihrer deutschen Identität bedroht. Das nicht ernst zu nehmen, finde ich arrogant"", sagt M.. Sie will weitermachen in der AfD, im Presseteam des Landesverbands, und sie bewirbt sich für den Landesausschuss zur Außen- und Sicherheitspolitik. Fühlt sie sich da wirklich wohl? ""Es variiert"", sagt M.. ""Ich trete sofort aus, wenn die AfD offiziell festschreibt, dass wir gegen die Gleichstellung von Schwulen und Lesben sind."" Das ist ihre Grenze. So viel ist allemal übrig geblieben von ihrer linken Vergangenheit. "	1980	False
1982	DieGruenen	1	0	youtube.com	YouTube	Libertarismus - Die Dokumentation	Was ist Libertarismus? Warum hat es der Libertarismus so schwer in Deutschland? Warum ist der Libertarismus sozial? Wer sind die bekanntesten Denker? Welche ...	video	https://i.ytimg.com/vi/syySw99NcS4/hqdefault.jpg	https://www.youtube.com/watch?v=syySw99NcS4&list=PL5qusMCqBdTsKBYnJGDpQ6HCsUlG08ksV	Möchtest du dieses Video später noch einmal ansehen? Wenn du bei YouTube angemeldet bist, kannst du dieses Video zu einer Playlist hinzufügen. 	1982	False
1983	DieGruenen	1	0	welt.de	DIE WELT	Grüne wollen keinen Gedenkstein für Trümmerfrauen	In München erinnert ein neues Denkmal an die Frauen und Männer, die nach Kriegsende die bayerische Hauptstadt wieder aufgebaut haben. Nach Ansicht der Grünen werden damit aber die Falschen geehrt.	article	http://img.welt.de/img/deutschland/crop122749391/2546932060-ci3x2l-w900/Gedenkstein-Truemmerfrauen-in-Muenchen.jpg	http://www.welt.de/politik/deutschland/article122749392/Gruene-wollen-keinen-Gedenkstein-fuer-Truemmerfrauen.html	"Von Claudia Ehrenstein Claudia Ehrenstein Biografie und alle Artikel des Autors Facebook Google + Twitter Politikredakteurin Foto:  Bündnis 90/Die Grünen im Bayerischen Landtag ""Den Richtigen ein Denkmal. Nicht den Alt-Nazis"" steht auf der Plane, mit der Katharina Schulze und ihr grüner Fraktionskollege Sepp Dürr den Gedenkstein verhüllt haben Katharina Schulze ist 28 Jahre alt, Vorsitzende der Münchner Grünen und seit Oktober Abgeordnete des Bayerischen Landtags. Erste politische Erfahrungen hat sie also schon gesammelt. Und sie weiß auch, was ein Shitstorm ist. Was sie aber derzeit erlebt, verschlägt ihr fast die Sprache. ""Krass"" nennt sie den massiven Hass, den sie zu spüren bekommt. ""Weg mit der Schnepfe"" ist noch eine der harmloseren Beschimpfungen. Auf Facebook gibt es eine eigens eingerichtete Seite, auf der ihr Rücktritt gefordert wird. ""Braunen Sack drüber und Schlinge drum!"", heißt es in einem der Kommentare. Grüne ""Politdilettantin"". Die Seite wurde schon mehr 100 Mal geteilt. Hinter einer Flut von Hassmails vermutet Schulze eine ""konzentrierte Aktion"" rechter Gruppierungen, denn es tauchten immer wieder dieselben Textbausteine auf. Ehrung der Aufbaugeneration Anlass für diese Empörungswelle im Internet ist die Verhüllung eine Denkmals für Trümmerfrauen an der Münchner Alfons-Goppel-Straße, auf halber Strecke ungefähr zwischen Maximilianstraße und Bayerischer Staatskanzlei. Auf einem schlichten Felsbrocken ist dort in goldenen Buchstaben zu lesen: ""Den Trümmerfrauen und der Aufbaugeneration Dank und Anerkennung München nach 1945"". Und in einem Nachsatz: ""Im Wissen um die Verantwortung"". Dieser Gedenkstein vermittle ein völlig falsches Bild, sagt Schulze und beruft sich auf Recherchen des Münchner Staatsarchivs. Demnach habe es in München nach Ende des Krieges kaum Trümmerfrauen gegeben. Es seien vor allem Alt-Nazi gewesen, die zwangsverpflichtet wurden, beim Aufräumen und Wiederaufbau zu helfen, um sich ihre Essenmarken zu verdienen. Unter den rund 1500 Personen, die damals im Einsatz waren, sollen nur 200 Frauen gewesen hat. Denkmal mit Plane verhüllt ""Wir wollen die Leistungen von Trümmerfrauen nicht schmälern"", versichert Schulze. In Städten wie Hamburg oder Berlin hätte ein solches Denkmal seine Berechtigung. In München aber habe es die Trümmerfrauen eben so nicht gegeben. ""Den richtigen ein Denkmal. Nicht den Alt-Nazis"" steht daher auf der Plane, mit der Schulze und ihr grüner Fraktionskollege Sepp Dürr das Denkmal verhüllt haben. Das war am vergangenen Donnerstag. Foto: picture alliance / dpa Bayerns Kultusminister Ludwig Spaenle (CSU) verteidigt das umstrittene Münchner Denkmal für die Trümmerfrauen: Der Zusatz ""Im Wissen um die Verantwortung"" erinnere an den historischen Hintergrund und die deutsche Verantwortung für die Shoah Die Plane ist längst wieder eingerollt. Die empörten Reaktionen aber reißen nicht ab. Dürr spricht von einen ""Kampf um die Geschichtsdeutung"". Ihm gehe es darum, die Vergangenheit aufzuarbeiten und über eine angemessene Erinnerungskultur zu diskutieren. Stattdessen beobachte er jedoch gerade bei der Generation der Enkel ein ausgeprägtes Bemühen, die Generation ihrer Großeltern von jeglicher Schuld freizusprechen. Der Gedenkstein ist nach Ansicht Dürrs eine solche Freisprechung. In München wurde schon seit Jahren über ein Denkmal für Trümmerfrauen gestritten. Vier Mal hatte der Münchner Stadtrat dagegen gestimmt, zuletzt 2007. Der Verein ""Dank und Gedenken der Aufbaugeneration, insbesondere der Trümmerfrauen e.V."" konnte das Vorhaben schließlich umsetzten, nachdem der Freistaat Bayern dafür ein entsprechendes Gelände zur Verfügung gestellt hatte. Im Mai wurde der Gedenkstein aufgestellt und im September feierlich geweiht. Dem NS-Regime zu Dienste gewesen In der Antwort auf eine Anfrage des grünen Abgeordneten Dürr stellt auch Bayerns Kultusminister Ludwig Spaenle (CSU) fest, dass ""unbestritten in München die Arbeit der ,Trümmerfrauen' eine geringere Rolle gespielt hat als in anderen deutschen/bayerischen Städten"". Dass bei der Trümmerbeseitigung überwiegend Männer und Frauen zum Einsatz kamen, die dem NS-Regime ""zu Dienste gewesen waren"", sei für die Gesamtwürdigung des Denkmals ein sehr wichtiger Gesichtspunkt. Spaenle wehrt sich denn auch gegen den Vorwurf der Grünen, ""Geschichtsklitterung"" zu betreiben. Das sei eine ""plumpe"" Unterstellung, sagte Spaenle im Gespräch mit der ""Welt"". Schon bei der Aufstellung des Gedenksteins habe er darauf hingewiesen, dass die Erinnerung an die Aufbaugeneration immer vor dem historischen Hintergrund der deutschen Verantwortung für die Shoah stehe. Daher habe für diesen Nachsatz ""Im Wissen um die Verantwortung"" auf dem Gedenkstein gesorgt. Auch Spaenle hat in den vergangenen Tagen dutzende Mails bekommen - von Menschen, die sich durch die Aktion der Grünen zu Unrecht diffamiert fühlten, wie er sagt. So seien nach Kriegsende etwa auch Studenten verpflichtet worden, bei den Aufräumarbeiten zu helfen und einen ""Räumschein"" zu erwerben, den sie dann an der Universität vorlegen mussten. Und so wirft Spaenle den Grünen vor, mit ihrer Kritik an dem Gedenkstein selbst ""Geschichtsklitterung"" zu betreiben. © WeltN24 GmbH 2016. Alle Rechte vorbehalten "	1983	False
