line	page	week	num_likes	domain	outlet	title	description	contenttype	image	url	text	id	right_of_center
96	Pegida	9	700	jungefreiheit.de	JUNGE FREIHEIT	Zentralratspräsident warnt vor Kippa-Tragen	Der Präsident des Zentralrates der Juden in Deutschland, Josef Schuster, hat vor dem Tragen der Kippa in von Moslems dominierten Stadtgebieten gewarnt. „Es ist eine Entwicklung, die ich so vor fünf Jahren nicht erwartet hätte.“	article	https://assets.jungefreiheit.de/2015/02/54994228-860x360.jpg	https://jungefreiheit.de/politik/deutschland/2015/zentralratspraesident-warnt-vor-kippa-tragen/	Zentralratspräsident warnt vor Kippa-Tragen Mann mit Kippa: Zentralratsvorsitzender warnt vor Tragen in von Moslems dominierten Stadtvierteln Foto:  picture alliance / dpa BERLIN. Der Präsident des Zentralrates der Juden in Deutschland, Josef Schuster, hat vor dem Tragen der Kippa in von Moslems dominierten Stadtgebieten gewarnt. „Die Frage ist, ob es tatsächlich sinnvoll ist, sich in Problemvierteln, in Vierteln mit einem hohen muslimischen Anteil, als Jude durch das Tragen der zu erkennen gibt“, sagte er dem RBB-Inforadio. Jedoch „sollten sich Juden nicht aus Angst verstecken“. Die meisten jüdischen Einrichtungen seien in Deutschland gut gesichtert. Hintergrund sind gehäufte Überfälle auf Juden durch überwiegend moslemische Täter. Für Aufsehen sorgte beispielsweise der Rücktritt des Offenbacher Schülervertreters im vergangenen Oktober. Dieser begründete seinen Schritt mit Morddrohungen, denen er als Jude seitens arabisch- und türkischstämmigen Jugendlichen ausgesetzt gewesen sei. „Es ist eine Entwicklung, die ich so vor fünf Jahren nicht erwartet hätte“, zeigte sich Schuster bestürzt. (FA) Unterstützung Wenn Ihnen unser Artikel gefallen hat: Unterstützen Sie die JF mit einer Spende € 	96	True
98	Pegida	9	853	rp-online.de	RP ONLINE	Richter- und Staatsanwaltstag in Weimar: Ist die Scharia auch deutsches Recht?	Anstatt vor staatliche Gerichte zieht es strenggläubige Muslime auch in Deutschland lieber zu islamischen Streitschlichtern. Die Gefahr einer Paralleljustiz muss stärker diskutiert werden, heißt es beim Richter- und Staatsanwaltstag in Weimar.		http://bc02.rp-online.de/polopoly_fs/zahlreiche-trauergaeste-2012-berlin-trauerfeier-jungen-1.4149708.1396463186!httpImage/2436529097.jpg_gen/derivatives/d950x950/2436529097.jpg	http://www.rp-online.de/politik/deutschland/ist-die-scharia-auch-deutsches-recht-aid-1.4149707	"Richter- und Staatsanwaltstag in Weimar Ist die Scharia auch deutsches Recht? Zahlreiche Trauergäste nahmen 2012 in Berlin an einer Trauerfeier für einen jungen Muslim teil. FOTO:  dpa Zahlreiche Trauergäste nahmen 2012 in Berlin an einer Trauerfeier für einen jungen Muslim teil. FOTO:  dpa Twittern Weimar. Anstatt vor staatliche Gerichte zieht es strenggläubige Muslime auch in Deutschland lieber zu islamischen Streitschlichtern. Die Gefahr einer Paralleljustiz muss stärker diskutiert werden, heißt es beim Richter- und Staatsanwaltstag in Weimar. Von Reinhold Michels Ein Schreckgespenst geht um in deutschen Großstädten: Es heißt Scharia, was übersetzt so viel bedeutet wie ""Weg"" oder ""zur Quelle"". Klingt harmlos, ist es aber nicht. Auch auf dem Richter- und Staatsanwaltstag in Weimar wurde die deutsche Rechtskultur von radikalisierten Verfechtern mit islamischen Rechtsauffassungen mit Nichtbeachtung gestraft. Der Journalist und Kriminologe Joachim Wagner, bekannt durch sein aufklärerisches Buch ""Richter ohne Gesetz"", gab ein eindrucksvolles Beispiel von Schattenjustiz mitten im Einwanderungsland Deutschland: Ein muslimisches Mädchen aus Berlin verliebt sich in einen jungen Libanesen und will ihn heiraten. Die Familie des Mädchens lehnt den jungen Mann jedoch ab und ""bestraft"" das Mädchen durch schwere Körperverletzung. Die Tat wird nicht etwa nach deutschem Strafrecht geahndet; vielmehr tritt ein islamischer Streitschlichter in Erscheinung. Dieser im Viertel bekannte Kriminelle empfiehlt, die Täter nicht zu bestrafen. Im Gegenzug bekommt das Mädchen seine Heiratserlaubnis. Die Scharia, das islamische Recht, basiert auf dem Koran und der überlieferten Lebenspraxis des Propheten Mohammed. Sie regelt Rechtsnormen wie das Familien- und Strafrecht und die religiösen Vorschriften für Muslime – ohne dabei die Sphären von Religion und Staat zu trennen. Radikale Muslime rechtfertigen deshalb auch extreme Strafen wie die Steinigung mit der Scharia. Im Fall des verliebten muslimischen Mädchens aus Berlin wurde von den beteiligten Clans das Ziel verfolgt, Frieden zwischen den Familien herbeizuführen – jedoch unter Missachtung des deutschen Rechtsstaates und seiner Normen. Wagner: ""Unser staatliches Strafmonopol wird unterlaufen, entweder durch Verhinderung einer Strafanzeige, Fälschen der Beweise oder entlastende Aussagen des Opfers zugunsten des Täters."" Die Scharia-Schattenjustiz tritt in ihrer krassen Variante als Blutrache, Entführung, Ehrenmord oder Zwangsverheiratung auf. Auf der Richter- und Staatsanwaltstagung war auch von der Gefahr einer Parallelgesellschaft die Rede: Imame würden mitten im Rechtsstaat Zwangsehen schließen, islamische Geistliche das Verbot der Polygamie (Vielehe) nicht beachten. In der Scharia-Rechtskultur stellten manche Clanchefs zudem Haftbefehle aus – wenn sich etwa eine islamische Großfamilie auf die Suche nach einem Schuldner aus einer ebenfalls islamischen Familie macht und das Opfer zwingt, seine Schulden zurückzuzahlen. Eine Strafanzeige werde dabei in der Regel nicht gestellt. Ganz nach dem Motto: ""Das regeln wir unter uns."" Die Schattenjustiz existiert weitgehend im Dunkeln, vorwiegend in Berlin, Bremen, Niedersachsen und Nordrhein-Westfalen. Mathias Rohe, Jurist und Islamwissenschaftler aus Erlangen, sagte allerdings, dass auch in Bayern jährlich mehrere Tausend ""Scharia-Problemlösungen"" vorbei am deutschen Recht stattfänden. Rohe räumte ein, dass die meisten Muslime in Deutschland ihre Streitigkeiten vor deutschen Gerichten austrügen; aber man dürfe nicht länger verniedlichen, dass in bestimmten Großstadt-Milieu oft mit kurdischem oder arabischem Hintergrund, deutsches Recht ignoriert werde. Rohe: ""Das ist eine Gefahr für unser Land."" Auch Rainer Wendt, Vorsitzender der Deutschen Polizeigewerkschaft, erklärte in Weimar: ""Es darf keine eigene Paralleljustiz für bestimmte Bevölkerungsgruppen geben, sonst wird der Rechtsstaat ad absurdum geführt."" Zum Schluss meldete sich Arnold Mengelkoch, Integrationsbeauftragter in Berlin-Neukölln, zu Wort: Er berichtete von einem Vorfall, bei dem zwei muslimische Männer zwei muslimische Mädchen in einem Bus belästigten. Die Mädchen wehrten sich, wurden daraufhin bespuckt und verprügelt. Eines der Mädchen fiel in Ohnmacht. Zweieinhalb Jahre später kam es nicht zur Schattenjustiz, sondern zu einem Verfahren vor einem deutschen Gericht. Die Täter gebärdeten sich frech, die Opfer hatten Angst, gegen sie auszusagen. Mengelkoch: ""Da stimmt was nicht bei uns und unserer Staatsgewalt. Unser System schwächelt."" Quelle: RP "	98	True
99	Pegida	9	325	stern.de	stern.de	Thomas de Maizière nimmt Scharia-Vergleich zurück - Deutschland | STERN.de	In einem Interview hatte de Maizière den Kirchen vorgeworfen, sich mit dem Kirchenasyl über geltendes Recht zu stellen - und einen Scharia-Vergleich gezogen.	article	http://image.stern.de/5958446/16x9-1200-675/d90f2c7f18b29f39f70bd5ade6cc8ca6/QC/thomas-de-maiziere-jpg--aec8bc2e70b3635f-.jpg	http://www.stern.de/politik/deutschland/thomas-de-maiziere-nimmt-scharia-vergleich-zurueck-2176153.html	"Thomas de Maizière nimmt Scharia-Vergleich zurück 25. Februar 2015 17:33 Uhr Diskussion um Kirchenasyl De Maizière nimmt Scharia-Vergleich zurück In einem Interview hatte Thomas de Maizière den Kirchen vorgeworfen, sich mit dem Kirchenasyl über geltendes Recht zu stellen - und einen Scharia-Vergleich gezogen. Den hat er jetzt zurückgenommen. Fullscreen Thomas de Maizière fühle sich in Bezug auf das Kirchenasyl ""teilweise falsch verstanden"" © Tobias Schwarz/AFP Photo Bundesinnenminister Thomas de Maizière (CDU) hat in der Diskussion um das Kirchenasyl eingelenkt. ""Den Scharia-Vergleich möchte ich zurücknehmen"", sagte de Maizière der Zeitung ""Welt"". Er wolle ""verbal abrüsten, wie es ein Kirchenvertreter formuliert hat"". Allerdings betonte der Minister, dass er sich in Bezug auf das Kirchenasyl ""teilweise falsch verstanden"" fühle. In einem Interview Anfang Februar hatte de Maizière den Kirchen vorgeworfen, sich mit dem Kirchenasyl über geltendes Recht zu stellen. Dabei hatte er einen Vergleich zu einer Paralleljustiz durch islamisches Scharia-Recht gezogen. Beim Kirchenasyl nehmen Kirchengemeinden Asylbewerber, denen die Abschiebung droht, für einen begrenzten Zeitraum in ihren Gebäuden auf. Dadurch soll Zeit für eine Wiederaufnahme oder Überprüfung des Asylantrags gewonnen werden. De Maizière erklärte nun, dass das Kirchenasyl ""in einigen Härtefällen"" hinzunehmen sei. Wenn die Kirchen ""solche Fälle wieder in ein rechtliches Verfahren eingliedern"", fände er das in Ordnung. Unter diesen Bedingungen habe er nicht die Absicht, das Kirchenasyl zu beenden, sagte der Minister. Dennoch hielt er an seiner Kritik fest. Die Zahlen sprächen dafür, dass eine bestimmte Rechtslage in Europa ""systematisch"" abgelehnt werde und dass gesetzliche Fristen bewusst ignoriert würden. Das sei ""inakzeptabel"". Beurteilung politischer Zustände obliege nicht der Kirche Als Verfassungsminister und Christ würde er begrüßen, dass sich die Kirchen von einer solchen Art des Kirchenasyls distanzierten. De Maizière fügte hinzu, dass die Beurteilung der politischen Zustände etwa in Italien oder Ungarn dem Staat und seinen Gerichten, nicht aber der Kirche obliege. Zu seiner persönlichen Haltung in dem Streit sagte der Minister, dass ""zwei Herzen in seiner Brust schlagen"". Für seinen Scharia-Vergleich war de Maizière von der Opposition, aber auch innerhalb der Regierungskoalition kritisiert worden. Ein Sprecher des Bundesinnenministeriums verwies darauf, dass es bereits Gespräche mit den Kirchen gebe. Diese verliefen ""sehr konstruktiv"". and/AFP/AFP "	99	True
103	Pegida	9	563	welt.de	DIE WELT	Braunschweig erwägt Demonstrationsverbot für Pegida		article	http://img.welt.de/img/niedersachsen/crop137791746/8676931853-ci3x2l-w900/urn-newsml-dpa-com-20090101-150224-99-07605-large-4-3.jpg	http://www.welt.de/regionales/niedersachsen/article137791747/Braunschweig-erwaegt-Demonstrationsverbot-fuer-Pegida.html	Braunschweig erwägt Demonstrationsverbot für Pegida Artikel per E-Mail empfehlen Braunschweig erwägt Demonstrationsverbot für Pegida Empfänger E-Mail Tipp: mehrere E-Mailadressen mit Komma      trennen persönliche Nachrichtoptional 	103	True
104	Pegida	9	469	spiegel.de	SPIEGEL ONLINE	Werbekampagne für arabischen Sponsor: Real Madrid nimmt Kreuz aus dem Wappen - SPIEGEL ONLINE	Die Galaktischen gehen eine Partnerschaft mit einer arabischen Bank ein - und opfern für eine Werbekampagne die christliche Symbolik im Vereinswappen von Real Madrid. Es ist nicht das erste Mal.	article	http://cdn2.spiegel.de/images/image-782009-galleryV9-xwau-782009.jpg	http://www.spiegel.de/sport/fussball/fussball-real-madrid-entfernt-fuer-bank-kreuz-aus-dem-wappen-a-1005268.html	"Die kostenlose Fußball-App für Ihr Android Phone! Jetzt herunterladen! Hamburg - Fußballvereine gehen weit, wenn es darum geht, Sponsoren zu gewinnen und neue Einnahmequellen zu erschließen. Stadionnamen werden verkauft, Eckbälle und Auswechslungen werden von Versicherungen oder Supermarktketten präsentiert. Real Madrid geht noch einen Schritt weiter: Der Champions-League-Sieger ändert für eine Sponsoren-Aktion sein Vereinswappen, offenbar dem Werbepartner zuliebe. Die Madrilenen haben gerade einen Dreijahresvertrag mit der National Bank of Abu Dhabi abgeschlossen. Klubchef Florentino Perez spricht von einer ""strategischen Allianz mit einer der prestigeträchtigsten Institutionen der Welt"". Bei der Verkündung der Partnerschaft waren Topspieler wie Gareth Bale, Karim Benzema und Toni Kroos dabei, unter anderem stellte die Bank eine Real-Madrid-Kreditkarte vor. Darauf ist das Wappen zu sehen, und bei genauem Hinsehen fällt ein Detail auf. Beziehungsweise: Es fällt nicht mehr auf. Es fehlt das kleine Kreuz, das eigentlich auf der Krone in Reals Wappen platziert ist. Die Sportzeitung Marca vermutet , dass der Verein das christliche Symbol aus Rücksicht auf die Gefühle der muslimischen Bankkunden änderte. Zu den Spielen in der Liga und der Champions League treten die Madrilenen weiter mit ihrem Originalwappen an. Real bricht sich nicht zum ersten Mal ein Kreuz aus der Krone: Als der Verein vor zwei Jahren die Pläne für das ""Real Madrid Resort Island"" vorstellte , eine Art Fußball-Vergnügungspark, wurde das christliche Symbol ebenfalls geopfert - denn das Milliardenprojekt, das schließlich doch nicht umgesetzt wurde, sollte in den Vereinigten Arabischen Emiraten entstehen. buc "	104	True
106	Pegida	9	469	welt.de	DIE WELT	Wenn die Fußballkabine zur Moschee wird	Seit dem Anschlag auf Charlie Hebdo tobt in Frankreichs Fußball eine Islamdebatte. Nicht jeder Spieler mochte sich vom schrecklichen Terror distanzieren. Auch im Nationalteam gibt es große Probleme.	article	http://img.welt.de/img/sport/crop137668832/2716935413-ci3x2l-w900/Fussball-FC-Bayern-Muenchen-Hannover-96-24032012.jpg	http://www.welt.de/sport/fussball/article137668834/Wenn-die-Fussballkabine-zur-Moschee-wird.html	"Von Adrian Lobe Foto: picture alliance / GES-Sportfoto Franck Ribéry vom FC Bayern zählt zu den gläubigen Muslimen im französischen Nationalteam Nach den Terroranschlägen auf die Satirezeitschrift ""Charlie Hebdo"" in Paris ging eine beispiellose Solidaritätswelle um die Welt. Fußballspieler trugen Trikots mit der Aufschrift ""Nous sommes tous Charlies"". Doch einige französische Kicker wollten sich der Bewegung nicht anschließen, nicht einmal alle Nationalspieler. Frankreichs Fußball und der Islam: Die Integrationsdebatte wird auch in den Stadien geführt – und die Ergebnisse sind zum Teil erschreckend. Der Torhüter des FC Toulouse, Ali Ahamada, weigerte sich, eine schwarze Binde zu tragen. Drei Spieler des FC Valenciennes strichen den Slogan ""Je suis Charlie"" kurzerhand von ihren Trikots. Dabei handelt es sich um keine Petitesse. Der Fall wirft ein Schlaglicht auf das Verhältnis zwischen Religion und Fußball in Frankreich. ""Sind sie nicht alle Charlie?"", fragt die Sportzeitschrift ""L'Equipe"". Der Fall wächst zu einer veritablen Affäre, der Präsident des FC Toulouse entschuldigte sich gar öffentlich. 80 Prozent der französischen Fußballspieler, so schreibt der Journalist Daniel Riolo in seinem Buch ""Racaille Football Club"", kommen aus der Banlieue. Franck Ribéry stammt aus einem Armenviertel in Boulogne-sur-Mer, Karim Benzema wuchs in einer Trabantensiedlung vor den Toren Lyons auf, und Frankreichs WM-Held Zinédine Zidane stammt aus dem Armenviertel La Citadelle in Marseille. Der WM-Titel im eigenen Land 1998 wurde als Erfolg der Integration verklärt, das Modell ""black-blanc-beur"" (black für Schwarzafrikaner, blanc für Franzosen, beur für Nordafrikaner) sollte Schule machen. Doch das Konzept erwies sich schnell als Illusion. 2005 brannten die Vorstädte, das Land war in Aufruhr. 2010 kam es beim Freundschaftsspiel zwischen Frankreich und Algerien im Stade de France zum Eklat, weil algerische Fans bei der Marseillaise pfiffen. Frankreich spielte zu Hause auswärts, kommentierte Autor Riolo. Wenig später meuterte das Team im Trainingslager bei der WM in Südafrika. Eine Posse jagte die nächste. ""Wenn ich treffe, bin ich Franzose, wenn nicht, bin ich Araber"" Die Equipe Tricolore diente als Projektionsfläche für nationale Identität, und nur so sind die Debatten zu verstehen. Wenn Karim Benzema die Nationalhymne nicht mitsingt, ist das in Frankreich ein Politikum. ""Wenn ich treffe, bin ich Franzose, wenn ich nicht treffe, bin ich Araber"", sagte Benzema. Der Stürmer hat nie einen Hehl daraus gemacht, dass er sich im Herzen als Araber fühlt. Foto: dpa Karim Benzema (l.) gewann gerade mit Real Madrid in der Champions League 2:0 bei Schalke 04 In der französischen Nationalmannschaft zeigt sich das Integrationsproblem wie unter einem Brennglas. 2008 forderte der französische Nationalspieler Eric Abidal, dass die Speisen in der Vorbereitung ""halal"" sein sollten – also frei von Blut, Schweinefleisch, Schweinefett und Alkohol. Der wankelmütige Nationaltrainer Raymond Domenech gab dem Druck nach und verordnete im Trainingscamp von Clairefontaine ein Halal-Menü. Die Nation grollte. Die Fußballelite eines streng laizistischen Landes machte sich religiöse Insignien zu eigen – und dann auch noch die des Islam. In der Umkleidekabine wurden Gebetsteppiche ausgerollt. WM-Torhüter Fabien Barthez sagte: ""Wenn man in die Umkleidekabine kam, glaubte man sich in einer Moschee."" Der Soziologe Gilles Kepel warnte vor einer ""Halalisierung"" der Nationalmannschaft. Im aktuellen Kader der Equipe Tricolore stehen vier Muslime: Karim Benzema, Paul Pogba, Moussa Sissoko und Bacary Sagna. Bei der WM 2014, die mit dem Ramadan zusammenfiel, fragten besorgte Beobachter, ob die fastenden Fußballer überhaupt noch leistungsfähig seien. Im Sport stellte sich plötzlich die brisante Frage, die in der Politik mit rhetorischer Finesse beiseitegeschoben wird: Gehört der Islam zu Frankreich? Anelkas umgekehrter Hitlergruß Fußballer sind Vorbilder. Und da zählt jede Symbolik. Bilal Yusuf Mohammed alias Franck Ribéry konvertierte 2006 zum Islam und passte sich zwischenzeitlich mit einem wallenden Bart auch optisch seinen Glaubensbrüdern an. 2014 irritierte Nicolas Anelka mit der Quenelle, einem umgekehrten Hitlergruß – eine Geste, die auch der Komiker Dieudonné einsetzt. Dieudonné, der wegen Verherrlichung des Terrorismus angeklagt ist, postete nach den Terroranschlägen auf Facebook: ""Ich fühle mich wie Charlie Coulibaly."" Eine Provokation. Diese heimliche Sympathie mit den Attentätern fand in den Vorstädten Widerhall. Die Banlieue war nicht Charlie. Ribéry, Nasri und Benzema blieben seltsam stumm. Den Soziologen Stéphane Beaud überrascht das nicht. ""Fußballer sind soziale Wesen wie alle anderen auch. Diejenigen, die nicht Charlie sein wollen, haben wahrscheinlich starke religiöse Überzeugungen: Sie erkennen sich nicht in der redaktionellen Ausrichtung von, Charlie Hebdo' wieder."" Das muss nicht heißen, dass sie die Terroranschläge gutheißen. Doch Frankreichs muslimische Kicker müssen sich fragen, ob sie sich vom radikalen Islam distanzieren wollen. © WeltN24 GmbH 2016. Alle Rechte vorbehalten "	106	True
107	Pegida	9	639	youtube.com	YouTube	Wie Salafisten Kinder und Jugendliche beeinflussen	Report Mainz 09.05.2011 Radikale Prediger als Religionslehrer Wie Salafisten Kinder und Jugendliche infiltrieren Sie geben sich als streng gläubige Muslime, ...	video	https://i.ytimg.com/vi/jayYKiFaOdA/hqdefault.jpg	https://www.youtube.com/watch?v=jayYKiFaOdA		107	True
108	Pegida	9	461	youtube.com	YouTube	Egyptian President Al-Sisi at Al-Azhar: We Must Revolutionize Our Religion	In a speech delivered at Al-Azhar on December 28, 2014, Egyptian President Abd Al-Fattah Al-Sisi called to combat extremist ideology and said: We need to re...	video	https://i.ytimg.com/vi/DEhNarfrlec/hqdefault.jpg	https://www.youtube.com/watch?v=DEhNarfrlec	"Die Bewertungsfunktion ist nach Ausleihen des Videos verfügbar. Diese Funktion ist zurzeit nicht verfügbar. Bitte versuche es später erneut. Veröffentlicht am 05.01.2015 In a speech delivered at Al-Azhar on December 28, 2014, Egyptian President Abd Al-Fattah Al-Sisi called to combat extremist ideology and said: ""We need to revolutionize our religion."" Calling for ""religious discourse that is in keeping with its times,"" Al-Sisi warned that ""the Islamic nation is being torn apart and destroyed"" by extremism. Kategorie "	108	True
