line	page	week	num_likes	domain	outlet	title	description	contenttype	image	url	text	id	right_of_center
1994	DieGruenen	1	1	change.org	Change.org	Deutscher Bundestag, Bundesrat Schweiz, parlament österreich: Das Zünden von Feuerwerk und Böllern von Privatpersonen muss ganzjährig verboten werden.	Das Zünden von Feuerwerk und Böllern  ist eine unnötige Umweltverschmutzung mit Dreck und Lärm, welche viele Haustiere und Tiere aus der Natur erschreckt und die Luft unnötig verdreckt und Schäden in Millionenhöhe verursacht.   Die sozialen Kosten sind enorm: Rettungskräfte, Krankenhauspersonal und...	change-org:petition	http://d22r54gnmuhwmk.cloudfront.net/public/img/default-petition-UKz-6DKUCXnjvUBmkiKnAViIRewclvahOWrjSixAEM0.gif	https://www.change.org/p/deutscher-bundestag-bundesrat-schweiz-parlament-österreich-das-zünden-von-feuerwerk-und-böllern-von-privatpersonen-muss-ganzjährig-verboten-werden	Liebe Change.org-Nutzerinnen und -Nutzer, wir setzen auf Change.org Cookies ein, um Ihnen möglichst viele interessante Inhalte anzuzeigen. Weitere Informationen. OK, das habe ich verstanden Zum Hauptinhalt wechseln 	1994	False
1996	DieGruenen	1	0	berliner-zeitung.de	Berliner Zeitung	Lärm aus Moschee ärgerte die Eigentümergemeinschaft: Cem Özdemir klagt Kurden aus seinem Wohnhaus	Zwischen dem Moschee-Verein Selahaddin, der die einzige kurdische Moschee in Berlin an der Kottbusser Straße betreibt, und dem Grünen-Politiker Cem Özdemir gibt es Streit. Der designierte Chef der Bundesgrünen und Europa-Politiker will gemeinsam mit den anderen Eigentümern der neun Wohnungen im Haus die Moschee samt einem Café nicht länger dulden. Hauptgrund ist, dass die Gebetsrufe im ganzen Haus zu hören sind und dass die Moschee beim Verfassungsschutz als PKK-nah gilt.Bereits Mitte September hat Özdemir mit den anderen Eigentümern eine Räumungsklage erfolgreich vor Gericht durchgesetzt. Demnach muss der Moschee-Verein als einziger Mieter im Haus die Räume bis Ende März kommenden Jahres aufgeben. Auch das Café soll bis dahin geräumt werden. Die Auseinandersetzung zwischen den Eigentümern und den kurdischen Mietern dauert bereits zwei Jahre. Zuletzt hatten die Eigentümer Unterschriften gesammelt. Özdemir hat vor etwa drei Jahren eine Dachgeschosswohnung in dem ehemals besetzten Haus gekauft und war dort mit Frau und Kind vergangenes Jahr eingezogen.Mit Knüppeln gegen ÖzdemirDer Politiker steht als Europa-Abgeordneter seit längerem unter Polizeischutz. Nachdem aufgebrachte Kurden versucht hatten, am 28. Oktober vergangenen Jahres seine Wohnung zu stürmen, ist der Schutz verstärkt worden. Damals war nach einer Demonstration von türkischen Nationalisten in Neukölln und Kreuzberg die Gewalt zwischen Türken und Kurden eskaliert. Türken hatten sich an jenem Abend aufgemacht, um Kurden zu klatschen.Doch auch Gruppen von Kurden waren zum Teil mit Knüppeln bewaffnet unterwegs, um Türken zu verprügeln. Nur knapp konnten Polizisten damals verhindern, dass auch Özdemirs Wohnung gestürmt wurde. Seitdem seien Objektschützer und Zivilbeamte verstärkt an der Wohnung präsent, heißt es aus der Polizei.Die Mieter der Moschee sind die Auseinandersetzung inzwischen leid. So schnell wie möglich wollen die gläubigen kurdischen Muslime einen neuen Platz für ihr Gotteshaus finden. Als neuer Standort ist das Gelände eines alten Fabrikgebäudes in der Kreuzberger Bopp- straße 10 im Gespräch. Der Makler hat sich bereits am Montag mit Gemeindevertretern getroffen.Zu voll und zu lautDie alten Räume in der Kottbusser Straße sind nicht günstig. Es ist ständig bei Gottesdiensten - nicht nur wie gestern beim Zuckerfest - zu voll und zu laut, sagt Riza Baran von der Kurdisch-Demokratischen Gemeinde. Die Selahaddin-Eyyubi-Moschee befindet sich seit 13 Jahren in einem ganz normalen Altbau, direkt oberhalb eines Cafés, das viele Kurden besuchen. Baran ist über einen möglichen Auszug nicht unzufrieden: Mir liegt daran, dass der Konflikt bald vorbei ist. Vor allem aber will das Vorstandsmitglied der kurdischen Gemeinde, dass in dem Zusammenhang nicht ständig politisiert wird. In einem Gastbeitrag bei spiegel online hatte Cem Özdemir schon vor fast zwei Jahren die Moschee quasi als Domizil der in Deutschland als terroristisch verbotenen Organisation PKK bezeichnet. Dies scheine in Berlin niemanden so richtig zu stören - auch nicht die Polizei und die Behörden, hieß es in dem Beitrag. Sein Büro teilte gestern mit, dass Özdemir derzeit zu dem Konflikt mit dem Moschee-Verein keine Stellungnahmen mehr abgeben möchte.Der Linken-Abgeordnete Giyasettin Sayan, selbst kurdischer Herkunft, weist die PKK-Vorwürfe empört zurück. In Berlin gebe es für die schätzungsweise 60 000 Kurden 17 Vereine. In vielen seien vereinzelt PKK-Anhänger anzutreffen, aber noch deutlich mehr Leute, die gläubige Muslime seien beziehungsweise für demokratische Rechte eintreten würden. Nur ganz wenigen Vereinen könne man eine generelle PKK-Nähe nachsagen. Der Moschee-Verein mit einem ganz liberalen Imam gehört definitiv nicht dazu, so Sayan. Der Moschee-Verein soll jedoch, wie es heißt, vom Verfassungsschutz beobachtet werden.------------------------------Foto: Cem Özdemir, Europa-Abgeordneter der Grünen, ärgert sich über laute ...	article	http://mobil.berliner-zeitung.de/assets/1466775127/Sh/desktop/img/berliner-zeitung/logo.png	http://www.berliner-zeitung.de/laerm-aus-moschee-aergerte-die-eigentuemergemeinschaft-cem-oezdemir-klagt-kurden-aus-seinem-wohnhaus-15706260	"Lärm aus Moschee ärgerte die Eigentümergemeinschaft: Cem Özdemir klagt Kurden aus seinem Wohnhaus 01.10.08, 00:00 Uhr Von Marlies Emmerich, Andreas Kopietz Zwischen dem Moschee-Verein Selahaddin, der die einzige kurdische Moschee in Berlin an der Kottbusser Straße betreibt, und dem Grünen-Politiker Cem Özdemir gibt es Streit. Der designierte Chef der Bundesgrünen und Europa-Politiker will gemeinsam mit den anderen Eigentümern der neun Wohnungen im Haus die Moschee samt einem Café nicht länger dulden. Hauptgrund ist, dass die Gebetsrufe im ganzen Haus zu hören sind und dass die Moschee beim Verfassungsschutz als PKK-nah gilt.Bereits Mitte September hat Özdemir mit den anderen Eigentümern eine Räumungsklage erfolgreich vor Gericht durchgesetzt. Demnach muss der Moschee-Verein als einziger Mieter im Haus die Räume bis Ende März kommenden Jahres aufgeben. Auch das Café soll bis dahin geräumt werden. Die Auseinandersetzung zwischen den Eigentümern und den kurdischen Mietern dauert bereits zwei Jahre. Zuletzt hatten die Eigentümer Unterschriften gesammelt. Özdemir hat vor etwa drei Jahren eine Dachgeschosswohnung in dem ehemals besetzten Haus gekauft und war dort mit Frau und Kind vergangenes Jahr eingezogen.Mit Knüppeln gegen ÖzdemirDer Politiker steht als Europa-Abgeordneter seit längerem unter Polizeischutz. Nachdem aufgebrachte Kurden versucht hatten, am 28. Oktober vergangenen Jahres seine Wohnung zu stürmen, ist der Schutz verstärkt worden. Damals war nach einer Demonstration von türkischen Nationalisten in Neukölln und Kreuzberg die Gewalt zwischen Türken und Kurden eskaliert. Türken hatten sich an jenem Abend aufgemacht, um ""Kurden zu klatschen"".Doch auch Gruppen von Kurden waren zum Teil mit Knüppeln bewaffnet unterwegs, um Türken zu verprügeln. Nur knapp konnten Polizisten damals verhindern, dass auch Özdemirs Wohnung gestürmt wurde. Seitdem seien Objektschützer und Zivilbeamte verstärkt an der Wohnung präsent, heißt es aus der Polizei.Die Mieter der Moschee sind die Auseinandersetzung inzwischen leid. So schnell wie möglich wollen die gläubigen kurdischen Muslime einen neuen Platz für ihr Gotteshaus finden. Als neuer Standort ist das Gelände eines alten Fabrikgebäudes in der Kreuzberger Bopp- straße 10 im Gespräch. Der Makler hat sich bereits am Montag mit Gemeindevertretern getroffen.Zu voll und zu laut""Die alten Räume in der Kottbusser Straße sind nicht günstig. Es ist ständig bei Gottesdiensten - nicht nur wie gestern beim Zuckerfest - zu voll und zu laut"", sagt Riza Baran von der Kurdisch-Demokratischen Gemeinde. Die Selahaddin-Eyyubi-Moschee befindet sich seit 13 Jahren in einem ganz normalen Altbau, direkt oberhalb eines Cafés, das viele Kurden besuchen. Baran ist über einen möglichen Auszug nicht unzufrieden: ""Mir liegt daran, dass der Konflikt bald vorbei ist."" Vor allem aber will das Vorstandsmitglied der kurdischen Gemeinde, dass in dem Zusammenhang nicht ständig politisiert wird. In einem Gastbeitrag bei ""spiegel online"" hatte Cem Özdemir schon vor fast zwei Jahren die Moschee ""quasi als Domizil der in Deutschland als terroristisch verbotenen Organisation PKK"" bezeichnet. Dies scheine in Berlin niemanden so richtig zu stören - ""auch nicht die Polizei und die Behörden"", hieß es in dem Beitrag. Sein Büro teilte gestern mit, dass Özdemir derzeit zu dem Konflikt mit dem Moschee-Verein keine Stellungnahmen mehr abgeben möchte.Der Linken-Abgeordnete Giyasettin Sayan, selbst kurdischer Herkunft, weist die PKK-Vorwürfe empört zurück. In Berlin gebe es für die schätzungsweise 60 000 Kurden 17 Vereine. In vielen seien vereinzelt PKK-Anhänger anzutreffen, aber noch deutlich mehr Leute, die gläubige Muslime seien beziehungsweise für demokratische Rechte eintreten würden. Nur ganz wenigen Vereinen könne man eine generelle PKK-Nähe nachsagen. ""Der Moschee-Verein mit einem ganz liberalen Imam gehört definitiv nicht dazu"", so Sayan. Der Moschee-Verein soll jedoch, wie es heißt, vom Verfassungsschutz beobachtet werden.------------------------------Foto: Cem Özdemir, Europa-Abgeordneter der Grünen, ärgert sich über laute Moschee-Besucher. Kommentare "	1996	False
1998	DieGruenen	1	0	youtube.com	YouTube	Pegida-Demo: Demonstranten im Interview am 15.12.2014	In Bonn trafen sich am 15.12.2014 Demonstranten der islamfeindlichen Gruppierung Bogida (Bonn gegen Islamismus in Deutschland und im Abendland), einem Able...	video	https://i.ytimg.com/vi/MYwtc3XoMb8/maxresdefault.jpg	https://www.youtube.com/watch?v=MYwtc3XoMb8	Möchtest du dieses Video später noch einmal ansehen? Wenn du bei YouTube angemeldet bist, kannst du dieses Video zu einer Playlist hinzufügen. 	1998	False
3581	CDU	1	366	welt.de	DIE WELT	Der Mythos vom Linksruck der CDU	Ein Grund für den Erfolg von Pegida soll sein, dass sich die CDU nach links bewegt habe. Das ist Unsinn, wie ein Blick auf zehn Politikfelder zeigt, meint CDU-Vize <i>Armin Laschet</i>.	article	http://img.welt.de/img/kommentare/crop135995172/656693618-ci3x2l-w900/CDU-Bundesparteitag-Koeln-2-.jpg	http://www.welt.de/debatte/kommentare/article135995173/Der-Mythos-vom-Linksruck-der-CDU.html	"Twittern Von Armin Laschet Foto: dpa Der Autor: Armin Laschet (r.) ist stellvertretender CDU-Bundesvorsitzender sowie Landes- und Fraktionschef der CDU in NRW. Neben ihm Bundeskanzlerin Angela Merkel und CDU-Generalsekretär Peter Tauber ""Die CDU ist nach links gerückt."" So lautet eine der gängigen Allround-Erklärungen, die passend oder nicht von Hobby-Politologen vorgetragen werden. Nun auch noch der frühere Bundesminister Hans-Peter Friedrich, der die Bundeskanzlerin für Pegida verantwortlich macht. Das klingt fast wie der Sommerhit von Rudi Carrell aus den 70er-Jahren: ""Mein Milchmann sagt, dies Klima hier, wen wundert's, denn Schuld daran ist nur die SPD."" In die Demonstrationen von Dresden wird inzwischen alles Mögliche hineininterpretiert. Dabei wäre es doch für die vermeintlichen Retter des christlichen Abendlandes ein guter Start ins neue Jahr, sich dort, wo 80 Prozent der Menschen keiner Religion mehr angehören, selbst zu einer christlichen Kirche zu bekennen – statt fast gotteslästerlich schwarz-rot-gelbe Kreuze durch die Stadt zu tragen. Das christliche Abendland hat sich eben gerade nicht national, sondern durch Werte definiert. Statt sich mit diesen Widersprüchen von Pegida auseinanderzusetzen, sucht Friedrich den Gegner nun in der eigenen Schwesterpartei. Sancta simplicitas! Wo also soll der Linksruck der CDU stattgefunden haben? Ein Lackmustest zu zehn gängigen Stichworten hilft, Mythos und Wirklichkeit zu unterscheiden. Europa Die europäische Integration gehört zum Markenkern der Union seit Konrad Adenauer. Damals galten die Vereinigten Staaten von Europa als visionär, heute sind sie ein wirtschaftspolitisches Gebot. Binnenmarkt und gemeinsame Währung, von Kohl und Waigel durchgesetzt, sind mittlerweile eine Voraussetzung für unseren Wohlstand und die Sicherung unseres Gesellschaftsmodells in der Welt von heute. Wir brauchen mehr Europa: in der Außen- und Sicherheitspolitik, bei der Kriminalitätsbekämpfung, bei der Schaffung eines gemeinsamen Energiemarkts, im Wettbewerb mit den USA auf dem Felde der Digitalisierung. Nationale Interessen wahrnehmen in einer globalisierten Welt heißt die Einigung Europas vorantreiben. Wo ist der Linksruck? Wirtschaft Die Union kämpft dafür, dass die auf Export ausgerichtete deutsche Wirtschaft weiterhin floriert, auch, indem sie sich wie keine andere Partei klipp und klar für das Freihandelsabkommen mit den USA (TTIP) einsetzt. Wir wollen unsere Werte und Standards durchsetzen. Die politische Linke pflegt im Kampf gegen TTIP derweil ihren Antiamerikanismus. In puncto Russlandfreundlichkeit wird sie dabei nur von der AfD übertroffen. Links- und Rechtspopulisten treffen sich auf den gleichen Demonstrationen. Wer ist hier ""links""? Haushaltspolitik Die Union macht Schluss mit der Neuverschuldungsorgie. Nach 45 Jahren kommt der Staat 2015 erstmals wieder mit dem aus, was er einnimmt – eine Kernforderung konservativer Politik. Wo ist hier der Linksruck? Wer das rot-grüne Gegenmodell erleben will, sollte nach Nordrhein-Westfalen kommen: In Zeiten sprudelnder Steuereinnahmen und historischer Niedrigzinsen wurden 2014 knapp drei Milliarden neue Schulden aufgenommen und die Steuern erhöht. Steuerpolitik Die Union hat nach der Bundestagswahl die Steuererhöhungen verhindert, die alle linken Parteien planten. Linksruck? Energiepolitik Hier ist Kritik an der Bundesregierung in der Tat berechtigt. Trotz der sinnvollen Revision des Erneuerbare-Energien-Gesetzes (EEG) und der Begrenzung der Strompreisexplosion, die mit der FDP nicht gelungen ist, droht dennoch die derzeitige Energiepolitik der Wettbewerbsfähigkeit der deutschen Industrie zu schaden. Dagegen kämpfen wir als CDU im Industrieland Nordrhein-Westfalen. Den Mythos Linksruck nun aber mit dem Ausstieg aus der Kernenergie zu begründen wirkt etwas geschichtsvergessen. War es nicht der CSU-Chef, der nach Fukushima als Erster einen schnellen Atomausstieg forderte? Ist das der Linksruck, den Friedrich nun beklagt? Wehrpflicht Ihre Aussetzung setzte die damalige Leuchtfigur Freiherr zu Guttenberg durch. Hat ihm Friedrich als sein Nachfolger im Amt des Bundesministers und des oberfränkischen Bezirksvorsitzenden je einen Linksruck unterstellt? Nein. Wahrscheinlich teilt er einfach dessen Einschätzung, dass eine veränderte geopolitische Lage neue Antworten verlangt. Die Forderung nach einer Rückkehr zur Wehrpflicht ist selbst von der AfD nicht zu vernehmen. Linksruck? Familienpolitik Die Anerkennung von Kindererziehungszeiten in der Rentenversicherung und die Verbesserungen in der Mütterrente gehen ebenso auf die Union zurück wie das Betreuungsgeld, das Elterngeld und der Rechtsanspruch auf einen Kita-Platz. All das stärkt Familien. Und: Was ist hier ""links"" und was ""rechts""? Im Brandenburger Wahlkampf lobte die AfD die Krippen in der ehemaligen DDR. Wer steht hier links? Zuwanderungspolitik Es gehört zu den Erfolgen des damaligen Innenministers Friedrich, dass er mit Blick auf den drohenden Fachkräftemangel qualifizierte Zuwanderung erleichtert hat. Die Gewerkschaften sahen das stets distanzierter als die Arbeitgeberverbände. Ist das vielleicht der Linksruck? Doppelte Staatsbürgerschaft Die Abschaffung des komplizierten Optionsmodells für in Deutschland nach dem Jahr 2000 geborene Kinder gehörte nicht zum Wahlprogramm der Union, aber sie dem Unions-Verhandlungsführer in der Arbeitsgruppe Innen – Minister Friedrich – anzulasten ist genauso absurd, wie die Rente mit 63 oder den Mindestlohn in seiner jetzigen Form der CDU anzuhängen. Koalitionskompromisse sind kein Linksruck, sondern Folge des Wählervotums. Hier muss man Friedrich vor sich selbst in Schutz nehmen. Eine generelle doppelte Staatsbürgerschaft gilt bis heute nicht. Wo ist der Linksruck der CDU? Asyl- und Flüchtlingspolitik Gegen den Widerstand von Grünen und Linken hat die große Koalition die Demokratien des Balkans, aus denen 40 Prozent aller Asylbewerber kommen, zu sicheren Herkunftsländern bestimmt. Das kürzt – ganz im Sinne der aktuellen Forderung der CSU – die Verfahren und schafft Ressourcen, um denen zu helfen, die vor Krieg und Verfolgung fliehen. Flüchtlingen, auch muslimischen, beizustehen, die vor dem IS-Terror fliehen, folgt dem christlichen Menschenbild, dem die Union besonders verpflichtet ist. Das deutsche Handwerk fordert zudem schnelle Deutschkurse und ein Bleiberecht für junge Flüchtlinge in Ausbildung. Ist es links, wenn CDU und CSU sich die Forderungen des Mittelstands zu eigen machen? Adenauer und Kohl haben größere Proteste ausgehalten Politik darf nicht konjunkturabhängig werden – das gilt für die Konjunktur des Nachrichtenmarktes, der Umfragen und auch der sogenannten Straße. Wenn in Dresden einige Tausend auf die Straße gehen, ist das kein Grund, den Kurs zu ändern. Adenauer, Strauß und Kohl haben ganz andere Demonstrationen erlebt. Aber sie sind standhaft geblieben. Wir müssen mutig dagegen vorgehen, wenn linke und rechte Populisten Sorgen und Ängste von Menschen missbrauchen. Dieser Aufgabe haben sich bisher alle Parteien verschrieben, die das Prädikat ""bürgerlich"" verdienen. Bürgerliche Politik entscheidet aus Grundsätzen und handelt pragmatisch. Für diese Klarheit erhielt die Union bei der Bundestagswahl fast die absolute Mehrheit und liegt seither bei Umfragen kontinuierlich über 40 Prozent. Nun an einer absoluten Mehrheit gegen Rot-Rot-Grün zu arbeiten, wie dies Horst Seehofer vorschlägt, ist klug. Der erste Schritt wäre, vom ""Mythos Linksruck"" Abschied zu nehmen. © WeltN24 GmbH 2016. Alle Rechte vorbehalten "	3581	True
3583	CDU	1	131	bild.de	BILD.de	Gesundheitsminister Hermann Gröhe über Kassenwechsel und den „Internet-Arzt	Bundesgesundheitsminister im großen BILD-Interview. Wann lohnt sich der Kassenwechsel und wie gut ist das Internet als Arzt.	article	http://bilder.bild.de/fotos/bild-logo-35166394/Bild/29.bild.png	http://www.bild.de/politik/inland/hermann-groehe/internet-ersetzt-arzt-nicht-39167424.bild.html	Geänderte Zusatzbeiträge Der große Kranken-Kassen-Check BILD: Was ändert sich für Demenzkranke? Gröhe: Demenzkranke in der Pflegestufe 0, die zu Hause gepflegt werden, haben jetzt erstmals Anspruch auf alle Leistungen, die auch Pflegebedürftigen mit körperlichen Einschränkungen zustehen. In einem zweiten Schritt werden wir die Pflegeeinstufung verbessern. Über die Leistungshöhe entscheidet dann, was jemand noch selbst kann und wo er Unterstützung braucht – unabhängig, ob durch Demenz oder körperliche Einschränkung. Die Vorarbeiten dazu laufen schon. BILD: Bei den Arbeitsbedingungen in der Pflege: Können Sie noch empfehlen, den Pflegeberuf zu ergreifen? Gröhe: Ja. Der Pflegeberuf ist ein fordernder, aber auch schöner Beruf. Und das wird auch erkannt. Im vergangenen Jahr hatten wir einen Ausbildungsrekord in der Pflege. Die Zahl derjenigen, die sich für eine Altenpflegeausbildung entschieden haben, ist um mehr als 14 Prozent gestiegen. Das ist ein gutes Zeichen. BILD: Was tun Sie für Pflegekräfte? Gröhe: Wir helfen, dass Pflegekräfte mehr Zeit für die Pflege haben. Durch die Pflegereform wird die Zahl der Betreuungskräfte in den Heimen fast verdoppelt. Das entlastet auch die Pflegekräfte. Und wir räumen mit der Pflege-Bürokratie auf, vereinfachen die Dokumentation. Außerdem stärken wir die Pflegeeinrichtungen, damit sie Pflegekräfte nach Tarif bezahlen können. BILD: Zum neuen Jahr starten Sie eine Beratung übers Internet, mit der man sich Pflegeleistungen zusammenstellen kann. Was steckt dahinter? Gröhe: Gute Pflege sollte möglichst individuell sein. Deshalb schaffen wir mit der Pflegereform mehr und bedarfsgerechte Wahlmöglichkeiten. Darüber informiert der Pflegeleistungs-Helfer. BILD: Wie? Gröhe: Durch einen Fragenkatalog wird ermittelt, welche Leistungen in der konkreten Pflegesituation passen und wie verschiedene Leistungen kombiniert werden können. Auf dieser Grundlage können sich Pflegebedürftige und ihre Angehörigen dann gezielt bei der Pflegeberatung oder bei ihrer Pflegekasse beraten lassen. Bundesgesundheitsminister Hermann Gröhe Ich bin verantwortlich für Ihre Gesundheit Gröhe ist Kassenpatient und treibt zu wenig Sport. Der neue Bundesgesundheitsminister im Interview. BILD: Da wir gerade über Internet-Angebote sprechen. Es drängen immer mehr Gesundheits-Apps auf den Markt. Patienten suchen Antworten im Netz und nicht beim Arzt. Ist das gefährlich? Gröhe: Gegen den informierten Patienten spricht erst einmal nichts. Aber den Arztbesuch kann der Klick im Internet nicht ersetzen. Es gibt manche Gesundheits-Apps, die helfen, sich zu orientieren. Andere sind eher Geschäftemacherei. Hier gibt es wachsenden Informationsbedarf. BILD: Der durchschnittliche Beitragssatz der gesetzlichen Krankenkassen hat sich über die letzten Jahre kaum verändert. Jetzt beschließen Sie Gesetze, die viel kosten. Und langsam zehren steigende Honorare und der Kostenanstieg im Gesundheitswesen die Kassenreserven auf. Müssen wir bald mit Beitragssatzsteigerungen auf breiter Front rechnen? Gröhe: Für Spekulationen ist es jetzt zu früh. Fest steht aber: In einer älter werdenden Gesellschaft und mit steigendem medizinischen Fortschritt werden auch die Gesundheitskosten eher zunehmen. Und Verbesserungen, z.B. in der Hospizarbeit, sind ja auch im Sinne der Versicherten. Umso wichtiger ist es aber auch, durch Wettbewerb, Sparsamkeit und sichere Arbeitsplätze die Beitragsentwicklung in Schach zu halten. 	3583	True
4180	AfD	1	2	youtube.com	YouTube	Libertarismus - Die Dokumentation	Was ist Libertarismus? Warum hat es der Libertarismus so schwer in Deutschland? Warum ist der Libertarismus sozial? Wer sind die bekanntesten Denker? Welche ...	video	https://i.ytimg.com/vi/syySw99NcS4/hqdefault.jpg	https://www.youtube.com/watch?v=syySw99NcS4&list=PL5qusMCqBdTsKBYnJGDpQ6HCsUlG08ksV	Möchtest du dieses Video später noch einmal ansehen? Wenn du bei YouTube angemeldet bist, kannst du dieses Video zu einer Playlist hinzufügen. 	4180	True
4181	AfD	1	0	bild.de	BILD.de	Gottesdienst: Christen sollen muslimische Lieder singen	Als Zeichen des friedlichen Zusammenlebens: Christen sollen in den Weihnachts-Gottesdiensten muslimische Lieder singen.	article	http://bilder.bild.de/fotos/bild-logo-35166394/Bild/29.bild.png	http://www.bild.de/politik/inland/weihnachten/weihnachts-gottesdienst-mit-muslimischen-lieder-39069240.bild.html	21.12.2014 - 23:59             Uhr Von KARINA MÖßBAUER und RALF SCHULER Es soll eine Geste des Friedens, ein Zeichen der Verständigung sein: Christen sollen in den Gottesdiensten an Heiligabend auch ein muslimisches Lied singen! Das regen Politiker und der Zentralrat der Muslime in Deutschland an. „Es wäre ein tolles Zeichen des friedlichen Zusammenlebens der Religionen , wenn in der Kirche ein islamisches Lied gesungen würde und in der Moschee ein Weihnachtslied“, sagte der Grünen-Menschenrechtsexperte Omid Nouripour (39) zu BILD. Nach Umfragen will zu Weihnachten fast jeder zweite Bundesbürger in die Kirche gehen. In der Regel werden im Gottesdienst fünf bis sechs Lieder gesungen. In Moscheen singt in der Regel nur der Imam. Die Pegida-Demonstrationen 	4181	True
