line	page	week	num_likes	domain	outlet	title	description	contenttype	image	url	text	id	right_of_center
4190	AfD	1	0	welt.de	DIE WELT	Zuwanderung – Abrechnung mit einem Mythos	Bereicherung oder Bedrohung? Ein US-Journalist hat die Geschichte der Immigration analysiert – und sieht für Deutschland und Europa dramatische Konsequenzen. Europa hat den Bedarf an Arbeitskraft von Zuwanderern überschätzt. Sie beanspruchen die Sozialsysteme mehr, als sie dazu beitragen.	article	http://img.welt.de/img/deutschland/crop101266452/3046937173-ci3x2l-w900/zuwanderung2-DW-Bayern-Berlin.jpg	http://www.welt.de/politik/deutschland/article4500301/Zuwanderung-Abrechnung-mit-einem-Mythos.html	"Von Mariam Lau Foto: dpa Auch Deutschland ist ein Zuwanderland Auf den Tag genau 45 Jahre ist es jetzt her, dass der Portugiese Armando Rodrigues de Sà mit Blumenstrauß und einem Moped – es war eine Zündapp Sport Combiette – am Bahnhof Köln-Deutz als der millionste Gastarbeiter in Deutschland begrüßt wurde. Geht es nach dem amerikanischen Journalisten Christopher Caldwell, gibt es an diesem Datum nichts zu feiern. Über zehn Jahre lang hat Caldwell die Geschichte der Zuwanderung nach Europa recherchiert, von Malmö bis Rom, von Dublin bis Duisburg, und sein Ergebnis ist finster. ""Europa hat seinen Bedarf an Arbeitskraft von Zuwanderern überschätzt. Der wirtschaftliche Nutzen, den die Zuwanderung gebracht hat, war minimal und temporär. Er ist längst Vergangenheit."" Dafür, so glaubt Caldwell, waren die sozialen und kulturellen Umwälzungen infolge der Massenimmigration massiv und dauerhaft. Die Einbindung neuer ethnischer Gruppen in Europas Gesellschaften war nicht einfach eine Addition zu dem, was da ist, sodass es nun bunter ist als vorher. Wohlfahrtsstaat ist nicht zu halten Es ist eine massive Veränderung, eine Revolution. Der Wohlfahrtsstaat ist praktisch nicht mehr zu halten; das Zusammenwachsen der EU erschwert, der Säkularismus europäischer Provenienz durch die Ankunft des Islam auf eine harte Probe gestellt. ""Kann Europa bleiben, was es ist, obwohl andere Leute darin leben?"", fragt Caldwell. Die Antwort ist Nein. Der Titel dieses beunruhigenden, provokanten und exzellent recherchierten Buchs ist angelehnt an einen Klassiker des europäischen Konservatismus: Edmund Burkes ""Reflections on the Revolution in France"". Wie Burke darin 1790 seinen tiefen Zweifeln an der Französischen Revolution Luft macht, deren abstrakte Prinzipien in seinen Augen der menschlichen Natur zuwiderlaufen, will auch Caldwell die vorgebliche Rationalität hinter der Massenimmigration nach Europa als Schimäre enthüllen. Seine Geschichte geht so: Europa war nicht ganz bei sich, als es beschloss, massiv um Zuwanderer zu werben. Es lag in Trümmern, materiell und ideell. Die Eliten der Nachkriegszeit hätten entweder gar nicht groß über die Folgen ihres Tuns nachgedacht – oder sich vollkommen verschätzt. Sie dachten, die Zuwanderer würden nicht lange bleiben (das dachten diese selbst auch), es würden nicht viele kommen, und sie würden genau in den kurzfristigen Engpass springen, der sich wegen der vielen toten Europäer aufgetan hatte. ""Niemand glaubte, sie würden jemals Anspruch auf Sozialhilfe erwerben. Dass sie die Gewohnheiten und Kulturen südländischer Dörfer, Familienclans und Moscheen beibehalten würden, erschien als völlig bizarrer Gedanke."" Falsche Annahmen zu Beginn Fast alle diese Annahmen hatten sich spätestens in den Siebzigerjahren als falsch erwiesen. Aber der Anwerbestopp, den die meisten westeuropäischen Länder dann verhängten, änderte wegen des Familiennachzugs nichts daran, dass es da mit der Zuwanderung überhaupt erst richtig losging. Wenn man den deutschen Bundesinnenminister Wolfgang Schäuble auf diese paradoxe Entwicklung anspricht, erhält man eine verblüffende Antwort. ""Wir waren nie ein Land, das aussucht"", erklärte Schäuble vergangene Woche im Gespräch mit WELT ONLINE , als ginge es um den Verlauf der deutschen Küsten oder andere Naturgegebenheiten. Warum eigentlich nicht? Und auf die Frage, wie es sein konnte, dass eine Demokratie diesen Prozess jahrzehntelang gegen den erklärten Willen der Bevölkerungsmehrheit durchgedrückt hat, hieß es: ""Je besser die Integration gelingt, desto weniger Fremdenfeindlichkeit gibt es."" Den Menschen müsse man sagen: ""Verschiedenheit ist keine Bedrohung, sondern eine Bereicherung."" Da hat Christopher Caldwell seine Zweifel. Als die Gastarbeiter kamen, war die Schwerindustrie, für die sie angeheuert wurden, schon auf dem absteigenden Ast. Die Türken, die noch in den Sechzigerjahren eine höhere Beschäftigungsquote hatten als die Deutschen, stellen heute in manchen Städten bis zu 40 Prozent der Arbeitslosen. Gastarbeiter, da seien sich alle Experten einig, sagt Caldwell, drückten die Produktivität. Italien beispielsweise hätte traditionelle Formen der Landwirtschaft nur mit billigen Zuwanderern aus Afrika und dem Mittleren Osten aufrechterhalten können. ""Unter den Bedingungen der Globalisierung hätte Italien wahrscheinlich einen Wettbewerbsvorteil, wenn es auf ein Hightech-Wirtschaftsmodell setzen würde, das vielleicht lukrativer wäre – aber eben nicht besonders 'italienisch'. Italiener könnten dagegen aufbegehren."" Büffelmozzarella aus Kampanien, kostbares Leinen aus der Normandie, Stahl aus Deutschland – ohne Arbeitskraft aus Mali, Anatolien und Algerien müsste man auf Billigersatz und seelenlose Großketten zurückgreifen. ""Alles muss sich ändern, damit es so bleiben kann, wie es ist"", zitiert Caldwell den nostalgischen Seufzer aus Giuseppe di Lampedusas ""Der Leopard"". In Deutschland hört man häufiger ein anderes Argument für die Zuwanderung, eines, das Caldwell ""sozialistisch"" nennt: Immigranten sollten den Wohlfahrtsstaat retten, indem sie die ungünstige demografische Talfahrt umkehren, auf der wir uns befinden: zu viele Alte, zu wenig Kinder. Aber die Bevölkerungsabteilung der Vereinten Nationen behauptet, dass dafür 701 Millionen Zuwanderer nötig wären, also deutlich mehr Menschen, als derzeit in Europa leben. In Deutschland ist die Zahl der zugezogenen Ausländer zwischen 1971 und 2000 um drei Millionen auf 7,5 Millionen gestiegen. Aber die Zahl der Berufstätigen aus dieser Gruppe blieb festgebacken bei zwei Millionen. 1973 waren 65 Prozent der Immigranten berufstätig, 1983 waren es nur noch 38 Prozent. Obendrein werden auch Zuwanderer alt und haben dann Anspruch auf Rentenzahlungen. Caldwell folgert: ""Immigranten beanspruchen die Sozialsysteme mehr, als sie dazu beitragen."" Caldwall hält Islam-Konferenz für naiv Eine fatale Mischung aus deutschem und europäischem Selbsthass (begründet in der Nazi-Vergangenheit, Kolonialismus, Werteverlust) und islamischer ""Hyper-Identität"" führt nach Caldwells Auffassung dazu, dass Europäer vor allem dem Massenzustrom muslimischer Migranten hilflos gegenüberstehen. ""Warum in Gottes Namen"", zitiert Caldwell den Verfassungsrichter Udo Di Fabio, ""sollte eine vitale Weltkultur sich in eine westliche Kultur integrieren wollen, wenn diese – die nicht genügend Nachwuchs produziert und nicht mehr länger über eine transzendente Idee verfügt – sich ihrem historischen Ende nähert?"" Versuche, beispielsweise in der Islam-Konferenz zu einem Modus Vivendi zu kommen, hält Caldwell naturgemäß für naiv. Wie es sich für ein konservatives Manifest gehört, stellt sich am Ende von Christopher Caldwells ""Reflexionen über die Revolution in Europa"" (bisher nicht auf Deutsch erschienen) das triste Gefühl ein, dass mit wohlmeinender Politik nicht viel zu machen ist. ""Der amerikanische Erfolg mit der Zuwanderung"", so schreibt er, sei nicht zuletzt das Produkt ""brutaler Indifferenz und eines Regierungshandelns, das für die meisten Europäer abstoßend ist"". Ob ein Vergleich der Lage europäischer und amerikanischer Städte wirklich den durchschlagenden Erfolg ""brutaler Indifferenz"" belegen kann, ist allerdings eine andere Frage. "	4190	True
4191	AfD	1	3985	faz.net	FAZ.NET	AfD attackiert Kanzlerin: Lucke: Merkel stempelt Menschen als fremdenfeindlich ab	Nach dem Brandenburger AfD-Fraktionsvorsitzenden Alexander Gauland greift nun auch der Parteivorsitzende Bernd Lucke die Kanzlerin wegen ihrer Warnung vor Pegida an. Merkels Neujahrsansprache wertet er als Pflichtverletzung.		http://media1.faz.net/ppmedia/aktuell/3787253958/1.3348711/article_multimedia_overview/der-afd-vorsitzende-bernd.jpg	http://www.faz.net/aktuell/politik/inland/afd-attackiert-kanzlerin-lucke-merkel-stempelt-menschen-als-fremdenfeindlich-ab-13348668.html	Merkel warnt vor Pegida-Protesten Merkel hatte in ihrer Neujahrsansprache vor den Pegida -Protesten gewarnt. Sie hatte gesagt: „Deshalb sage ich allen, die auf solche Demonstrationen gehen: Folgen Sie denen nicht, die dazu aufrufen! Denn zu oft sind Vorurteile, ist Kälte, ja, sogar Hass in deren Herzen!“ Lucke verteidigt zudem die Äußerungen seines Stellvertreters Alexander Gauland. Dieser hatte zu der Ansprache Merkels geäußert, die Kanzlerin „verurteilt Menschen von oben herab, die sie gar nicht kennt“. Der AfD-Fraktionsvorsitzende im Brandenburger Landtag mutmaßte, die Kritik der Kanzlerin werde der Protestbewegung noch mehr Zulauf als bisher schon bescheren. Lucke sagte nun der F.A.Z., er teile die Aussagen Gaulands „vollkommen“. Linkspartei: Gauland ist Pegida in Nadelstreifen Der Vorsitzende der Linkspartei Bernd Riexinger kritisierte Gauland hingegen scharf:  „Die AfD mutiert immer mehr zum parlamentarischen Arm der rechten Brandstifter. Gauland ist Pegida in Nadelstreifen“, sagte er der F.A.Z. Auch Merkel attackiert er. Pegida sein „ein Geschöpf  des Merkelismus“. Er fügte an: „Sie und ihre Leute predigen Tag und Nacht eine Politik der kalten Herzen gegen die Griechen. Da muss man sich dann über die organisierte Kaltherzigkeit von Pegida und AfD nicht mehr wundern.“ Die SPD lobte die scharfe Kritik Merkels an der Pegida-Bewegung. Die Erste Parlamentarische Geschäftsführerin der SPD-Bundestagsfraktion, Christine Lambrecht, sagte der F.A.Z: „Es ist gut, dass die Kanzlerin klare Worte zu Pegida gesagt hat. Die Vorstellungen von Pegida sind zum Teil menschenverachtend. Ihre Anhänger tragen diffuse Ängste auf dem Rücken der Schwächsten aus.“  Lambrecht sagte weiter: „Es ist wichtig, dass mit Argumenten dagegen gehalten wird. Denn es ist unsere Aufgabe, dafür zu sorgen, dass sich diese Menschen nicht endgültig von der Politik abwenden.“ Die SPD-Politikerin übte scharfe Kritik an der Alternative für Deutschland: „Dass ein Teil der AfD die Pegida-Demonstrierenden unterstützt und sich nicht davon distanziert, offenbart das wahre Gesicht der AfD. Das ist unerträglich.“ Köln: Dom bleibt dunkel während Pegida-Demo Am kommenden Montag sind Pegida-Proteste auch in Köln geplant. Dort soll während der Demonstration am weltberühmten Dom die Außenbeleuchtung für zweieinhalb Stunden abgeschaltet werden. Der stellvertretende SPD-Fraktionsvorsitzende Rolf Mützenich sagte dem „Kölner Stadt-Anzeiger“ dazu, er begrüße diese Entscheidung und halte sie für ein „sehr beachtenswertes und auch richtiges Signal“. Der Vorsitzende des Auswärtigen Ausschusses im Bundestag, Norbert Röttgen (CDU), sagte, er sei „froh über dieses klare Zeichen der Abgrenzung“. Stimmungsmache gegen Mitmenschen, zumal auch gegen solche, die in Not seien, sei „unchristlich“. Der FDP-Bundesvorsitzende Christian Lindner sagte dem „Kölner Stadt-Anzeiger“, bei dem Bündnis Pegida gehe es „längst nicht mehr um Sorgen wegen unbestreitbarer Integrationsprobleme“, sondern es gehe um einen „Angriff auf die Liberalität unseres Landes“. Das Kölner Erzbistum hatte am Dienstag erklärt, die Kirche wolle keine Kulisse für die Demonstration bieten und schalte daher die Beleuchtung ab. Damit folgt der Dom einer Aktion der Semperoper in Dresden, wo die Pegida-Bewegung ihren Ursprung hat. 	4191	True
4195	AfD	1	2	welt.de	DIE WELT	Zuwanderung – Abrechnung mit einem Mythos	Bereicherung oder Bedrohung? Ein US-Journalist hat die Geschichte der Immigration analysiert – und sieht für Deutschland und Europa dramatische Konsequenzen. Europa hat den Bedarf an Arbeitskraft von Zuwanderern überschätzt. Sie beanspruchen die Sozialsysteme mehr, als sie dazu beitragen.	article	http://m.welt.de/img/deutschland/crop101266452/3046937173-ci3x2l-w900/zuwanderung2-DW-Bayern-Berlin.jpg	http://m.welt.de/politik/deutschland/article4500301/Zuwanderung-Abrechnung-mit-einem-Mythos.html	"Zuwanderung – Abrechnung mit einem Mythos Von Mariam Lau 0 Auch Deutschland ist ein Zuwanderland Foto: dpa Bereicherung oder Bedrohung? Ein US-Journalist hat die Geschichte der Immigration analysiert – und sieht für Deutschland und Europa dramatische Konsequenzen. Europa hat den Bedarf an Arbeitskraft von Zuwanderern überschätzt. Sie beanspruchen die Sozialsysteme mehr, als sie dazu beitragen. Auf den Tag genau 45 Jahre ist es jetzt her, dass der Portugiese Armando Rodrigues de Sà mit Blumenstrauß und einem Moped – es war eine Zündapp Sport Combiette – am Bahnhof Köln-Deutz als der millionste Gastarbeiter in Deutschland begrüßt wurde. Geht es nach dem amerikanischen Journalisten Christopher Caldwell, gibt es an diesem Datum nichts zu feiern. Über zehn Jahre lang hat Caldwell die Geschichte der Zuwanderung nach Europa recherchiert, von Malmö bis Rom, von Dublin bis Duisburg, und sein Ergebnis ist finster. ""Europa hat seinen Bedarf an Arbeitskraft von Zuwanderern überschätzt. Der wirtschaftliche Nutzen, den die Zuwanderung gebracht hat, war minimal und temporär. Er ist längst Vergangenheit."" Dafür, so glaubt Caldwell, waren die sozialen und kulturellen Umwälzungen infolge der Massenimmigration massiv und dauerhaft. Die Einbindung neuer ethnischer Gruppen in Europas Gesellschaften war nicht einfach eine Addition zu dem, was da ist, sodass es nun bunter ist als vorher. Wohlfahrtsstaat ist nicht zu halten Es ist eine massive Veränderung, eine Revolution. Der Wohlfahrtsstaat ist praktisch nicht mehr zu halten; das Zusammenwachsen der EU erschwert, der Säkularismus europäischer Provenienz durch die Ankunft des Islam auf eine harte Probe gestellt. ""Kann Europa bleiben, was es ist, obwohl andere Leute darin leben?"", fragt Caldwell. Die Antwort ist Nein. Der Titel dieses beunruhigenden, provokanten und exzellent recherchierten Buchs ist angelehnt an einen Klassiker des europäischen Konservatismus: Edmund Burkes ""Reflections on the Revolution in France"". Wie Burke darin 1790 seinen tiefen Zweifeln an der Französischen Revolution Luft macht, deren abstrakte Prinzipien in seinen Augen der menschlichen Natur zuwiderlaufen, will auch Caldwell die vorgebliche Rationalität hinter der Massenimmigration nach Europa als Schimäre enthüllen. Seine Geschichte geht so: Europa war nicht ganz bei sich, als es beschloss, massiv um Zuwanderer zu werben. Es lag in Trümmern, materiell und ideell. Die Eliten der Nachkriegszeit hätten entweder gar nicht groß über die Folgen ihres Tuns nachgedacht – oder sich vollkommen verschätzt. Sie dachten, die Zuwanderer würden nicht lange bleiben (das dachten diese selbst auch), es würden nicht viele kommen, und sie würden genau in den kurzfristigen Engpass springen, der sich wegen der vielen toten Europäer aufgetan hatte. ""Niemand glaubte, sie würden jemals Anspruch auf Sozialhilfe erwerben. Dass sie die Gewohnheiten und Kulturen südländischer Dörfer, Familienclans und Moscheen beibehalten würden, erschien als völlig bizarrer Gedanke."" Falsche Annahmen zu Beginn Fast alle diese Annahmen hatten sich spätestens in den Siebzigerjahren als falsch erwiesen. Aber der Anwerbestopp, den die meisten westeuropäischen Länder dann verhängten, änderte wegen des Familiennachzugs nichts daran, dass es da mit der Zuwanderung überhaupt erst richtig losging. Wenn man den deutschen Bundesinnenminister Wolfgang Schäuble auf diese paradoxe Entwicklung anspricht, erhält man eine verblüffende Antwort. ""Wir waren nie ein Land, das aussucht"", erklärte Schäuble vergangene Woche im Gespräch mit WELT ONLINE , als ginge es um den Verlauf der deutschen Küsten oder andere Naturgegebenheiten. Warum eigentlich nicht? Und auf die Frage, wie es sein konnte, dass eine Demokratie diesen Prozess jahrzehntelang gegen den erklärten Willen der Bevölkerungsmehrheit durchgedrückt hat, hieß es: ""Je besser die Integration gelingt, desto weniger Fremdenfeindlichkeit gibt es."" Den Menschen müsse man sagen: ""Verschiedenheit ist keine Bedrohung, sondern eine Bereicherung."" Da hat Christopher Caldwell seine Zweifel. Als die Gastarbeiter kamen, war die Schwerindustrie, für die sie angeheuert wurden, schon auf dem absteigenden Ast. Die Türken, die noch in den Sechzigerjahren eine höhere Beschäftigungsquote hatten als die Deutschen, stellen heute in manchen Städten bis zu 40 Prozent der Arbeitslosen. Gastarbeiter, da seien sich alle Experten einig, sagt Caldwell, drückten die Produktivität. Italien beispielsweise hätte traditionelle Formen der Landwirtschaft nur mit billigen Zuwanderern aus Afrika und dem Mittleren Osten aufrechterhalten können. ""Unter den Bedingungen der Globalisierung hätte Italien wahrscheinlich einen Wettbewerbsvorteil, wenn es auf ein Hightech-Wirtschaftsmodell setzen würde, das vielleicht lukrativer wäre – aber eben nicht besonders 'italienisch'. Italiener könnten dagegen aufbegehren."" Büffelmozzarella aus Kampanien, kostbares Leinen aus der Normandie, Stahl aus Deutschland – ohne Arbeitskraft aus Mali, Anatolien und Algerien müsste man auf Billigersatz und seelenlose Großketten zurückgreifen. ""Alles muss sich ändern, damit es so bleiben kann, wie es ist"", zitiert Caldwell den nostalgischen Seufzer aus Giuseppe di Lampedusas ""Der Leopard"". In Deutschland hört man häufiger ein anderes Argument für die Zuwanderung, eines, das Caldwell ""sozialistisch"" nennt: Immigranten sollten den Wohlfahrtsstaat retten, indem sie die ungünstige demografische Talfahrt umkehren, auf der wir uns befinden: zu viele Alte, zu wenig Kinder. Aber die Bevölkerungsabteilung der Vereinten Nationen behauptet, dass dafür 701 Millionen Zuwanderer nötig wären, also deutlich mehr Menschen, als derzeit in Europa leben. In Deutschland ist die Zahl der zugezogenen Ausländer zwischen 1971 und 2000 um drei Millionen auf 7,5 Millionen gestiegen. Aber die Zahl der Berufstätigen aus dieser Gruppe blieb festgebacken bei zwei Millionen. 1973 waren 65 Prozent der Immigranten berufstätig, 1983 waren es nur noch 38 Prozent. Obendrein werden auch Zuwanderer alt und haben dann Anspruch auf Rentenzahlungen. Caldwell folgert: ""Immigranten beanspruchen die Sozialsysteme mehr, als sie dazu beitragen."" Caldwall hält Islam-Konferenz für naiv Eine fatale Mischung aus deutschem und europäischem Selbsthass (begründet in der Nazi-Vergangenheit, Kolonialismus, Werteverlust) und islamischer ""Hyper-Identität"" führt nach Caldwells Auffassung dazu, dass Europäer vor allem dem Massenzustrom muslimischer Migranten hilflos gegenüberstehen. ""Warum in Gottes Namen"", zitiert Caldwell den Verfassungsrichter Udo Di Fabio, ""sollte eine vitale Weltkultur sich in eine westliche Kultur integrieren wollen, wenn diese – die nicht genügend Nachwuchs produziert und nicht mehr länger über eine transzendente Idee verfügt – sich ihrem historischen Ende nähert?"" Versuche, beispielsweise in der Islam-Konferenz zu einem Modus Vivendi zu kommen, hält Caldwell naturgemäß für naiv. Wie es sich für ein konservatives Manifest gehört, stellt sich am Ende von Christopher Caldwells ""Reflexionen über die Revolution in Europa"" (bisher nicht auf Deutsch erschienen) das triste Gefühl ein, dass mit wohlmeinender Politik nicht viel zu machen ist. ""Der amerikanische Erfolg mit der Zuwanderung"", so schreibt er, sei nicht zuletzt das Produkt ""brutaler Indifferenz und eines Regierungshandelns, das für die meisten Europäer abstoßend ist"". Ob ein Vergleich der Lage europäischer und amerikanischer Städte wirklich den durchschlagenden Erfolg ""brutaler Indifferenz"" belegen kann, ist allerdings eine andere Frage. "	4195	True
4198	AfD	1	1	faz.net	FAZ.NET	AfD attackiert Kanzlerin: Lucke: Merkel stempelt Menschen als fremdenfeindlich ab	Nach dem Brandenburger AfD-Fraktionsvorsitzenden Alexander Gauland greift nun auch der Parteivorsitzende Bernd Lucke die Kanzlerin wegen ihrer Warnung vor Pegida an. Merkels Neujahrsansprache wertet er als Pflichtverletzung.		http://media1.faz.net/ppmedia/aktuell/3787253958/1.3348711/article_multimedia_overview/der-afd-vorsitzende-bernd.jpg	http://www.faz.net/aktuell/politik/inland/afd-attackiert-kanzlerin-lucke-merkel-stempelt-menschen-als-fremdenfeindlich-ab-13348668.html	Merkel warnt vor Pegida-Protesten Merkel hatte in ihrer Neujahrsansprache vor den Pegida -Protesten gewarnt. Sie hatte gesagt: „Deshalb sage ich allen, die auf solche Demonstrationen gehen: Folgen Sie denen nicht, die dazu aufrufen! Denn zu oft sind Vorurteile, ist Kälte, ja, sogar Hass in deren Herzen!“ Lucke verteidigt zudem die Äußerungen seines Stellvertreters Alexander Gauland. Dieser hatte zu der Ansprache Merkels geäußert, die Kanzlerin „verurteilt Menschen von oben herab, die sie gar nicht kennt“. Der AfD-Fraktionsvorsitzende im Brandenburger Landtag mutmaßte, die Kritik der Kanzlerin werde der Protestbewegung noch mehr Zulauf als bisher schon bescheren. Lucke sagte nun der F.A.Z., er teile die Aussagen Gaulands „vollkommen“. Linkspartei: Gauland ist Pegida in Nadelstreifen Der Vorsitzende der Linkspartei Bernd Riexinger kritisierte Gauland hingegen scharf:  „Die AfD mutiert immer mehr zum parlamentarischen Arm der rechten Brandstifter. Gauland ist Pegida in Nadelstreifen“, sagte er der F.A.Z. Auch Merkel attackiert er. Pegida sein „ein Geschöpf  des Merkelismus“. Er fügte an: „Sie und ihre Leute predigen Tag und Nacht eine Politik der kalten Herzen gegen die Griechen. Da muss man sich dann über die organisierte Kaltherzigkeit von Pegida und AfD nicht mehr wundern.“ Die SPD lobte die scharfe Kritik Merkels an der Pegida-Bewegung. Die Erste Parlamentarische Geschäftsführerin der SPD-Bundestagsfraktion, Christine Lambrecht, sagte der F.A.Z: „Es ist gut, dass die Kanzlerin klare Worte zu Pegida gesagt hat. Die Vorstellungen von Pegida sind zum Teil menschenverachtend. Ihre Anhänger tragen diffuse Ängste auf dem Rücken der Schwächsten aus.“  Lambrecht sagte weiter: „Es ist wichtig, dass mit Argumenten dagegen gehalten wird. Denn es ist unsere Aufgabe, dafür zu sorgen, dass sich diese Menschen nicht endgültig von der Politik abwenden.“ Die SPD-Politikerin übte scharfe Kritik an der Alternative für Deutschland: „Dass ein Teil der AfD die Pegida-Demonstrierenden unterstützt und sich nicht davon distanziert, offenbart das wahre Gesicht der AfD. Das ist unerträglich.“ Köln: Dom bleibt dunkel während Pegida-Demo Am kommenden Montag sind Pegida-Proteste auch in Köln geplant. Dort soll während der Demonstration am weltberühmten Dom die Außenbeleuchtung für zweieinhalb Stunden abgeschaltet werden. Der stellvertretende SPD-Fraktionsvorsitzende Rolf Mützenich sagte dem „Kölner Stadt-Anzeiger“ dazu, er begrüße diese Entscheidung und halte sie für ein „sehr beachtenswertes und auch richtiges Signal“. Der Vorsitzende des Auswärtigen Ausschusses im Bundestag, Norbert Röttgen (CDU), sagte, er sei „froh über dieses klare Zeichen der Abgrenzung“. Stimmungsmache gegen Mitmenschen, zumal auch gegen solche, die in Not seien, sei „unchristlich“. Der FDP-Bundesvorsitzende Christian Lindner sagte dem „Kölner Stadt-Anzeiger“, bei dem Bündnis Pegida gehe es „längst nicht mehr um Sorgen wegen unbestreitbarer Integrationsprobleme“, sondern es gehe um einen „Angriff auf die Liberalität unseres Landes“. Das Kölner Erzbistum hatte am Dienstag erklärt, die Kirche wolle keine Kulisse für die Demonstration bieten und schalte daher die Beleuchtung ab. Damit folgt der Dom einer Aktion der Semperoper in Dresden, wo die Pegida-Bewegung ihren Ursprung hat. 	4198	True
