line	page	week	num_likes	domain	outlet	title	description	contenttype	image	url	text	id	right_of_center
2217	DieGruenen	8	0	n-tv.de	n-tv.de	Preise dürften steigen: Tierschutz für Hummer geplant		article	http://bilder3.n-tv.de/img/incoming/crop3218906/2071322885-cImg_16_9-w1200/hummer.jpg	http://www.n-tv.de/panorama/Tierschutz-fuer-Hummer-geplant-article3218971.html	"Zur Startseite Der Preis für Hummer in Deutschland könnte bald deutlich steigen. Die Verbraucherbehörden der Länder beraten in den nächsten Wochen über eine Verschärfung der Tierschutzbestimmungen für die Krustentiere, die lebend im Einzelhandel verkauft werden. Das würde die Haltung deutlich verteuern. ""Das regelmäßig praktizierte Zusammenbinden der Scheren verhindert zwar Kannibalismus, macht aber auch ein artgemäßes Verhalten unmöglich"", heißt es in einem Arbeitspapier des bayerischen Landesamtes für Gesundheit und Lebensmittelsicherheit. Lebende Hummer und Langusten in einem Wasserbecken in der Lebendfisch-Abteilung eines Großmarktes in Düsseldorf. (Foto: picture alliance / dpa) ""Zunächst hat das Merkblatt nur empfehlenden Charakter, es ist ein Anhaltspunkt, mehr aber auch nicht"", sagte der Sprecher des nordrhein-westfälischen Landesamtes für Natur, Umwelt und Verbraucherschutz, Roland Schütz. Falls die Kommission beschließen sollte, die Empfehlungen umzusetzen, würden die strengeren Regeln jedoch wohl schnell verbindlich. Viele Aquarien müssten dann größer werden. Empfohlen werden acht Tiere pro 300 Liter Salzwasser - und Sichtschutzbleche. ""Dann müssten Händler die Hummer wahrscheinlich in großen Becken, einzeln und ohne zusammengebundene Scheren halten."" Der Deutsche Tierschutzbund begrüßt die Entwicklung als Schritt in die richtige Richtung. ""Allerdings sollten Krustentiere wie Hummer gar nicht mehr lebend verkauft oder gehandelt werden"", sagte ein Sprecher des Tierschutzbundes. Hummer sind auch Linkshänder Protestaktion der Tierschützer von PETA vor dem KaDeWe in Berlin. (Foto: picture-alliance/ dpa) Die Tierschutz-Organisation PETA hatte Anzeige gegen eine Handelskette wegen ""tierschutzwidriger Haltungsbedingungen"" erstattet. Weil das Strafgesetzbuch aber nur dann Tierquälerei gegeben sieht, wenn ein Wirbeltier leidet, nahm der Fall den Weg durch die Instanzen. Auch anderenorts häuften sich die Anzeigen. Die PETA-Leute sehen den Hummer als eine nach wie vor völlig unterschätzte, sensible Kreatur an. ""Hummer sind wunderschöne, interessante und empfindsame Tiere, die ihr Leben im Ozean genießen"", hat PETA-Aktivistin Petra Breining in einer Mitteilung ihres Vereins geschrieben. Hummerfreunde wie Breining beschreiben ihre Lieblinge fast wie Menschen: ""Einige Hummer sind Linkshänder, andere wieder Rechtshänder. Man hat sie dabei beobachtet, wie sie Hand in Hand gingen, ein alter Hummer einen jungen führte. Sie können jährlich mehr als 150 Kilometer zurücklegen, wenn sie nicht in eine der zahlreichen Hummerfallen geraten."" Mehr zum Thema "	2217	False
2224	DieGruenen	8	0	youtube.com	YouTube	Monsanto - Der schlimmste Konzern der Welt?	Vor kurzem sind weltweit mehr als zwei Millionen Menschen auf die Straßen gegangen, um gegen einen Konzern zu demonstrieren. Aber warum eigentlich? In diesem...	video	https://i.ytimg.com/vi/sFXuBWg9mXo/hqdefault.jpg	https://www.youtube.com/watch?v=sFXuBWg9mXo	Möchtest du dieses Video später noch einmal ansehen? Wenn du bei YouTube angemeldet bist, kannst du dieses Video zu einer Playlist hinzufügen. 	2224	False
2236	DieGruenen	8	0	handelsblatt.com		Lindner-Wutrede: „Dämlicher Zwischenruf“ bringt FDP-Chef in Rage	Ab Minute 22 drehte Christian Lindner auf: Der FDP-Chef setzt zu einer Wutrede im NRW-Landtag an.	Article	http://www.handelsblatt.com/images/fdp-chef-christian-lindner-in-action/11315140/3-format2010.png	http://www.handelsblatt.com/politik/deutschland/lindner-wutrede-daemlicher-zwischenruf-bringt-fdp-chef-in-rage/11314866.html	Sie haben den Artikel in Ihre Merkliste aufgenommen. Möchten Sie ihn nicht auch gleich mit Feunden teilen? Nicht mehr fragen. Schließen Bei einer Rede von Christian Lindner vor dem nordrhein-westfälischen Landtag hat der FDP-Parteivorsitzende zu einer wahren Wutrede angesetzt. Anlass war ein Zwischenruf eines SPD-Abgeordneten. Er habe ja wohl „Erfahrung mit der Gründerkultur“ hatte der SPD-Mann Volker Münchow ihm zugerufen, während Lindner am Rednerpult stand. Es war eine hämische Anspielung auf Lindners einstiges Scheitern mit seinem Unternehmen während der New Economy. Lindner, als guter Redner bekannt, nahm den Zwischenruf auf mit den Worten: „Ah, das ist ja interessant“ und wusch dem SPD-Hinterbänkler gehörig den Kopf. SPD-Ministerpräsidentin Hannelore Kraft hatte zuvor in der Regierungserklärung gesagt, man solle Scheitern von Pionieren nicht ein Leben lang biographisch als Stigma verwenden. „Da haben Sie einen, Frau Ministerpräsidentin“, sagte Lindner, auf Münchow, Fraktionsgeschäftsführer der SPD und Landtagsneuling, deutend. „Da haben Sie einen in Ihren eigenen Reihen, der nicht zuhört, was Sie machen.“ Genau das sei der Grund, warum junge Menschen heute lieber in den öffentlichen Dienst treten würden, statt sich zu gründen. Das ist Christian Lindner 	2236	False
2237	DieGruenen	8	0	welt.de		Pensionen für Beamte kosten drei Billionen	Altersansprüche betragen 3000 Milliarden Euro - und drohen den Staat zu ersticken. Forderungen nach Ende der Privilegien	article		http://www.welt.de/print/wams/vermischtes/article12055573/Pensionen-fuer-Beamte-kosten-drei-Billionen.html	"E-Mail Auf Deutschland rollt eine gewaltige Pensionslawine zu. In den nächsten drei Jahrzehnten schnellt die Zahl der Versorgungsempfänger von einer auf 1,6 Millionen hoch. Schon heute sind die Altersansprüche aller Staatsdiener, also die Pensionsverpflichtungen gegenüber den heutigen Pensionären plus der Ansprüche der noch aktiven Beamten, auf drei Billionen Euro gestiegen. Die Ausgaben dafür werden binnen zehn Jahren um 50 Prozent steigen. Dies überfordert vor allem die Haushalte der Länder, die rund drei Viertel aller Beamten beschäftigen. Sie gaben im vergangenen Jahr 22 Milliarden Euro für deren Altersversorgung aus und müssen für 2020 mit mehr als 34 Milliarden kalkulieren. Nach Ansicht des Steuerzahlerbundes sind die Beamten im Alter noch immer besser abgesichert als gesetzlich Versicherte. Der Verband fordert drastische Einsparungen. ""Wenn die Politik sich nicht an die Privilegien traut, drohen Steuererhöhungen zur Finanzierung der immer schwerer werdenden Pensionslasten"", sagte Verbandspräsident Karl Heinz Däke der ""Welt am Sonntag"". Die Forderung nach Pensionskürzung kommt pünktlich zur Jahrestagung des Deutschen Beamtenbundes, die heute Abend in Köln beginnt. Dessen Vorsitzender Peter Heesen sieht indes keinen Reformstau: ""Alle Rentenreformen der letzten Jahrzehnte sind wirkungsgleich auf die Beamtenversorgung übertragen worden."" Nach Berechnungen des Finanzexperten des Instituts der deutschen Wirtschaft (IW) Winfried Fuest geht die Schere aber weiter auseinander: Während das Rentenniveau wegen der Leistungseinschnitte der vergangenen Jahre nur noch 46,4 Prozent des Bruttoverdienstes ausmacht, erhalten Staatsdiener im Alter 71,75 Prozent. ""Wir brauchen keine Luxusbeamten"", so Fuest. Der Freiburger Ökonom Bernd Raffelhüschen moniert, dass die Rentenreformen nicht wirkungsgleich auf die Beamten übertragen worden seien. ""Dies gilt sowohl für den 2005 eingeführten Nachhaltigkeitsfaktor als auch - mit Ausnahme einiger Bundesländer - für die Rente mit 67 ."" Weil die Pensionswelle in wenigen Jahren ihren Höhepunkt erreiche, plädiert der Ökonom sogar dafür, die ""Pension mit 67"" in schnelleren Schritten umzusetzen als die Einschränkungen bei Arbeitern und Angestellten. So sollten Staatsdiener schon von 2019 an erst mit 67 Jahren pensioniert werden. Bislang haben nur der Bund und einige Länder die Anhebung der Altersgrenze für Beamte beschlossen. In etlichen hoch verschuldeten Ländern wie Berlin oder Bremen blieb die Altersgrenze unangetastet. Finanzwissenschaftler Raffelhüschen plädiert dafür, das Versorgungsniveau von Beamten schrittweise auf 60 Prozent der Bruttobezüge zu senken. Dazu müsste die Beamten auch der Nachhaltigkeitsfaktor treffen, der bereits den Rentenanstieg dämpft. Nach seinen Berechnungen könnte der Staat mit der so gestalteten Einführung der ""Pension mit 67"" seine Schuldenlast um ein Drittel verringern. Die Politik scheut sich, das Problem entschlossen anzugehen. Die FDP spricht aber von dringendem Handlungsbedarf. Ihr haushaltspolitischer Sprecher Volker Wissing sagte der ""Welt am Sonntag"": ""Es darf nicht sein, dass man Pensionslasten künftigen Generationen aufbürdet."" Der Liberale fordert aber keine Pensionskürzungen, sondern staatliches Sparen. Dafür gebe es zwar schon Ansätze. ""Doch die bestehenden Fonds vieler Bundesländer sind nur Taschenspielertricks"", denn was dort als Rückstellungen verbucht sei, werde vielfach den Ländern als Darlehen gegeben - also auch durch Schulden finanziert. Politik Seite 7 © WeltN24 GmbH 2016. Alle Rechte vorbehalten Meistgelesene Artikel "	2237	False
2243	DieGruenen	8	0	tagesspiegel.de		UN streichen Nahrungsmittelhilfe	Hunderttausende syrische Flüchtlinge erhalten keine Lebensmittelgutscheine mehr, weil den UN das Geld dafür ausgegangen ist. Schuld sind die Geberländer, die mit ihren Zahlungen nicht nachkommen.	Article	http://www.tagesspiegel.de/images/syrisch/11059080/3-format530.jpg	http://www.tagesspiegel.de/weltspiegel/kein-geld-fuer-syrische-fluechtlinge-un-streichen-nahrungsmittelhilfe/11059010.html	"01.12.2014 16:58 Uhr Kein Geld für syrische Flüchtlinge : UN streichen Nahrungsmittelhilfe Hunderttausende syrische Flüchtlinge erhalten keine Lebensmittelgutscheine mehr, weil den UN das Geld dafür ausgegangen ist. Schuld sind die Geberländer, die mit ihren Zahlungen nicht nachkommen. Auf Lebensmittel angewiesen. Syrische Familien in den Flüchtlingslagern. Foto: Reuters Kleine Kinder, die keine Schuhe haben und durch Schlamm waten. Familien, die ohne Decken und warme Kleidung auskommen müssen. Kranke, die dringend benötigte Medikamente nicht erhalten. Frauen und Männer, die unter zerrissenen Plastikplanen hausen: So beschreiben Helfer die Not der syrischen Flüchtlinge im Bürgerkriegsland und in den Nachbarstaaten. Millionen Menschen, die vor der Gewalt geflohen sind und alles verloren haben. Menschen, für die deshalb Unterstützung lebenswichtig ist. Jetzt verschärft der beginnende Winter die ohnehin katastrophale Lage. Doch womöglich werden Hunderttausende bald auch noch hungern. Denn das Welternährungsprogramm der Vereinten Nationen (WFP) muss ab sofort seine auf Gutscheinen beruhende Lebensmittelhilfe für Syrer in Jordanien, der Türkei , dem Libanon, im Irak und in Ägypten einstellen. Der UN-Organisation fehlen 64 Millionen Dollar, um das Programm im Dezember aufrechtzuerhalten – Geld, das zwar von der Staatengemeinschaft versprochen wurde, aber dennoch bislang nicht zur Verfügung steht. Mithilfe der elektronischen Gutscheine konnten Flüchtlingsfamilien bislang in lokalen Geschäften einkaufen. Das gab den Menschen die Möglichkeit, sich selbstbestimmt zu versorgen. Gleichzeitig wurde dadurch die einheimische Wirtschaft gestärkt. So sind seit dem Beginn des Programms laut WFP mehr als 800 Millionen Dollar der Region zugute gekommen. Doch schon vor einigen Wochen musste das Welternährungsprogramm die monatliche finanzielle Zuwendung für die Flüchtlinge drastisch kürzen. Nun gibt es gar kein Geld mehr. 1,7 Millionen Kinder, Frauen und Männer Ohne die Gutscheine werden viele Menschen vermutlich nicht ausreichend zu essen haben. Betroffen sind nach Angaben von WFP 1,7 Millionen Kinder, Frauen und Männer. „Für viele Familien, die ohnehin unter dem harschen Winter leiden, wird die ausbleibende Hilfe drastische Konsequenzen haben“, sagt Ertharin Cousin, WFP-Exekutivdirektorin. Die Gesundheit und Sicherheit dieser Menschen sei gefährdet. Man könne zudem nicht ausschließen, dass die Anrainerländer noch mehr als bisher unter Spannungen und Instabilität leiden. Allein der Libanon hat 1,5 Millionen Menschen Schutz vor dem Krieg in Syrien gewährt . Das Land ist aber ebenso wie Jordanien mit der Aufgabe völlig überfordert. „Wir sind sehr besorgt über die negativen Auswirkungen dieser Kürzungen für die Flüchtlinge und die Länder, die sie aufnehmen. Diese Staaten haben eine schwere Last geschultert“, sagt Muhannad Hadi, WFP-Nothilfekoordinator für die Syrienkrise. Sowohl die öffentliche Gesundheitsversorgung als auch das Bildungswesen sind in Jordanien und dem Libanon mittlerweile völlig überlastet. Der Wohnungs- und Arbeitsmarkt droht zusammenzubrechen, weil die Mieten in die Höhe schnellen und die Löhne in den Keller gehen. Dementsprechend groß ist der Unmut bei den Einheimischen. Die sozialen Spannungen nehmen immer mehr zu. Gerade deshalb hatte die Bundesregierung vor einigen Wochen eine Syrienkonferenz organisiert. Das Treffen sollte deutlich machen, wie dramatisch die Situation in den Nachbarstaaten bereits heute ist. Daher waren sich die 40 hochrangigen Konferenzteilnehmer auch einig, dass nur gezielte, vor allem langfristige Hilfe die Stabilität der Länder gewährleisten kann. Deutschland verpflichtete sich damals, bis 2017 zusätzlich 640 Millionen Euro für die Syrien-Hilfe bereitzustellen. Doch Deutschlands Engagement ist die Ausnahme, nicht die Regel. Viele Geber sind mit ihren zugesagten Zahlungen in Verzug - zum Schaden der syrischen Flüchtlinge. ""Die Weltgemeinschaft muss umgehend ihrer Verantwortung gerecht werden"", fordert Ralf Südhoff, Leiter von WFP in Deutschland. ""Denn Millionen Vertriebene, die keine Chance haben, sich und ihre Familien selbst zu versorgen, stehen jetzt vor dem Nichts."" "	2243	False
3600	CDU	8	262	cdu.de	Christlich Demokratische Union Deutschlands	Merkel: Bitteres Wahlergebnis für die CDU	„Das ist ein bitteres Wahlergebnis - trotz eines engagierten Wahlkampfes“, betonte die CDU-Vorsitzende, Bundeskanzlerin Angela Merkel, im Anschluss an die Treffen der CDU-Spitze in Berlin am Morgen nach der Wahl zur Hamburger Bürgerschaft. Sie dankte allen Wählerinnen und Wähler, die der CDU Hamburg das Vertrauen schenkten sowie Spitzenkandidat Dietrich Wersich für seinen Einsatz im Wahlkampf. Gleichzeitig gratulierte Merkel SPD-Bürgermeister Olaf Scholz.	article	http://www.cdu.de/sites/default/files/media/images/661_artikelbilder/150216_pv_img_6697_661x372.jpg	https://www.cdu.de/artikel/merkel-bitteres-wahlergebnis-fuer-die-cdu	Merkel: Bitteres Wahlergebnis für die CDU 16.02.2015 Merkel: Bitteres Wahlergebnis für die CDU „Das ist ein bitteres Wahlergebnis - trotz eines engagierten Wahlkampfes“, betonte die CDU-Vorsitzende, Bundeskanzlerin Angela Merkel, im Anschluss an die Treffen der CDU-Spitze in Berlin am Morgen nach der Wahl zur Hamburger Bürgerschaft. Sie dankte allen Wählerinnen und Wähler, die der CDU Hamburg das Vertrauen schenkten sowie Spitzenkandidat Dietrich Wersich für seinen Einsatz im Wahlkampf. Gleichzeitig gratulierte Merkel SPD-Bürgermeister Olaf Scholz. Das Wahlergebnis ist im Bundesvorstand ausgiebig analysiert worden: Es sei im Wahlkampf spürbar gewesen, dass die Machtoptionen für die CDU nur als sehr eingeschränkt angesehen worden seien, sagte die Vorsitzende. Eine hohe Zustimmung zum Senat, die gute wirtschaftliche Lage sowie die fehlende Wechselstimmung seien weitere wahlentscheidende Faktoren gewesen. Es sei nun wichtig, den Weg gemeinsam zu gehen und einen langen Atem zu haben, um die CDU in Hamburg wieder zu besseren Ergebnissen zu führen. Zuletzt bei der Bundestagswahl seien CDU und SPD in der Hansestadt nahezu gleichauf gewesen. Dies zeige das Potential, das die Union in der Hansestadt habe. „Viel Respekt, leider wenig Stimmen“ CDU-Spitzenkandidat Dietrich Wersich bedankte sich für den großen Zuspruch, den er in den CDU-Gremien erfahren habe. „Wir sind sehr enttäuscht“, bekannte er. Der Wahlkampf habe viel Respekt, leider jedoch wenige Stimmen gebracht. Es sei keine Wechselstimmung auszumachen gewesen. Die mangelnde Gestaltungsoption und das konservative Auftreten des SPD-Amtsinhabers hätten zudem zu einer Demobilisierung der eigenen Anhängerschaft geführt. Das politische Klima in Hamburg werde sich jedoch durch das Ende der SPD-Alleinregierung ändern, sagte Wersich voraus. „Gemeinsam nehmen wir die vor uns stehenden Herausforderungen an. Wir werden nicht aufstecken, sondern in Verantwortung für unsere Stadt als Opposition arbeiten“, betonte der Hamburger CDU-Politiker. Mehr zum Thema 	3600	True
4983	AfD	8	0	youtube.com	YouTube	Deutschland steht Kopf, überall Demonstrationen.	In diesem Video wird erklärt, warum die Politiker in Europa verrückt spielen und warum überall in Europa die Menschen auf die Straße gehen. 15 min. die ihr L...	video	https://i.ytimg.com/vi/hBnYskcJjUo/maxresdefault.jpg	https://www.youtube.com/watch?v=hBnYskcJjUo	"Die Bewertungsfunktion ist nach Ausleihen des Videos verfügbar. Diese Funktion ist zurzeit nicht verfügbar. Bitte versuche es später erneut. Veröffentlicht am 06.01.2015 In diesem Video wird erklärt, warum die Politiker in Europa verrückt spielen und warum überall in Europa die Menschen auf die Straße gehen. 15 min. die ihr Leben grundsätzlich verändern. Prüfen Sie die gemachten Angaben bitte alle selber nach und teilen Sie dieses Video! Hier eine PDF-Datei in der alle Links aufgeführt sind und zusätzliches Material zum Thema. Geschäftswerdung der Welt. (Warum die VSA überalll Länder zerbomben und das im Namen der ""Demokratie"". http://youtube.com/watch?v=mp4JqQkq_60 Sklaven ohne Ketten- cestui que vie- wir sind für tot erklärt http://youtube.com/watch?v=2RI5dvXPWeY Anonymous - Der kleine Einblick, mit grosser Wirkung - Die Personenstandserklärung http://youtube.com/watch?v=xB1rab14sig Cestui Que Vie Act 1666 (Wir sind für tot erklärt, das gilt noch heute und zwar fast weltweit) http://legislation.gov.uk/aep/Cha2/18... The Truth About Your Birth Certificate... http://youtube.com/watch?v=cfnJ1rOFK7o Meet Your Strawman http://yourstrawman.com/ Treuhandbond - Strohmann - US-Bürger http://youtube.com/watch?v=PZiie1wXsIc Hier finden sie die Urteile des ""The International Common Law Court of Justice"" http://itccs.org/common-law-court-doc... Video-Quelle & Text-Quelle: http://sfrom.net/vimeo.com/115765685 „Es wird ein Tag kommen an dem der Mensch aus der Vergessenheit erwacht und endlich begreifen wird wem er die Zügel für sein Dasein überlassen hat einem falschen und lügenden Geist der ihn zum Sklaven werden lässt und auch hält… Der Mensch hat keine Grenzen und wenn er sich dessen eines Tages bewusst wird, wird er auch hier in dieser Welt frei sein. Ich weiß nicht wann aber ich weiß dass viele in dieses Jahrhundert gekommen sind um Künste und Wissenschaften zu entwickeln, und den Samen einer neuen Kultur zu pflanzen die unerwartet und plötzlich erblühen wird; und zwar dann, wenn die Macht sich vormacht gewonnen zu haben.“ Giodarno Bruno* 1600, Zitat-Fundort: "	4983	True
4987	AfD	8	0	sz-online.de	SZ-Online	Meißner Kreisrat provoziert auf Kosten von Bombenopfern	Gegen Johann Dulig, junger SPD-Kreisrat in Meißen und Sohn von Sachsens Landes-SPD-Chef Martin Dulig, werden Rücktrittsforderungen laut. Ein Facebook-Posting ist der Grund.	article	http://www.sz-online.de/bilder/johann-dulig-muss-sich-wegen-eines-facebook-postings-1438902h.jpg	http://www.sz-online.de/sachsen/meissner-kreisrat-provoziert-auf-kosten-von-bombenopfern-3040163.html	Meißner Kreisrat provoziert auf Kosten von Bombenopfern Dienstag, 17.02.2015 	4987	True
