line	page	week	num_likes	domain	outlet	title	description	contenttype	image	url	text	id	right_of_center
2256	DieGruenen	9	0	ndr.de		Scholz unterstützt Kongress radikaler Christen	Sie wollen sich für christliche Werte einsetzen - teils fundamentalistische. Radikale Christen veranstalten in Hamburg einen Kongress, Schirmherr ist Bürgermeister Scholz.		http://www.ndr.de/nachrichten/hamburg/fuehrungskraeftekongress134_v-contentxl.jpg	http://www.ndr.de/nachrichten/hamburg/Scholz-unterstuetzt-Kongress-radikaler-Christen,fuehrungskraeftekongress100.html	"von Christian Baars Der große Saal im Hamburger Congress Centrum (CCH) ist fast komplett gefüllt. Weit mehr als 1.000 Zuhörer sitzen in den Reihen, die meisten von ihnen im schicken Business-Outfit. Gerade hat einer der Organisatoren das Eröffnungsgebet gesprochen. Jetzt betritt Olaf Scholz (SPD) die Bühne. ""Herzlich Willkommen in Hamburg"", sagt der Bürgermeister, ""ich finde die Stadt der ehrbaren Kaufleute an der Wasserkante ist genau der richtige Ort für den diesjährigen Kongress christlicher Führungskräfte."" Scholz ist Schirmherr des Führungskräftekongresses Olaf Scholz zeigt sich gut gelaunt. Zwar laufen in dieser Woche die Koalitions-Gespräche mit den Grünen, doch für den Kongress hat er sich Zeit genommen. Er ist sogar Schirmherr der Veranstaltung. Sein Sprecher teilte dem NDR auf eine Anfrage vor dem Kongress mit, der Senat habe geprüft, wer die Organisatoren und die anderen Teilnehmer seien. Es gebe zwar kritische Punkte, aber in der Gesamtheit sei es aus ihrer Sicht in Ordnung, dorthin zu gehen. Kauder, de Maizière und Petry als Referenten Mehr als 3.000 Teilnehmer sind hier drei Tage lang zusammengekommen - unter ihnen auch einige Vertreter großer Firmen wie Underberg oder smart. Außerdem finden sich auf der Liste der Referenten bekannte Politiker - etwa der Vorsitzende der Unions-Fraktion im Bundestag, Volker Kauder, Bundesinnenminister Thomas de Maizière oder die Vorsitzende der AfD, Frauke Petry. Veranstalter wollen christliche Werte in die Gesellschaft einbringen ""Uns geht es darum, dass wir versuchen, christliche Werte in unsere Gesellschaft einzubringen und das besonders über Führungskräfte"", erklärt Helmut Matthies. Er ist Chef des evangelikalen Verlags idea, einer der Organisatoren des Kongresses. Kampf gegen Korruption und Menschenhandel, Einsatz für Religionsfreiheit, Transparenz und Ehrlichkeit seien die zentralen Themen des Kongresses, so Matthies. Radikale Missionswerke bewerben ihre Arbeit Zu der Veranstaltung gehört auch eine Ausstellung. Hier wird deutlich, dass es den Organisatoren auch um andere Inhalte geht. Hier werben zahlreiche, teils extrem radikale Missionswerke für Einsätze in arabischen Ländern, in Afrika oder in Indien. Sie wollen andere Länder ""von der Macht Satans"" befreien, wirbt eine von ihnen. Ein anderer Missionar meint, in Afrika Seelen retten und ""Dämonen"" vertreiben zu müssen - und ""die Hölle zu plündern"". An einem anderen Stand liegen kleine Föten aus Plastik und Füße von Föten aus Metall, um vor Abtreibungen zu warnen. Ein paar Meter entfernt hat die Gesellschaft ""Wort und Wissen"" ihren Stand aufgebaut. Sie versucht, die Evolutionslehre zu widerlegen, und gibt Schulbücher für den Bio-Unterricht mit der Schöpfungsgeschichte heraus. Homosexualität sei Sünde und Abtreibung das größte Verbrechen Bild vergrößern Eine Organisation widmet sich auf der Ausstellung dem Thema Christenverfolgung - mit einem Maschinengewehr. Helmut Matthies selbst hält Abtreibung für ""das größte Verbrechen der Gegenwart in Deutschland"", bezeichnet Homosexualität als Sünde. Sein Verlag warnt immer wieder vor einer angeblichen ""Islamisierung"" und ruft zur Missionierung von Muslimen auf. Sein Co-Organisator Jörg Knoblauch ist Mitglied im rechtskonservativen ""Arbeitskreis Christlichen Publizisten"" und sagt im Interview mit dem NDR, 95 Prozent der Moslems seien friedliebend und integriert, aber ""wenn du einen Moslem vor die Frage stellst, Demokratie oder Koran, dann muss er in der Regel nicht nachdenken, dann sagt er Koran. Und dann beginnen die Probleme."" Kritik an Nähe zu rechten Kreisen Helmut Matthies sowie sein Verlag idea sind in den letzten Jahren immer wieder wegen ihrer Nähe zu rechten Kreisen kritisiert worden. Matthies hat im Dezember 2009 einen Preis der rechtskonservativen Zeitung ""Junge Freiheit"" angenommen und für sie - genauso wie mehrere andere idea-Mitarbeiter - als Autor geschrieben. Evangelikale Weltweit gibt es mehrere Hundert Millionen evangelikale Christen. Für sie ist die Bibel Grundlage für alle Lebens- und Glaubensfragen. Sie leiten strenge Lebensregeln daraus ab. Abtreibung zum Beispiel lehnen sie entschieden ab. Sie machen sich für Ehe und die klassische Familie stark, Homosexualität gilt als Sünde. Zu der evangelikalen Bewegung gehören unterschiedliche Gruppen und Gemeinden. In Deutschland zählen laut Schätzungen etwa 1,3 Millionen Gläubige dazu, von denen etwa die Hälfte zu Freikirchen, unabhängigen Gemeinden und Hauskirchen gehört, die andere Hälfte zu Gemeinden der evangelischen Landeskirchen. Idea arbeitet eng mit dem Dachverband der Evangelikalen, der Deutschen Evangelischen Allianz (DEA), zusammen, der auch auf dem Kongress vertreten ist. Die Osnabrücker Theologin Sonja Strube kritisiert, dass auf dessen Internetseite immer wieder Artikel aus ""neurechten, rechtspopulistischen und islamfeindlichen Medien"" übernommen würden. Themen wie Religionsfreiheit und Christenverfolgungen würden dort ""mit antimuslimischer Hetze und umfassender Ablehnung des Islam verknüpft"". Es seien dort regelmäßig ""in optisch und sprachlich seriöser Form unseriöse Positionen und Texte des extrem rechten Spektrums"" verbreitet worden, schreibt Strube in einem Artikel in der ""Theologischen Revue"". Sowohl idea als auch die DEA bestreiten diese Vorwürfe und betonen, sie seien nicht rechtsradikal. Olaf Scholz lehnt Interview ab Bürgermeister Scholz hat ein Interview mit dem NDR abgelehnt. Er wollte sich nicht dazu äußern, warum er die Schirmherrschaft dieser Veranstaltung übernommen hat, teilte sein Sprecher mit. Die Frage sei: Nutze der Bürgermeister die Gelegenheit, sie mit seiner Weltsicht zu konfrontieren. In seiner Rede lobt Scholz ""christliche Werte"" und Hamburg als Unternehmensstandort. In einem Satz verweist er auf das Grundgesetz und die dort verankerte Würde des Menschen und ruft dazu auf, alle Menschen gleich zu behandeln. Außerdem sagt er, dass zu den Werten ""unseres Wirtschaftssystems"" auch die Weltoffenheit sowie Toleranz gehöre - im Sinne von Respekt gegenüber anderen Religionen und derer, die keine Religion haben. Kritik an den Positionen der Veranstalter zum Islam, zur Homosexualität oder zur Abtreibung äußert er nicht. Auf Nachfrage des NDR, ob er dies eventuell an anderer Stelle getan habe, hat der Senat nicht geantwortet. Hinweis der Redaktion: In einer früheren Version dieses Beitrages sind uns zwei Fehler unterlaufen. Der Vorname von Helmut Matthies wurde fälschlicherweise mit -h geschrieben.  Außerdem war zunächst an einer Stelle von ""mehr als 3.000 Unternehmern"" die Rede. Diese Formulierung haben wir in ""mehr als 3.000 Teilnehmer"" geändert. Die Redaktion bittet für diese Fehler um Entschuldigung. Stellungnahme der Redaktion Liebe Nutzerinnen und Nutzer von NDR.de, wir freuen uns über Kommentare zu unseren Beiträgen - auch über kritische. Denn sie ermöglichen einen Diskurs über strittige Themen. Einige Anmerkungen zu den vielen Kommentaren: Was bedeutet radikal? In dem Artikel ist die Rede von ""radikalen Christen"". ""Radikal"" in diesem Zusammenhang bedeutet, dass die Gläubigen zum christlich-fundamentalistischen Spektrum gezählt werden können, was aus Sicht der Autoren auf die Organisatoren des Kongresses sowie einige Aussteller zutrifft. Sollte aber der Eindruck einer Pauschalisierung entstanden sein, bedauern wir dies. Sie war nicht intendiert. Sind die Beispiele in dem Text ""willkürlich"" bzw. ""einseitig"" herausgegriffen? Der Redakteur, Christian Baars, hat sich schon im Vorfeld mit dem Kongress, den Referenten und den Aussteller beschäftigt und ist darüber hinaus einige Stunden - gemeinsam mit einem Team vom Hamburg Journal - auf der Ausstellung des Kongresses unterwegs gewesen. Die Mitarbeiter des NDR haben dort mit vielen Menschen gesprochen und sich die Stände angesehen. Zudem sind sie bei der Eröffnung sowie beim Grußwort von Herrn Scholz vor Ort gewesen und haben Interviews mit den Organisatoren Helmut Matthies und Jörg Knoblauch geführt. Durch diese Recherche, die auch auf der jahrelangen Beschäftigung des Redakteurs mit evangelikalen Gemeinden in Deutschland fußt, wurde die Auswahl getroffen. Die angesprochenen Punkte - Missionierung von Andersgläubigen, Forderung nach einem strikten Verbot von Abtreibungen, Darstellung von Homosexualität als Sünde - gehören zu den Positionen, die viele Evangelikale immer wieder nach außen vertreten. Grundsätzlich möchten wir anmerken, dass diese Positionen natürlich vertreten werden dürfen. Niemand will eine freie Meinungsäußerung untersagen. Umgekehrt ist jedoch auch Kritik an dieser Meinung erlaubt. Es ging auch darum zu zeigen, dass die Organisatoren und viele Aussteller gesellschaftspolitische Positionen vertreten, die von denen für die Herr Scholz bzw. die SPD ansonsten stehen, abweichen. Dieser Artikel wurde ausgedruckt unter der Adresse: http://www.ndr.de/nachrichten/investigation/Scholz-unterstuetzt-Kongress-radikaler-Christen,fuehrungskraeftekongress100.html mit Video 08.05.2014 21:45 Uhr Das Erste: Panorama Gibt es Ärzte, die Schwule umpolen wollen? Dieser Frage ist ein Panorama-Reporter nachgegangen. Ein Selbstversuch mit erschreckenden Erkenntnissen. mehr Mehr aus Hamburg "	2256	False
2258	DieGruenen	9	0	youtube.com	YouTube	nachdenKEN über: Krim-Krimi und die wahren Hintergründe	Glaubt man der westlichen Medienberichterstattung, ist Putin zum Kalten Krieg zurückgekehrt, als er den russischen Marinestützpunkt Sewastopol auf der ukrain...	video	https://i.ytimg.com/vi/sdrBMRSFqOg/maxresdefault.jpg	https://www.youtube.com/watch?v=sdrBMRSFqOg	"Das interaktive Transkript konnte nicht geladen werden. Wird geladen... Die Bewertungsfunktion ist nach Ausleihen des Videos verfügbar. Diese Funktion ist zurzeit nicht verfügbar. Bitte versuche es später erneut. Veröffentlicht am 07.03.2014 Glaubt man der westlichen Medienberichterstattung, ist Putin zum Kalten Krieg zurückgekehrt, als er den russischen Marinestützpunkt Sewastopol auf der ukrainischen Halbinsel Krim mit zahlreichen Soldaten absicherte. Hier liegen neben russischen Zerstörern auch Atom-U-Boote. Russland hat diesen Hafen bis 2042 gepachtet. Die deutsche Presse, die maßgeblich aus Washington gelenkt wird, suggeriert uns Deutschen, dass ein NATO-Waffengang gegenüber den Russen unumgänglich sei, um Demokratie und Stabilität in der Ukraine wieder herzustellen. In Wahrheit geht es der NATO darum, das Militärbündnis auf die Ukraine zu erweitern und so den Marinehafen Sewastopol an sich zu reißen. Dieser ist - genau so wie der syrische Hafen Tartus - der Hauptpfeiler der russischen Marine, um russische Handelswege zu verteidigen. Die Drahtzieher der aktuellen Krim-Krise sind vor allem amerikanische Energie-Riesen, wie z.B. Noble Energy, deren Auftrag es ist, das Geschäftsfeld von Gazprom wieder zu verkleinern. Während die ehemalige US-Außenministerin Hillary Clinton öffentlich Putin mit Hitler vergleicht, vergisst sie zu erwähnen, dass ausgerechnet ihr Mann, Bill Clinton, Lobbyist bei Noble Energy ist. ""In der internationalen Politik geht es nie um Demokratie oder Menschenrechte. Es geht um die Interessen von Staaten. Merken Sie sich das, egal, was man Ihnen im Geschichtsunterricht erzählt."" -Egon Bahr "	2258	False
2259	DieGruenen	9	0	deutsche-wirtschafts-nachrichten.de	DEUTSCHE WIRTSCHAFTS NACHRICHTEN	Kredite aus Steuergeldern: Saatgut-Konzerne kaufen Land in der Ukraine	Die Bundesregierung hat in der Antwort auf eine Anfrage der Links-Partei zugegeben, dass nationale und internationale Konzerne in der Ukraine EU-Subventionen und Kredite erhalten. Es findet ein Transfer von fruchtbaren Ländereien an ukrainische Oligarchen und internationale Saatgut-Konzerne statt. Im Gegenzug erhält die Regierung in Kiew internationale Kredite.	article	h	http://deutsche-wirtschafts-nachrichten.de/2015/02/27/kredite-aus-steuergeldern-saatgut-konzerne-kaufen-land-in-der-ukraine/	Der Kreml meldet, dass sich der türkische Staatschef Erdogan bei Putin für den Abschuss des russischen Kampfjets schriftlich entschuldigt habe. Auch mit Israel hat die Türkei eine Aussöhnung angekündigt. Lange verband Erdogan und Putin eine Männerfreundschaft. (Foto: dpa) Die Türkei hat gleich zwei außenpolitische Konflikte entschärft. Gut ein halbes Jahr nach dem Abschuss eines russischen Kampfjets im syrischen Grenzgebiet entschuldigte sich Präsident Recep Tayyip Erdogan der Regierung in Moskau zufolge bei Staatschef Wladimir Putin für den Vorfall. Dies könnte einem Ende der russischen Wirtschaftssanktionen den Weg ebnen. Zudem legte die Regierung einen jahrelangen Streit mit Israel bei und verständigte sich auf eine Normalisierung der Beziehungen, die einst von engen militärischen und wirtschaftlichen Kontakten geprägt waren. Hintergrund war der Versuch pro-palästinensischer und islamistischer Aktivisten aus der Türkei, die israelische Seeblockade des Gazastreifens im Jahr 2010 zu durchbrechen. Dabei waren zehn Türken getötet worden. Erdogan habe Putin in einem Schreiben sein Bedauern und den Angehörigen des getöteten Piloten sein Beileid ausgedrückt, teilte das russische Präsidialamt am Montag mit: „Wir hatten noch niemals einen vorsätzlichen Plan, um ein russisches Flugzeug abzuschießen. Ich teile Ihnen mit, dass es mir Leid tut. Ich teile Ihre Trauer von ganzem Herzen. Wir betrachte die Familie des russischen Piloten als unsere türkische Familie. Wir sind bereit, jedwede Initiative in Betracht zu ziehen, um den Schmerz und die Schwere der Schäden zu lindern“, schrieb Erdogan an Russland. Ein Sprecher Erdogans bestätigte den Brief, ohne von einer Entschuldigung zu sprechen. Der Präsident habe sein Bedauern ausgedrückt und die Familie des Piloten um Verzeihung gebeten. Die türkische Staatsanwaltschaft eröffnete ein neues Verfahren gegen die mutmaßlich Verantwortlichen für den Abschuss. Der Abschuss hatte die Beziehungen beider Länder schwer belastet. Russland verhängte Wirtschaftssanktionen. Russische Touristen mieden die Türkei. Putin verlangte eine Entschuldigung. Die russische Maschine verletzte nach früherer türkischer Darstellung den türkischen Luftraum. Der Regierung in Moskau zufolge flog der Jet dagegen nur über Syrien. Russland kämpft in dem Bürgerkriegsland an der Seite von Präsident Baschar al-Assad, während die Türkei islamistische Gruppen unterstützt. Russland hofft nun auf eine Entspannung der Beziehungen und die Wiederaufnahme der Partnerschaft zwischen beiden Staaten. Im vergangenen November hatte die türkische Luftwaffe im Grenzgebiet zwischen Syrien und der Türkei ein russisches Flugzeug abgeschossen. Doch auch zwischen Israel und Türkei wurde am Montag der Anstoß zu einer Annäherung bekanntgegeben. Beide Seiten haben sich nach jahrelanger Eiszeit auf eine Normalisierung ihrer Beziehungen geeinigt. Das bestätigten nach israelischen auch türkische Regierungskreise. „Die Vereinbarung stellt einen diplomatischen Sieg für die Türkei dar“, sagte ein Regierungsvertreter in Ankara, der anonym bleiben wollte, in der Nacht zum Montag. „Die Türkei wird den Palästinenserstaat und das palästinensische Volk weiterhin unterstützen.“ Palästinenserpräsident Mahmud Abbas habe die Vereinbarung am Sonntagabend in einem Gespräch mit dem türkischen Staatspräsidenten Recep Tayyip Erdogan begrüßt, hieß es weiter aus Ankara. Auch die Hamas habe bei den Verhandlungen ihre Unterstützung für die Türkei zum Ausdruck gebracht. In Rom hatten sich am Sonntag Delegationen beider Seiten getroffen, um letzte Details auszuarbeiten. Auch aus israelischen Regierungskreisen war eine Einigung bestätigt worden. Der türkische Ministerpräsident Binali Yildirim wollte am Montag in Ankara vor die Presse treten. Medienberichten zufolge wollte sich zeitgleich auch Israels Regierungschef Benjamin Netanjahu äußern. Aus israelischen Regierungskreisen hieß es, Angehörige von zehn Türken, die 2010 bei einem Einsatz der israelischen Marine auf der Mavi Marmara getötet worden waren, sollten mit rund 20 Millionen Dollar entschädigt werden. Damit seien alle Klagen gegen Israel hinfällig. Der türkische Regierungsvertreter bestätigte, dass man sich auf eine Kompensation im Fall der Mavi Marmara geeinigt habe. Israelische Soldaten hatten das unter der Flagge des Inselstaates Komoren fahrende Schiff aus der Türkei vor dem Gazastreifen geentert. Pro-palästinensische Aktivisten hatten trotz Warnungen versucht, mit dem Hilfsschiff eine von Israel verhängte Seeblockade des Gazastreifens zu durchbrechen. Aus israelischen Regierungskreisen hieß es, beide Staaten wollten wieder Botschafter austauschen. Israelische Medien berichteten, die Türkei sei von ihrer Forderung nach einer Aufhebung der seit zehn Jahren andauernden Blockade des Gazastreifens abgerückt. Der türkische Regierungsvertreter teilte mit, nach der Vereinbarung werde die Türkei humanitäre Hilfsgüter und andere nichtmilitärische Güter nach Gaza schicken. Außerdem werde die Türkei dort in die Infrastruktur investieren und ein Krankenhaus fertigbauen. Zudem werde die Türkei die Energie- und Wasserkrise in Gaza angehen. Der türkische Präsident Erdogan erklärte sich israelischen Angaben zufolge bereit, in einem gesonderten Dokument die Frage von zwei israelischen Soldaten festzuhalten, die im Gazastreifen vermisst werden. Er habe alle türkischen Sicherheitsbehörden angewiesen, sich für eine Lösung einzusetzen. Die Eltern der Soldaten hatten gefordert, die Rückführung der Leichen zu einem Teil des Abkommens zu machen. Netanjahu war am Sonntag nach Rom gereist und hatte dort den US-Außenminister John Kerry getroffen. 	2259	False
2270	DieGruenen	9	1	youtube.com	YouTube	Eklat bei Maischberger: „Machen Sie Ihre Sendung doch alleine 24.02.2015 - Bananenrepublik	► Homepage: http://www.Bananenrepublik.tv - Bananenrepublik.tv ► Google+: https://plus.google.com/u/0/106701079280378758319/posts ► Zweiter-Upload-Kanal: htt...	video	https://i.ytimg.com/vi/R-CWpcGuXP4/hqdefault.jpg	https://www.youtube.com/watch?v=R-CWpcGuXP4		2270	False
2271	DieGruenen	9	0	augsburger-allgemeine.de	Augsburger Allgemeine	Grüne Jugend will Sex unter Geschwistern erlauben	Die Grüne Jugend von Augsburg will Sex unter Geschwistern erlauben. In einer Pressemitteilung heißt es: Deutschland muss Liebe endlich legalisieren!	article	http://bilder.augsburger-allgemeine.de/img/incoming/crop20952796/8864787728-ctopTeaser-w1200/Bundesparteitag-Buendnis-90-Die-Gruenen.jpg	http://www.augsburger-allgemeine.de/augsburg/Gruene-Jugend-will-Sex-unter-Geschwistern-erlauben-id20952731.html	"Die Grüne Jugend von Augsburg will Sex unter Geschwistern erlauben. In einer Pressemitteilung heißt es: ""Deutschland muss Liebe endlich legalisieren!"" Foto: dpa Sex unter Geschwistern? In Deutschland verboten. Mehr sogar. Es ist ein Tabu. In Paragraf 173 des Strafgesetzbuches steht, dass Geschwister, die miteinander Sex haben, mit bis zu zwei Jahren Freiheitsstrafe zu rechnen haben. Die Grüne Jugend von Augsburg will dies nun abschaffen, wie sie in einer Mitteilung an die Presse und auf ihrer Homepage schreiben: ""Mit dem Inzestverbot greift der Staat massiv in das Privatleben und das Selbstbestimmungsrecht seiner Bürger*innen ein"", schreibt Marie Rechthaler, Sprecherin der Grünen Jugend Augsburg. Außerdem widerspreche das Inzest-Verbot den wissenschaftlichen Tatsachen. ""Dieses Verbot basiert allein auf überholten gesellschaftlichen Tabus und ist rational nicht haltbar. Das wollte der Europäische Gerichtshof leider nicht erkennen"", so Rechthaler weiter. ANZEIGE Auch Katharina Stephan, eine weitere Sprecherin der Grünen Jugend Augsburg schreibt: ""Mit dieser mutlosen Entscheidung werden wir um Jahre zurückgeworfen. Eine Abschaffung des ‘Inzestparagraphen’ 173 ist längst überfällig. Wir fordern deshalb: Deutschland muss Liebe endlich legalisieren!"" Inzest: Nicht der erste Vorstoß der Grünen Es ist nicht der erste Vorstoß der Grünen in Sachen Inzest-Verbot. Im April 2012 forderte bereits Polit-Dino Hans-Christian Ströbele, dass Geschwister-Sex erlaubt sein sollte: ""Zwei erwachsene Menschen sollten selbst entscheiden können, ob sie miteinander Geschlechtsverkehr haben – vorausgesetzt, sie lieben sich, es geschieht freiwillig und es besteht kein Abhängigkeitsverhältnis."" Inzest: § 173 - Beischlaf zwischen Verwandten 1 von 3 vorherige Seite nächste Seite (1) Wer mit einem leiblichen Abkömmling den Beischlaf vollzieht, wird mit Freiheitsstrafe bis zu drei Jahren oder mit Geldstrafe bestraft. (2) Wer mit einem leiblichen Verwandten aufsteigender Linie den Beischlaf vollzieht, wird mit Freiheitsstrafe bis zu zwei Jahren oder mit Geldstrafe bestraft; dies gilt auch dann, wenn das Verwandtschaftsverhältnis erloschen ist. Ebenso werden leibliche Geschwister bestraft, die miteinander den Beischlaf vollziehen. (3) Abkömmlinge und Geschwister werden nicht nach dieser Vorschrift bestraft, wenn sie zur Zeit der Tat noch nicht achtzehn Jahre alt waren. Hintergrund der damaligen Äußerungen des Grünen-Politikers war eine Entscheidung des Europäischen Gerichtshofs für Menschenrechte. Demnach verletze das deutsche Inzestverbot nicht die Menschenrechte. Sex zwischen Geschwistern ist in einigen europäischen Ländern erlaubt, in anderen verboten. Verfechter des Verbots der Geschwisterliebe verweisen darauf, dass aus Inzest-Beziehungen öfter Kinder mit Behinderung oder Erbkrankheiten hervorgehen. Herrmann äußerte sich pro Inzest-Verbot Im April 2012 sagte deshalb Bayerns Innenminister Herrmann der Bild: ""Es ist wichtig, dass Inzest in Deutschland weiter verboten bleibt. Wir müssen die Gesundheit unserer Bevölkerung schützen, die Chance auf ein körperlich und vor allem seelisch unversehrtes Leben ermöglichen. Wer hier nur an sexuelle Freiheit denkt, gibt sich vermeintlich tolerant, verdrängt aber die Folgen und ignoriert die Konsequenzen inzestuöser Verhältnisse."" "	2271	False
