line	page	week	num_likes	domain	outlet	title	description	contenttype	image	url	text	id	right_of_center
2957	DieGruenen	32	0	daserste.de	DasErste.de	Sambia: Wälder zu Holzkohle | Weltspiegel	Ein langsames Geschäft: Das Holz wird gehackt, gestapelt, dann luftdicht mit Gras und Sand bedeckt und schließlich angezündet. In einem selbstgebauten Meiler schwelen die Scheite tage-und nächtelang zu Holzkohle.	video.episode	http://www.daserste.de/information/politik-weltgeschehen/weltspiegel/sendung/sambia-holzkohle-102~_v-facebook1200_6b137c.jpg	http://www.daserste.de/information/politik-weltgeschehen/weltspiegel/sendung/sambia-holzkohle-100.html	"SENDETERMIN So, 02.08.15 | 19:20 Uhr | Das Erste Sambia: Wälder zu Holzkohle Sambia: Wälder zu Holzkohle Ein langsames Geschäft: Das Holz wird gehackt, gestapelt, dann luftdicht mit Gras und Sand bedeckt und schließlich angezündet. In einem selbstgebauten Meiler schwelen die Scheite tage-und nächtelang zu Holzkohle. Holzkohle ist die billigste Energiequelle Sambias. Die Produktion des Brennstoffes vernichtet Jahr für Jahr mehr Wälder. Berghänge erodieren, eigentlich fruchtbarer Boden wird weggeschwemmt, Bauern verlieren ihre Lebensgrundlage. Das einzige, was ihnen bleibt: Der Verkauf selbstgefertigter Holzkohle. Ein Kreislauf, der immer tiefer in die Armut führt. ARD-Korrespondentin Joana Jäschke (ARD-Studio Johannesburg) über Armut als Klimakiller. Vier Tage werden Alvin und Victor hacken, bis der Mutondo-Baum endlich fällt. Es sieht ein bisschen aus, wie ein Kampf David gegen Goliath. Nur langsam frisst sich die selbstgebaute Axt durch das Holz. Vier Tage werden Alvin und Victor hacken, bis der Mutondo-Baum endlich fällt. Einer der letzten, großen Bäume ihres Dorfes. Und so etwas wie ihre ""Lebensversicherung"". ""Der Mutondo-Baum ist ziemlich ergiebig"", meint Alvin Munymani. ""Daraus werden wir eine Menge Holzkohle machen. Aber es gibt nicht mehr viele von den ganz großen Bäumen. Deshalb haben wir oft lange Wege. Aber die müssen wir in Kauf nehmen, denn nur so können wir Geld machen und überhaupt überleben."" Es gibt keine Alternativen Ein langsames Geschäft. Das Holz wird gehackt, gestapelt, dann luftdicht mit Gras und Sand bedeckt und schließlich angezündet. In einem solchen Meiler schwelen die Scheite zu Holzkohle. Mehrfach am Tag und auch nachts müssen Alvin und seine Familie nachsehen, ob nicht doch Luft rankommt – dann wäre ihre Arbeit umsonst. Das Holz verbrennt zu Asche. ""Wir haben absolut keine Alternative. Nur so können wir ein bisschen Geld verdienen und unsere Kinder ernähren. Wir würden schlichtweg verhungern, denn wirtschaftlich geht es uns auf dem Land am schlechtesten."" Umgerechnet sechs Euro pro Sack Und so wie Alvin und seine Familie sind die meisten Menschen im ländlichen Sambia von der Holzkohle abhängig. 50 Kwacha verdienen sie an einem solchen Sack – umgerechnet gut sechs Euro. Von dem Geld wollen sie ihre Kinder zur Schule schicken. Die Nachfrage nach Holzkohle ist riesig. Allein in der Hauptstadt Lusaka, 160 km weiter westlich. Hier boomt das Geschäft mit dem ""schwarzen Gold"", wie sie es nennen. Kohlenmärkte wie dieser – überall in der Stadt. Betty, Tipe und Grace sind so etwas wie die Urgesteine auf dem Markt. Seit 10 Jahren stehen sie jeden Tag hier, vom Morgengrauen bis zur Dämmerung. Wenn es gut läuft, verdienen sie so 120 Kwacha am Tag, also rund 15 Euro. Dorfbewohner sammeln das ""schwarzen Gold"" ein – die Haupteinnahmequelle vieler Einwohner Sambias ""Sambia könnte nicht überleben, ohne das Holzkohlengeschäft"", erzählt die Holzkohle-Verkäuferin Grace Lombe. ""Es startet schon bei den Bauern im Dorf, die nur so ihre Familien durchbringen können, und reicht bis zu uns nach Luska, wo wir auf das Geschäft angewiesen sind. Es ist ein Riesen-Business!"" Und Betty Nyirongo ergänzt: ""Das Geschäft lässt niemals nach. Je mehr Bäume die Leute fällen, desto besser sind wir im Geschäft. Es ist ein nicht endender Kreislauf."" 300.000 Hektar Wald werden jedes Jahr gerodet Da könnte sie sich täuschen. Bald schon werden die Bäume nicht mehr ausreichen. 80% der Haushalte in Sambia haben keinen Stromanschluss – selbst in großen Teilen der Hauptstadt nicht. Geheizt und gekocht wird daher mit Holzkohle. Und mit der wachsenden Bevölkerung steigt auch die Anzahl derer, die auf Holzkohle angewiesen sind. ""Im Alltag brauchen wir die Holzkohle ständig"", sagt Endjoves Mwale. ""Das ist ja die einzige Energiequelle. Ohne könnte ich keinen Maisbrei kochen. Eigentlich ginge gar nichts ohne Holzkohle."" Für die Umwelt ist das ein Problem. Und das wird sichtbar, schon kurz hinter der Stadtgrenze von Lusaka: Bis vor ein paar Jahren stand hier noch dichter Wald. Nun sind nur noch Felder und Büsche übrig. 300.000 Hektar Wald werden jedes Jahr gerodet, schätzt die Regierung. Überwiegend für Holzkohle. Das ist dreimal die Fläche von Berlin. In 20 Jahren könnte das Land ohne Bäume dastehen. Die Auswirkungen aufs Klima kann man heute schon sehen, auch bei Alvin und den anderen Köhlern im Dorf Mumbwa. Starker Regen, dann wieder trockene Perioden. Klimawandel ganz nah. Nachhaltiger Umgang mit Holz Deshalb ist er heute hier: Clive Chibule von der Organisation ""Green Living Movement"". Er will den Köhlern einen nachhaltigen Umgang mit Bäumen und Holz zeigen. Das Prinzip: wenn sie schon einen Baum fällen – wenigstens einen neuen dafür pflanzen. ""Wir sitzen schon jetzt auf einer Zeitbombe. Wir leben in einer globalisierten Welt, die mit dem Klimawandel kämpft. Und wenn das Baumfällen nicht nachhaltig ist, verstärken sich extreme Dürreperioden und schlimme Fluten. Es wird noch mehr Hunger geben, weil die Menschen hier keine Ernte mehr produzieren können."" ""Wir wissen, dass wir durch das Abroden das Klima mit beeinflussen"" Dabei ist die Ernte schon jetzt ein Problem: Die Landwirtschaft, von der sie alle mal gelebt haben, wirft nicht mehr genug ab, zeigt uns Alvin. ""Schaut euch doch mal diesen verkümmerten Mais an, wo soll der uns denn hinbringen?"", fragt Alvin Munymani. ""Wie sollen wir davon denn leben? Der fruchtbare Boden – weggewaschen von flutartigen Regenfällen. Weil durch das unkontrollierte Baumfällen sind keine Wurzeln mehr da, die das Erdreich festhalten. Dabei wissen sie hier in Mumbwa, dass sie langfristig auch an ihrer eigenen Existenz sägen. ""Wir wissen, dass wir durch das Abroden das Klima mit beeinflussen. Aber was bleibt uns denn übrig? Wir müssen weiter Holzkohle machen. Es ist doch besser, jetzt einen Baum zu fällen und irgendwie zu überleben – als die Bäume stehenzulassen und dann zu verhungern, oder?"" Auf dem Heimweg ins Dorf fällt Alvin noch schnell einen Baum – Feuerholz für heute Abend. Und der nächste Stamm für die Holzkohleproduktion. Stand: 03.08.2015 16:18 Uhr "	2957	False
3819	SPD	32	31	spd.de	Sozialdemokratische Partei Deutschlands (SPD)	Unsere Zukunft in der digitalen Gesellschaft	Wir wollen aus dem technischen Fortschritt der Digitalisierung auch einen gesellschaftlichen Fortschritt machen.	website	https://www.spd.de/fileadmin/_processed_/csm_digitaleGesellschaft_34a6bdee33.png	https://www.spd.de/standpunkte/unsere-zukunft-in-der-digitalen-gesellschaft/	Unsere Zukunft in der digitalen Gesellschaft Offset Unsere Zukunft in der digitalen Gesellschaft Der digitale Wandel erfasst alle unsere Lebensbereiche. Wie schon im 19. Jahrhundert im Zuge der Industrialisierung stehen Gesellschaft und Politik heute wieder vor der Aufgabe, einer technischen Revolution einen Rahmen zu geben. Wir wollen aus dem technischen Fortschritt der Digitalisierung auch einen gesellschaftlichen Fortschritt machen. Chancen der neuen Technologien nutzen, Risiken klein halten. Dabei haben wir eine Debatte zu #DigitalLeben geführt und ein digitales Grundsatzprogramm erarbeitet. Digitale Wirtschaft Da, wo Bauteile über Sensoren mit der Maschine „kommunizieren“ und eine Wartung oder Reparatur „anfordern“, sind wir in der Zukunft angekommen: bei der Industrie 4.0. Die Vernetzung von Sensoren, Antriebselementen, Maschinen, Werkstoffen, Robotern und Anlagen macht eine Produktion flexibler und effizienter. Aufgaben werden aus diesem Netzwerk heraus zum Teil selbst gesteuert. Die Digitalisierung der Produktion ist für uns als Industrienation von ganz besonderer Bedeutung. Das betrifft den klassischen Industriezweig, den Mittelstand und den Dienstleistungssektor genauso wie die IT-Branche - mit ihren Start-ups und ihren etablierten Technologieunternehmen. Keine Frage: Wir haben Aufholbedarf – aber auch viel Potenzial! Die vierte industrielle Revolution findet längst statt. Das darf nicht unkontrolliert geschehen, denn sonst besteht die Gefahr, dass „große Player“ alle anderen vom Spielfeld drängen. Wir setzen Leitplanken! Starke Wirtschaft in der gerechten Gesellschaft Die Digitalisierung eröffnet Chancen und schafft Vereinfachungen – davon sollen auch alle Arbeitnehmer profitieren. Hier finden Sie mehr zur gerechten Wirtschaftspolitik der SPD. Weiterlesen Gute Arbeit in der digitalen Gesellschaft Und auch die Organisation der Arbeit verändert sich schnell und grundlegend. In vielen Berufen ist der Umgang mit Informationstechnik jetzt schon Alltag, neue Berufsbilder entstehen, feste Arbeitszeiten lösen sich auf – und das „Büro“ kann heute auch im Park oder im Wochenendhaus sein. Wie sieht künftig die Arbeitswelt in einer sozialen Marktwirtschaft aus? Wir brauchen Antworten – und zwar bald. Die gibt es nur, wenn wir uns alle auf die gleiche Idee und die gleiche Vorstellung von „Arbeit 4.0“ verständigen. Ein Konsens ist wichtig. Und wir wollen ihn gemeinsam mit Gewerkschaften, Arbeitgebern und Personalverantwortlichen entwickeln. Wir achten darauf, dass unter den neuen Bedingungen gute Arbeit gesichert und gestärkt wird. Bildung in einer digitalisierten Welt Aufstieg durch Bildung ist seit mehr als 150 Jahren Ziel unserer Politik. Aber was heißt das in der digitalen Revolution? Laptops auf jedem Tisch schon in der Grundschule? Smartboards an den Wänden? Programmieren als Unterrichtsfach für alle? Jedes Kind, jeder Erwachsene soll Zugang zu guter Bildung haben – nicht nur eine Elite. Jeder soll an der digitalen Entwicklung teilnehmen können. Wir wollen für schnelle, leistungsstarke Internetzugänge überall im Land sorgen. Auch für bezahlbares Internet für alle. Es gibt keinen Schritt zurück: Die Informationsmöglichkeiten im Internet und die sozialen Netzwerke haben unsere Gesellschaft bereits verändert. Wir wollen, dass sich unsere Kinder diese digitale Welt nicht alleine erschließen müssen. Wir wollen dass Schulen, Hochschulen und Weiterbildungsstätten Perspektiven für ein Leben und Arbeiten in der digitalen Welt eröffnen – unabhängig von sozialer Herkunft und unabhängig vom Geldbeutel. Gute Bildung für alle Ohne gute Bildung keine gute Zukunft. Darum wollen wir mehr Geld für Bildung zur Verfügung stellen. Hier finden Sie mehr Informationen zur Bildungspolitik der SPD. Mehr Unser digitales Grundsatzprogramm Die neuen Technologien bieten uns die Chance, unsere Grundwerte Freiheit, Gerechtigkeit und Solidarität weiterzuentwickeln. Die Vision von einem weltweiten Netz als Ort der individuellen und unternehmerischen Freiheit, als Ort der Kommunikation und als Ort der gesellschaftlichen Teilhabe kann Wirklichkeit werden. Wie, beschreiben wir mit unserem digitalen Grundsatzprogramm. Der digitale Wandel betrifft alle Lebensbereiche – wir haben Ideen, wie diese gestaltet werden können. Mehr dazu im Grundsatzprogramm >>> Mitglied werden Der digitale Wandel erfasst alle unsere Lebensbereiche. Wir wollen aus dem technischen Fortschritt der Digitalisierung auch einen gesellschaftlichen Fortschritt machen. Chancen der neuen Technologien nutzen, Risiken klein halten. Helfen Sie uns dabei - werden Sie SPD Mitglied. 	3819	False
6301	AfD	32	0	focus.de	FOCUS Online	Grüne fordern: 20 Euro pro Tag für jeden Deutschen, der Flüchtlinge aufnimmt		article	http://p5.focus.de/img/fotos/crop4856018/1732715308-w1200-h627-o-q75-p5/urn-newsml-dpa-com-20090101-150803-99-04305-large-4-3.jpg	http://www.focus.de/politik/deutschland/linke-und-fdp-unterstuetzen-vorschlag-gruener-fordert-20-euro-pro-tag-fuer-jeden-der-fluechtlinge-zuhause-aufnimmt_id_4863624.html	"von Harald Bayreuther schlägt dieser ""Volksvertreter"" vor und erhält von allen Seiten Unterstützung. Man will ja schließlich auf der Seite der Guten stehen und nicht als herzlos, oder schlimmer, als Rassist bezeichnet werden. Super Geschäftsidee. Ein Flüchtling ca 600 Euro im Monat. Da ist noch Luft nach oben (Familien): Stellt sich die Frage, sind diese Politiker eigentlich fähig die Konsequenzen ihrer Aussagen bis zum Ende zu bedenken, oder betreiben sie hier einen widerlichen Populismus, den sie Anderen gerne unterstellen. Wenn ich dann noch an die Aufwendungen für Bspw. Hartz4 Empfänger, Betreuungsgeld oder Taschengeld für Rentner in Pflegeheimen denke, fällt es schwer die Netiquette einzuhalten. Antwort schreiben 08.08.2015 von Wolfgang Nold Wenn hier 20 Euro pro Flüchtling und Tag bezahlt werden, und manche tatsächlich meinen, was das doch wieder kosten würde - was denken die dann? Dass Flüchtlinge für die 20 Euro zusätzlich importiert werden, um die deutschen Steuerkassen noch ein wenig mehr zu schröpfen und das Problem der nicht untergebrachten Flüchtlinge auf gleichem Niveau zu lassen - oder dass man schon hier vorhandene Flüchtlinge bei Privatpersonen unterbringt? Und wenn es zweiteres ist, was ist dann wohl günstiger für den Staat? 20 Euro bei einer Privatperson oder eine Unterbringung von staatlicher Seite her? Na? Nachdenken ist angesagt. Wer die Lösung kennt, kann sich ja melden. Oder den roten Daumen zücken. Ganz wie er will. Ist ja ein freies Land mit freiem Intellekt. Antwort schreiben 08.08.2015 von Karin  Möller Ich lese immer nur ""20 Euro für jeden der Asylanten aufnimmt"" also durchaus die Mehrzahl. Ich lese nirgends, dass es pro Asylant 20 Euro gibt. Ehe vermute ich mal, das die aufgenommene Anzahl keine Rolle spielt. Schon um Mißbrauch vorzubeugen ala 5 Leute im Minikeller einzuquartieren. Antwort schreiben 08.08.2015 von Eva Grübel Mehr als wie nach phrasen oder selber denken können die Grünen mit Politik auch nicht oder? Ich errriner in Italien: Italienischen Medien zufolge will der Staat 35 Euro pro Tag zahlen, wenn Menschen Flüchtlinge in den eigenen vier Wänden aufnehmen. Antwort schreiben 07.08.2015 von Ursula Oppermann Aufgrund des heute im Radio erwähnten Bevölkerungsrückganges aufgrund des dämagogischen Wandels besonders in den neuen Bundesländern, im Saarland und im Ruhrgebiet sollte es doch genug Wohnraum für die zugezogenen Facharbeiter geben. Nachdem der Osten industriemässig platt gemacht wurde, könnte er ja wieder aufgebaut werden, dann hätten die Facharbeiter auch Arbeit.oder bin ich einfach zu blöd und denke zu einfach. Ich glaube nicht, dass ich jemanden bei mir aufnehmen möchte, der aus einem ganz anderen Kulturkreis kommt und evtl. noch traumatisiert ist und ich weiss ja auch garnicht, was dieser Mensch vielleicht selbst verbrochen hat. Ich will mir auch deren Religion nicht aufschwätzen lassen, wenn mitlerweile behauptet wird, die Araber hätten überhaupt den Stein der Weisen gefunden. Antwort schreiben 07.08.2015 "	6301	True
6302	AfD	32	534	mopo24.de	MOPO24	aktuelle Nachrichten aus Sachsen und aller Welt			http://mopo24.de/assets/images/1/facebook_bild_neu-4c44ec81.png	https://mopo24.de/Home		6302	True
6311	AfD	32	3	mopo24.de	MOPO24	aktuelle Nachrichten aus Sachsen und aller Welt			http://mopo24.de/assets/images/1/facebook_bild_neu-4c44ec81.png	https://mopo24.de/Home		6311	True
6334	AfD	32	1	youtube.com	YouTube	Das EU-Parlament: Ein Nest voller korrupter Parasiten	Ein ausnahmsweise mal investigativer Bericht von RTL, indem der Parasitismus der EU-Abgeordneten entlarvt wird. Die Abgeordneten kassieren Spitzengehälter, o...	video	https://i.ytimg.com/vi/GGfUgFd3ILI/hqdefault.jpg	https://www.youtube.com/watch?v=GGfUgFd3ILI	Möchtest du dieses Video später noch einmal ansehen? Wenn du bei YouTube angemeldet bist, kannst du dieses Video zu einer Playlist hinzufügen. 	6334	True
