line	page	week	num_likes	domain	outlet	title	description	contenttype	image	url	text	id	right_of_center
1750	DieLinke	40	0	change.org	Change.org	Wir fordern den Rücktritt der Bundeskanzlerin Dr. A. Merkel und sofortige Neuwahl der Bundesregierung --- Resignation of the German Chancellor Dr. A. Merkel and immediate reelection of the German Government	Rücktritt der dt. Bundeskanzlerin Dr. Angela Merkel und sofortige Neuwahl der Bundesregierung    Frau Dr.  Merkel  handelt unverantwortlich nicht nur Deutschland gegenüber, sondern auch der EU und ganz Europa. Sie setzt Gesetze außer Kraft, ohne die Folgen zu bedenken. Sie und Ihre Regierung sind nicht...	change-org:petition	http://d22r54gnmuhwmk.cloudfront.net/photos/3/tb/jp/jkTBJPGQPoPBMwE-1600x900-noPad.jpg?1442112478	https://www.change.org/p/wir-fordern-den-rücktritt-der-bundeskanzlerin-dr-a-merkel-und-sofortige-neuwahl-der-bundesregierung-resignation-of-the-german-chancellor-dr-a-merkel-and-immediate-reelection-of-the-german-government	"Deutscher Bundestag Wir fordern den Rücktritt von Frau Dr. Merkel und sofortige Neuwahl der Bundesregierung. Frau Dr.  Merkel  handelt unverantwortlich nicht nur Deutschland gegenüber, sondern auch der EU und ganz Europa. Sie setzt Gesetze außer Kraft, ohne die Folgen zu bedenken. Sie und Ihre Regierung sind nicht mehr ""Herr der Lage“ und somit weder fähig Deutschland zu regieren noch bei für die EU relevanten Belange, weitreichende Entscheidungen zu treffen. Begründung: Frau Dr. Merkel und die amtierende Bundesregierung handelt seit Jahren nicht mehr im Sinne der deutschen Bevölkerung. Den Ausschlag dieser Petition gab zwar die aktuelle Flüchtlingspolitik, die nicht nur kurzfristig ein Potenzial des Verlustes  bzw. Gefährdung der inneren Sicherheit in sich birgt, sondern vor allem mittel- bis langfristig Deutschland und möglicherweise weitere EU-Länder nachhaltig verändern wird. Zu solchen einschneidenden und weitreichenden Veränderungen sollte die Bundesregierung ihre Handlungsstrategie transparent gestalten, die Sorgen der Bevölkerung wahrnehmen und sie bei diesbezüglichen Entscheidungen miteinbeziehen. Aber die aktuelle Flüchtlingspolitik ist nur eine Entscheidung von einer ganzen Reihe, die sich nicht förderlich auf das Wohl der eigenen Bevölkerung auswirken und/oder gegen deren mehrheitlichen Willen sprechen. Das Wohl und die Souveränität der eigenen Bevölkerung scheint demnach nicht mehr im Vordergrund zu stehen. Seit vielen Jahren wird den Bürgern mitgeteilt, dass sie den Gürtel enger schnallen müssen. Parallel dazu Kürzungen im Gesundheitssystem, im Bildungssystem und kulturellen Bereich.  Kürzungen im Sozialsystem, Kürzungen der Bezugsdauer des Arbeitslosengeldes, die Arbeitslosenhilfe und die Sozialhilfe werden zu ALG II (Hartz 4) zusammengefasst mit dem Prinzip „ Fordern und Fördern“, welches bedeutet das eine niedrige Grundsicherung den Anreiz schaffen soll eine Arbeit anzunehmen. Auch dann wenn sie wesentlich schlechter bezahlt wird als die vorherige. Jede legale Arbeit ist für ALG II-Empfänger zumutbar, lehnt er die Tätigkeit ab wird das ALG II für 3 Monate um 30% gekürzt. Das heißt, das auch einem Ingenieur eine Tätigkeit als Packer am Fließband zugemutet werden kann, selbst dann wenn er noch sein Bildungsdarlehen zurückzubezahlen hat und seine Fixkosten den Verdienst übersteigen. Hiermit wird Art. 12, Abs.2, GG bis zum Rand der Legalität beschnitten. Des Weiteren wurde damit der Niedriglohnsektor weiter vorangetrieben und stark ausgebaut. Zeitarbeitsfirmen, Leiharbeit, Minijobs, befristete Arbeitsverträge entstanden in schwindelerregender Schnelle und Höhe. Die Lebenshaltungskosten steigen schneller als die Rentenbezüge und Löhne. Laut Spiegel Online sind die Reallöhne von 1990 bis 2010 in machen Branchen um bis zu 50 % gesunken, im Durchschnitt auf ein Maximaltief von 4,3%. In diesem Jahr ist der Reallohn im selben Vergleich zwar um 1,3% gestiegen; zum Vergleich in Großbritannien bspw. um 26,1%. Teilt man diese Statistik zusätzlich nach Verdienstgruppen auf, bestätigt sich der Trend der auseinanderdriftenden Löhne und einer unsozialen Lohnentwicklung. Demgegenüber stehen die Unternehmensgewinne. Laut einer Publikation von Dipl.-Volkswirt Norbert Schwarz haben sich die gesamtwirtschaftlichen Unternehmensgewinne bspw. von 1991 mit 312 Mrd. EURO auf 672 Mrd. EURO im Jahr 2007 mehr als verdoppelt. Von einem einst guten und ausgeglichenen Gehaltsgefüge in Deutschland entwickelten wir uns zu einem „Lohndumpingland“. Der Abbau unseres Sozialsystems wird auch jetzt durch unsere amtierende Regierung weiter vorangetrieben und nicht gestoppt. Inzwischen sind knapp 300.000 Menschen obdachlos und die Zahl steigt weiter an, bis 2016 werden es ca. 380.000 Menschen ohne Wohnraum sein. Mehr als 300.000 deutschen Haushalten wird jedes Jahr der Strom abgestellt. Viele Familien können durch die geringeren Löhne kaum noch ihren Kindern gerecht werden bzw. eine ausgewogene, bildungsnahe gesellschaftliche Teilnahme ermöglichen. Ganz zu schweigen von 2,1 Millionen Kindern, die bereits unter der Armutsgrenze leben. Immer mehr Rentner rutschen in die Altersarmut, man begegnet immer mehr alten Menschen, die Flaschen sammeln müssen um auszukommen. Pflege- und Altersheime verkommen mehr und mehr zu lieblosen Massenabfertigungen. Alle hier aufgeführten Punkte zeigen auf: Die Bundesregierung wird den Grundbedürfnissen immer größer werdenden Teile der Bevölkerung nicht mehr gerecht. Die Unterstützer dieser Petition meinen, dass Art. 1 des GG durch diese Vorgehensweisen verletzt wurde und wird. Dieses Argument ist nicht juristisch, sondern in Anbetracht dessen, dass wir eines der reichsten Länder der Welt sind, moralisch zu verstehen. Die Steuereinnahmen sind in den letzten Jahren kontinuierlich gestiegen. Im ersten Halbjahr 2015 haben Bund, Länder und Gemeinden 21,1 Mill. Euro Steuerüberschuss erzielt - also mehr eingenommen als ausgegeben. Eine spürbare Entspannung, wie bspw. Steuererleichterungen hat sich für die dt. Bürger bisher aber nicht sichtbar gemacht. Viele öffentliche Einrichtungen wurden in den letzten Jahren verkleinert oder ganz geschlossen, Subventionen gekürzt oder ganz gestrichen. Polizei- und Verwaltungsstellen, Krankenhäuser und viele mehr wurden aus Gründen der zu hohen Kosten abgebaut. Wir haben es trotz des Bewusstseins dieser Probleme, bisher nicht geschafft ausreichend bezahlbaren Wohnraum in Ballungsräumen zu schaffen. Wir haben es nicht geschafft, genügend Kindergartenplätze für die eigene Bevölkerung zur Verfügung zu stellen. Wir haben es nicht geschafft die Kinder- und Altersarmut zu beseitigen. Wir haben es nicht geschafft, wieder eine freundlichere Familienpolitik zu führen, die es jungen Menschen erlaubt mit einem Gefühl einer kulturell und finanziell sicheren Zukunft eine Familie zu gründen. Wir haben es auch nicht geschafft alle Migranten zu integrieren und in den Großstädten ""No-go-Areas“ und Parallelgesellschaften zu verhindern. Stattdessen bekommt der religiöse Fundamentalismus langsam ein Gesicht in Deutschland. Wieso musste bisher so eisern gespart und abgebaut werden aber jetzt mit der aktuellen Flüchtlingspolitik wird mit einem fast schockierenden Tempo alles möglich gemacht, von Stellenaufbau in öffentlichen Ämtern über Kindergartenplätze und sozialem Wohnbau. Plötzlich scheinen die Mittel dazu nahezu unbegrenzt vorhanden zu sein. Einige Punkte zur Flüchtlingspolitik: - Die Bundeskanzlerin ist an Recht und Gesetz gebunden, dennoch setzt Sie sich in der Flüchtlingsfrage darüber hinweg. Ihre Aussagen, die sich weltweit verbreiten und besagen, dass wir für politisch Verfolgte keine Aufnahmeobergrenze haben und die Grenzen nicht geschlossen werden, ist nur dann sinnvoll und richtig wenn die Prüfung des Asylrechtes schnell und kontrolliert durchlaufen werden kann. Selbst klassische Einwanderungsländer lassen keine ungebremste und unregulierte Zuwanderung zu. Keine Gesellschaft kann eine andauernde unkontrollierte Masseneinwanderung verkraften. Europäische Verträge wie das Dublin III-Abkommen, die eine Kontrolle ermöglichen würden, werden nicht umgesetzt. Die Sicherheitsinteressen unseres Landes werden dadurch nachhaltig verletzt. Des Weiteren liegt in vielen Fällen eine Nichtbeachtung des Art.16a, Abs.2, GG vor. - Alleine für dieses Jahr werden 1,5 Mill. Flüchtlinge erwartet. Beachtet man die darauffolgende Familienzusammenführung kann man alleine für das Jahr 2015 von zwischen 4 und 7 Mill. Flüchtlingen ausgehen und der Strom reißt nach Medienartikel auch 2016 nicht ab. Abgelehnte Asylverfahren finden nur ungenügend Anwendung in der Abschiebung. Wir hatten Anfang des Jahres bereits 600.000 abgelehnte Asylbewerber in Deutschland, die bisher nicht abgeschoben wurden, sondern geduldet werden. - Sind die Flüchtlinge in Deutschland werden sie zumindest rhetorisch nicht mehr länger als Flüchtlinge, denen während der Dauer von Unruhen und Krieg Schutz gewährt werden muss, sondern als Zuwanderer behandelt. Die Gefahren für unsere freiheitlich demokratische Gesellschaft und deren Werte, sowie der drohende Transformationsprozess aufgrund unüberbrückbaren Differenzen der Kulturen in vielen Bereichen sind groß und realistisch. Dr. Merkel gefährdet durch ihr Vorgehen wissentlich die innere Sicherheit und den sozialen Frieden. - Mit der ausgeführten Vorgehensweise bietet Europa aber vor allem Deutschland, Anreize für illegale Einwanderung und kriminellen Schleppern. Die EU und die ""Offene-Arme-Politk“ bzw. Rhetorik von Frau Dr. Merkel lässt im Grunde zu, dass sich Menschen in Gefahr begeben bzw. in die Hände der Schlepper. Je mehr wir unkontrolliert und oftmals unregistriert aufnehmen, desto größer ist die Signalwirkung für weitere Flüchtlinge und Schlepper, die aus dem Leid Profit schlagen wollen. Nur wenn die illegale Einreise nicht zum Erfolg führt, wird man die Kontrolle zurückerlangen und den kriminellen Schleppern die Grundlage entziehen. Darüber hinaus besteht die Möglichkeit sich am Vorbild der Asylverfahren anderer Länder zu orientieren. - Die „Offene-Arme-Politk“ und Rhetorik von Frau Dr. Merkel bringt aber nicht nur Deutschland selbst stark in Bedrängnis, sondern andere EU-Länder durch die die Flüchtlinge auf Ihren Weg nach vor allem Deutschland reisen, ebenso. „Noch im Sommer hat man für dieses Jahr mit 800.000 Flüchtlingen in Deutschland gerechnet. Aktuelle Schätzung laufen auf 1,5 Millionen. Die Differenz von 700.000 geht auf das Konto von Angela Merkel und ihrer unverantwortlichen und vernichtenden Politik. Frau Merkel hat das Dubliner Abkommen außer Kraft gesetzt und verstößt gegen das deutsche Grundgesetz. Das darf sie nicht. Die meisten Menschen, die kommen sind Wirtschaftsmigranten und keine Kriegsflüchtlinge. Wer vier oder fünf sichere Länder durchquert, flüchtet vor keinem Krieg. Es ist eine Illusion zu glauben, das diese Immigranten für die deutschen Renten arbeiten werden, dafür ist der deutsche Mindestlohn eine viel zu große Barriere. Deutschland kann hauptsächlich nur Sozialleistungen anbieten. Frau Merkel hat offensichtlich vergessen wer sie gewählt hat und wen sie beschützen soll. Es ist höchste Zeit aufzuwachen und diese Invasion zu stoppen. Australien hat es vorgemacht."" (Richard Sulik aus der Slowakei, EU-Abgeordnerter, EU-Parlament, Brüssel) Weitere Themen bei denen das Vertrauen der Bevölkerung, die diese Regierung zur „Volksvertretung“ gewählt hat, nachhaltig erschüttert wurde und wird: BND/NSA - Affäre: Amerikanische Institutionen halten sich in Deutschland nicht an dt. Recht. Kein „No-Spy“-Abkommen, eine mögliche Teilnahme am „Five-Eyes“-Abkommen scheitert ebenfalls. Alle politischen Flüchtlinge haben Anspruch auf Asyl nur Edward Snowden nicht etc. Neue Atomraketenstationierung in Deutschland: März 2010: Bundestag beschließt mit breiter Mehrheit, die Bundesregierung solle sich „gegenüber den amerikanischen Verbündeten mit Nachdruck für den Abzug der US-Atomwaffen aus Deutschland einsetzen“. Mai 2014 bestätigte die Bundesregierung, die USA wolle ihre Atombomben in Deutschland einem „Lebensdauerverlängerungsprogramm“ unterziehen. Dies wurde nicht mit der Bundesregierung verhandelt. Außerdem soll der Steuerzahler die Erneuerungen mittragen. September 2015:  Die USA wollen 20 neue Atombomben in Büchel deponieren. Im Kriegsfall sollen deutsche Tornado-Piloten die Angriffe mit den US-Bomben fliegen. Das ist eine Verletzung der Artikel 1 und 2 des Vertrages über die Nichtverbreitung von Atomwaffen, NVV. Die Bundesregierung legte bisher kein Veto gegen die „nukleare Teilhabe“ der NATO ein etc. TTIP & CETA: Geheime Vertragsverhandlungen zwischen den USA und der EU. Keine ausreichende Transparenz trotz dahingehenden eingeleiteten Schritten. Die Mehrheit der Bevölkerung  lehnt TTIP und CETA in großen Teilen oder ganz ab. (3.263.920 Unterstützer der „Stop TTIP“-Petition) Mühsam erarbeitete Verbraucherschutzrechte laufen Gefahr ausgehöhlt zu werden. „Investorenschutz“ mit zweifelhafter demokratischer Legitimation etc. Ausstieg aus Atomkraft auf Kosten der Privathaushalte: Der BRM (Bundesverbandes Regenerative Mobilität) nimmt an, dass ""die EEG-Umlage ohne Befreiung der größten Energieverbraucher heute bei drei bis vier Cent pro Kilowattstunde (ct/kWh) liegen würde“. Tatsächlich liegt sie bei 6,170 ct/kWh. Erneuerbare Energie wird gedeckelt (2.500 Megawatt pro Jahr (MW/a)), wodurch der Wandel ausgebremst wird etc. ... Bankenrettung, Eurokrise, Euro-Rettungsschirm etc. ... OK Monika Hanutko startete diese Petition mit einer einzelnen Unterschrift und hat nun 255.785 Unterstützer/innen. Starten Sie heute eine Petition, um sich für Ihr Anliegen einzusetzen. Eine Petition starten "	1750	False
1760	DieLinke	40	128	youtube.com	YouTube	Aus den Fraktionen: Matthias Höhn zur Flüchtlingssituation am 28.09.2015	Pressekonferenz der Linken mit einem Statement von Matthias Höhn (Bundesgeschäftsführer) zur Flüchtlingssituation und zur gestrigen Rede von Bundespräsident ...	video	https://i.ytimg.com/vi/u8JmMRoKp5k/maxresdefault.jpg	https://www.youtube.com/watch?v=u8JmMRoKp5k	Möchtest du dieses Video später noch einmal ansehen? Wenn du bei YouTube angemeldet bist, kannst du dieses Video zu einer Playlist hinzufügen. 	1760	False
3170	DieGruenen	40	0	bild.de	BILD.de	Provokation 25 Jahre nach der Einheit - Grüne Jugend wünscht sich Auflösung Deutschlands	Twitter-Provokation zum Tag der Deutschen Einheit: Die Grüne Jugend wünscht sich die Auflösung Deutschlands!	article	http://bilder.bild.de/fotos/provokation-25-jahre-nach-der-einheit---gruene-jugend-wuenscht-sich-aufloesung-deutschlands-48272682-42881732/Bild/2.bild.jpg	http://www.bild.de/politik/inland/gruene-jugend/wuenscht-sich-zum-tag-der-deutschen-einheit-aufloesung-deutschlands-provokation-auf-twitter-42881382.bild.html	07.10.2015 - 18:39             Uhr Ganz Deutschland feiert am Samstag die Einheit vor 25 Jahren… Wirklich ganz Deutschland? Die Grüne Jugend hat offenbar eine andere Sicht der Dinge: Sie wünscht sich die Auflösung Deutschlands! In einem am Samstag veröffentlichten Tweet des Partei-Nachwuchses heißt es: „Am 3. Oktober wurde ein Land aufgelöst und viele freuen sich 25 Jahre danach. Warum sollte das nicht noch einmal mit Deutschland gelingen?“ Am 3. Oktober wurde ein Land aufgelöst und viele freuen sich 25 Jahre danach. Warum sollte das nicht noch einmal mit Deutschland gelingen? — GRÜNE JUGEND (@gruene_jugend) 3. Oktober 2015 Furchtbar viele Anhänger der Partei scheinen diese Ansicht aber nicht zu teilen: Der Beitrag wurde 39mal geteilt und von 50 Leuten als Favorit markiert. Und die Kommentare auf die grüne Provokation fielen wenig positiv aus: „Möge Euch der Blitz treffen“, heißt es da. Andere bezeichnen die Aussage als „Hasskriminalität“ oder empören sich über die „linken Deutschlandhasser“. Ein anderer User fragt: „Kann man eigentlich gut schlafen, wenn man etwas mit den 'Grünen' zu tun hat?“ Now playing @gruene_jugend Slime - Deutschland muss sterben https://t.co/Py2ma4l70C via @YouTube — Dirk Benninghoff (@neuigkeitenchef) 3. Oktober 2015 Reaktionen des Parteivorstandes auf den Tweet ihrer Nachwuchsorganisation gab es am Samstag nicht. Am Sonntag dann stellte Michael Kellner, politischer Bundesgeschäftsführer der Grünen, klar: „Wir wollen Deutschland natürlich nicht auflösen. 'Wir freuen uns über das vereinigte Deutschland, warum sollte eine Vereinigung nicht erneut auf Europäischer Ebene gelingen.' So wäre der Tweet politisch klüger gewesen, aber dann hätten sich auch viele nicht so schön aufregen können.“ Der frühere Europa-Abgeordnete Werner Schulz (65) zeigt sich wenig begeistert über die Provokation. Schulz zu BILD: „Der grüne Bundesvorstand sollte ganz schnell ein politisches Bildungsprogramm für die Grüne Jugend auflegen damit deren Rest Grips nicht verloren geht oder sich anstelle des Landes auflöst “ Und CDU-Generalsekretär Peter Tauber (41) sagt: „Kiffen ist eben doch schädlich. Das beweist der unglaubliche Stuss, den die Grüne Jugend zum Tag der Deutschen Einheit abgesondert hat.“ Vergrößern Peter Tauber ist Generalsekretär der CDU Foto: dpa Tauber zu BILD: „Wir können stolz sein auf unser Vaterland – ein Land, das mit allen Nachbarn in Frieden und Freundschaft lebt, das international Verantwortung übernimmt, das frei, demokratisch und offen ist, das für viele Menschen aus anderen Regionen ein Ort der Hoffnung ist.“ Er erwarte von der Grünen-Parteispitze „eine klare Distanzierung von der absurden und geschichtsvergessenen Forderung“. Entsetzt zeigte sich auch Hans Reichhart (33), Chef der Jungen Union Bayern. „Mit solchen Äußerungen verhöhnen die Grünen alle Menschen, die für die deutsche Einheit gekämpft haben“, so Reichhart zu BILD. 	3170	False
3176	DieGruenen	40	0	youtube.com	YouTube	KenFM-Positionen 2: Ethik oder Etat - Sind unsere Werte nur Börsenwerte?	Wann reicht es? Ein Prozent der Menschheit besitzt mehr als der Rest auf diesem Planeten. Diese Fakten haben mit dem vorherrschenden Wirtschaftssystem zu tun...	video	https://i.ytimg.com/vi/yfJ-bNUmVPM/maxresdefault.jpg	https://www.youtube.com/watch?v=yfJ-bNUmVPM	"Die Bewertungsfunktion ist nach Ausleihen des Videos verfügbar. Diese Funktion ist zurzeit nicht verfügbar. Bitte versuche es später erneut. Veröffentlicht am 29.09.2015 Wann reicht es? Ein Prozent der Menschheit besitzt mehr als der Rest auf diesem Planeten. Diese Fakten haben mit dem vorherrschenden Wirtschaftssystem zu tun, das vor allem denen nützt, die reich sind. Es ist buchstäblich ihr Reich, und alles, was in diesem Reich geschieht, hat sich nach zuvor von den Reichen auf den Weg gebrachten Gesetzen, Ansichten und Plänen zu richten. Mit Demokratie hat das wenig bis gar nichts zu tun, nur darf man das den Massen gegenüber nicht offen aussprechen, um eine weltweite Rebellion zu verhindern. Tarnen und Täuschen ist daher eines der Hauptanliegen der obszön reichen Eliten, deren elitärer Status sich ausschließlich auf den Nullen vor dem Komma stützt. Was der Otto-Normal-Bürger schlicht als ungerechte Verteilung aller weltweit erbrachten Güter bezeichnen würde, wird von den Eliten als Gesetzmäßigkeiten des Marktes verkauft. Immer ist es ein abstrakter Markt, der für alle Fehlentwicklungen verantwortlich ist. An diesen Markt hat man zu glauben wie an eine Religion. Schon wer hinterfragt, macht sich verdächtig und wird als Ketzer abgestempelt. Für den Markt hat nur Wert, was man zu Cash machen kann, was Profite verspricht, und da ist beispielsweise Ethik kein Produkt, mit dem man handeln könnte. Ethik lässt sich auf dem Markt weder kaufen noch verkaufen, und so hat sich der moderne Mensch im Kapitalismus gefälligst zu entscheiden! Ethik oder Etat? Nur muss er das wirklich? Lässt sich nicht Ethik und Etat unter einen Hut bringen? Und sind unsere Werte nur Börsenwerte? Diese Fragen stellen wir unseren vier Gästen der zweiten Ausgabe von Positionen: -Prof. Dr. Athanassios Giannis, Leiter des Instituts für organische Chemie der Universität Leipzig, -Peter König, der über 20 Jahre für die Weltbank Wasserentwicklungsprojekte geleitet hat, -Ernst Wolff, Autor des Buches ""Weltmacht IWF - Chronik eines Raubzuges"", -Albrecht Müller, Ökonom, ehemaliger Wahlkampfleiter von Willy Brandt und Kopf des alternativen Nachrichtenportals NachDenkSeiten. "	3176	False
3179	DieGruenen	40	0	youtube.com	YouTube	Die Flüchtlingskrise - Was die Medien verbergen	Die syrische Youtuberin SyrianGirlpartisan beschäftigt sich schon seit längerem mit der syrischen Politik, den Kriegen im Nahen Osten und der Interventionspo...	video	https://i.ytimg.com/vi/TK1TyizRoYo/maxresdefault.jpg	https://www.youtube.com/watch?v=TK1TyizRoYo	"Das interaktive Transkript konnte nicht geladen werden. Wird geladen... Die Bewertungsfunktion ist nach Ausleihen des Videos verfügbar. Diese Funktion ist zurzeit nicht verfügbar. Bitte versuche es später erneut. Veröffentlicht am 16.09.2015 Die syrische Youtuberin SyrianGirlpartisan beschäftigt sich schon seit längerem mit der syrischen Politik, den Kriegen im Nahen Osten und der Interventionspolitik der westlichen Staaten. Im aktuellen Video erklärt sie die Zusammenhänge der Flüchtlingskrise in Europa. Schon 2007 begannen die USA und die NATO, die radikalen, islamistischen, al-Qaida-nahen ""syrischen Rebellen"" zu unterstützen und so einen Bürgerkrieg in Syrien zu provozieren. Diese Terroristen wurden seither immer weiter darin unterstützt, Syrien zu zerstören und so die Syrer aus ihrem eigenen Land zu treiben. Hauptfinanzierer dieses Terrors sind die USA, die Türkei und Saudi Arabien, wobei insbesondere letztere eine dem IS nachstehende Ideologie haben. Syrien war noch vor 2007 ein so reiches und aufstrebendes Land, dass sie 2 Millionen irakische Flüchtlinge aufnehmen konnte, die wegen des Angriffskriegs der USA gegen den Irak 2003 geflüchtet waren. Und so verwundert es nicht, dass viele Syrer nichts weiter wollen, als in ihre geliebte Heimat zurück kehren, wo sie oftmals ein Haus, einen Beruf, Freunde und Hab und Gut zurück ließen. Umso perfider und hinterhältiger ist die Verzerrung der Situation durch westlichen Medien und Politiker. Die englische Sun-Zeitschrift titelte, dass Syrien zerbombt werden soll - für Aylan Kurdi, den syrischen Jungen, der tot am Meer gefunden wurde. Ironischerweise musste dessen Vater nur deshalb nach Europa, weil er eine Zahnoperation brauchte. Diese konnte er aber in Syrien, wo vorher das Gesundheitssystem kostenlos war, nicht mehr bekommen, weil das Land von der NATO und den vom Westen finanzierten ISIS-Terroristen zerstört wird. Darüber hinaus konnte seine Familie ihm die nötigen 14.000 Euro nicht überweisen, weil der Westen gegen Syrien Sanktionen verhängt. Und so wird klar, dass hier westlichen Medien und Politiker einen Zustand anklagen, den sie selbst verursacht haben. Im Video kritisiert SyrianGirlpartisan auch Israel für sein Moralaposteltum gegen die Europäer, während sie selbst keine Flüchtlinge aufnehmen, obwohl sie eine Grenze direkt zu Syrien haben. Auch die Türkei behandelt ihre syrischen Flüchtlinge nicht gut und finanziert im Gegenteil noch weiter die ISIS in Syrien. SyrianGirlpartisan ruft Europäer dazu auf, ihre eigenen Regierung zu stoppen, weiter gegen Syrien Krieg zu führen und stattdessen den syrischen Flüchtlingen zu helfen, wieder in ihre geliebte Heimat zurück zu kehren. "	3179	False
3183	DieGruenen	40	0	abendblatt.de		Flüchtlinge sind in Plön nun Schlossherren	170 Flüchtlinge zogen am Sonnabend in das 1881 erbaute Schloss. Auch in Wentorf bei Hamburg gibt es eine neue Unterkunft.	website	http://img.abendblatt.de/img/region/crop205800685/048260547-w820-cv16_9-q85/148E620034B20C5B.jpg	http://www.abendblatt.de/region/schleswig-holstein/article205800687/Fluechtlinge-sind-in-Ploen-nun-Schlossherren.html	Abmeldung Sie haben sich erfolgreich abgemeldet! Wenn Sie die bezahlpflichtigen Artikel wieder lesen wollen, können Sie sich jederzeit mit Ihrem Benutzernamen und Passwort erneut anmelden. Sind Sie sich sicher, dass Sie sich abmelden möchten? Angemeldet bleiben 	3183	False
