line	page	week	num_likes	domain	outlet	title	description	contenttype	image	url	text	id	right_of_center
362	Pegida	32	350	fr-online.de		Frankreich : Flüchtlinge besetzen Pariser Schule		article	http://www.fr-online.de/image/view/2015/7/6/31403398,34400384,highRes,Par8243734.jpg	http://www.fr-online.de/flucht-und-zuwanderung/frankreich--fluechtlinge-besetzen-pariser-schule-,24931854,31403290.html	 Von  Axel Veiel Einwanderer demonstrieren im Mode- und Designerviertel, später errichten sie hier auch ein Camp.  Foto: AFP Mitten in Paris besetzen Flüchtlinge eine Schule und verwandeln sie in ein Protestcamp. Nachbarn versorgen die Besetzer mit Essen, eine Räumung ist vorerst offenbar nicht geplant. Drucken per Mail Mitten in Paris besetzen Flüchtlinge eine Schule und verwandeln sie in ein Protestcamp. Nachbarn versorgen die Besetzer mit Essen, eine Räumung ist vorerst offenbar nicht geplant. Das Gitter vor dem Pariser Jean-Quarré-Gymnasium ist gut drei Meter hoch. Um den Weg zu Unterkunft und fließend Wasser dauerhaft zu verstellen, reicht das nicht aus. Mehr als 200 Flüchtlinge haben die Absperrung in den vergangenen Tagen überwunden. Unter den Blicken von Polizisten, die der Übermacht wenig entgegenzusetzen hatten, sind die Immigranten hinübergeklettert. Auf der anderen Seite haben sie Fahnen gehisst. „Öffnet die Grenzen“, steht darauf. Nachbarn bringen rund um die Uhr Lebensmittel. Hilfsorganisationen wie „Ärzte der Welt“, „Emmaus“ oder „Katholische Hilfe“ stellen Dolmetscher, die Arabisch oder Paschtu, eine der Hauptsprachen Afghanistans, sprechen können. Die Gelegenheit, das verwaiste Schulgebäude im Nordosten der französischen Hauptstadt zu besetzen, war günstig gewesen. Nicht nur die Schule, auch die hohe Politik macht Ferien. Von der Pariser Bürgermeisterin Anne Hidalgo bis hinauf zu Frankreichs Staatspräsidenten François Hollande haben die Mächtigen der Metropole den Rücken gekehrt. Zelte vor der Diskothek Das Katz- und Mausspiel zwischen Sicherheitskräften und Flüchtlingen, die hier ein besetztes Haus räumen, um wenig später ein anderes einzunehmen, geht so weitgehend unbeachtet von der Öffentlichkeit ohne große Zwischenfälle in die nächste Runde. Kurz vor dem Sturm auf die verwaiste Schule hatten andere Einwanderer bereits im Mode- und Designerviertel des 13. Arrondissements ein Camp errichtet. Nicht weit vom Seine-Ufer entfernt schlugen sie vor einer Diskothek ihre Zelte auf. Die überwiegend aus dem Sudan stammenden Flüchtlinge waren über Libyen und Italien nach Paris gekommen. Die in die Quarré-Schule Eingedrungenen hatten zuvor in besetzten Räumen der Frauenrechtsorganisation „Ni Putes Ni Soumises“ (Weder Huren noch unterwürfig) gelebt. In den vergangenen Tagen sahen sich die Feministinnen wachsendem Druck ausgesetzt, auf polizeiliche Räumung zu dringen. Um dem bevorstehenden Einsatz der Sicherheitskräfte zuvorzukommen, waren die Immigranten weitergezogen. Räumung nicht geplant Das ihnen als neue Bleibe dienende Gymnasium ist nur ein paar Straßenecken vom Sitz der Hilfsorganisation entfernt. Zu den wenigen Politikern, die in der Hauptstadt die Stellung halten und die Vorfälle kommentieren, zählt der Konservative Claude Goasguen. Der Nationalsekretär der konservativen „Republikaner“, beklagt, dass die vor vollendete Tatsachen gestellte Stadt klein beigebe. Die Besetzung des Quarré-Gymnasiums sei ein gefährlicher Präzedenzfall und für Flüchtlinge ein Anreiz, in noch größerer Zahl nach Paris zu kommen. Der stellvertretende Pariser Bürgermeister Bruno Julliard zeigt sich davon unbeeindruckt. Julliard hat eingeräumt, dass die Schule als Flüchtlingsunterkunft nicht geeignet sei, dann aber hinzugefügt: „Eine Räumung ist nicht beabsichtigt.“ Alles zum Thema Libyen finden Sie auf unserer Themenseite Libyen . AUTOR 	362	True
363	Pegida	32	413	jungefreiheit.de	JUNGE FREIHEIT	Mehr als 600.000 abgelehnte Asylbewerber in Deutschland	In Deutschland leben derzeit mehr als 600.000 abgelehnte Asylbewerber. Dies geht aus einer Antwort des Bundesinnenministeriums auf eine Anfrage von Bundestagsvizepräsident Johannes Singhammer (CSU) hervor. Demnach wurden 2013 etwa 15.000 Menschen aus Deutschland abgeschoben.	article	https://assets.jungefreiheit.de/2015/01/51438444-860x360.jpg	https://jungefreiheit.de/politik/deutschland/2015/mehr-als-600-000-abgelehnte-asylbewerber-in-deutschland/	Mehr als 600.000 abgelehnte Asylbewerber in Deutschland Aufgebrachte Asylbewerber in Berlin: 600.000 abgelehnte Asylsuchende in Deutschland Foto:  picture alliance/Geisler-Fotopress BERLIN. In Deutschland leben derzeit mehr als 600.000 abgelehnte Asylbewerber. Dies geht aus einer Antwort des Bundesinnenministeriums auf eine Anfrage von Bundestagsvizepräsident Johannes Singhammer (CSU) hervor. Demnach wurden 2013 etwa 15.000 Menschen aus Deutschland abgeschoben, berichtet der Cicero. Weitere 10.000 ausreisepflichtige Ausländer seien freiwillig ausgereist. „Wer einen Zugang nach Deutschland gefunden hat, insbesondere auch durch eine erfolgreiche Schleusung, hat mit einer erheblichen Wahrscheinlichkeit einen längeren oder faktisch dauerhaften Aufenthalt“, faßte Singhammer die Antwort des Ministeriums zusammen. In den vergangenen Jahren war die Zahl der Asylsuchenden gestiegen. 	363	True
365	Pegida	32	671	freiepresse.de	freiepresse.de	UPDATE: Sexueller Missbrauch auf Spielplatz - Tatverdacht gegen 22-Jährigen nicht erhärtet			http://www.freiepresse.de/IMG/FP_200px.jpg	http://www.freiepresse.de/LOKALES/CHEMNITZ/UPDATE-Sexueller-Missbrauch-auf-Spielplatz-Tatverdacht-gegen-22-Jaehrigen-nicht-erhaertet-artikel9267966.php	Willkommen im Archiv der Freien Presse! Sie interessieren sich für einen Artikel,     der älter als 3 Monate ist? Testen Sie das Digitalabo der Freien Presse ohne Artikelbegrenzung 	365	True
373	Pegida	32	249	mdr.de		MDR AKTUELL - Nachrichten aus Sachsen, Sachsen-Anhalt, Thüringen, Deutschland und der Welt | MDR.DE	Aktuelle Nachrichten, Videos und Liveticker aus Sachsen, Sachsen-Anhalt, Thüringen, Deutschland und der Welt.	website		http://www.mdr.de/nachrichten/verteilseite1124.html	Zur optimalen Darstellung unserer Webseite benötigen Sie Javascript. Bitte aktivieren sie dies in Ihrem Browser. Nachrichten 	373	True
376	Pegida	32	957	n-tv.de	n-tv.de	Fluchtversuche am Eurotunnel: Zugverkehr wegen Anomalie verspätet		article	http://bilder4.n-tv.de/img/incoming/crop15651751/8251324047-cImg_16_9-w1200/3qym3016.jpg	http://www.n-tv.de/politik/Zugverkehr-wegen-Anomalie-verspaetet-article15651056.html	"03.08.15 Rekordwert bei Zuwanderung Flüchtlingsgipfel wird wohl eilig vorgezogen Eine Inspektion im Inneren des Tunnels führte derweil am Dienstagmorgen zu Verspätungen im Zugverkehr unter dem Ärmelkanal. Es sei eine ""Anomalie"" festgestellt worden, teilte die Betreibergesellschaft Eurotunnel mit. Was genau vorgefallen war, wurde aber zunächst nicht bekannt - es könnte sich ebenso um einen technischen Defekt wie um in den Tunnel vorgedrungene Flüchtlinge handeln. Seit Wochen versuchen jede Nacht hunderte in Calais gestrandete Flüchtlinge, zum Eurotunnel vorzudringen. Sie hoffen, auf Lkw-Transportzügen nach Großbritannien zu gelangen, wo sie sich mehr Chancen ausrechnen als in Frankreich. Angesichts des Flüchtlingsandrangs wurden zuletzt die Sicherheitsvorkehrungen am Eurotunnel verschärft, die französische Regierung schickte zusätzliche 120 Polizisten. Bei den Fluchtversuchen gibt es immer wieder tödliche Unfälle, bei denen seit Anfang Juni zehn Flüchtlinge ums Leben kamen. Quelle: n-tv.de "	376	True
1597	DieLinke	32	0	youtube.com	YouTube	Wir BELTRETTER. (Langversion)	Hilf mit, unsere Ostsee und die Zukunft einer ganzen Region zu retten! Mehr Infos hier: http://beltretter.de	video	https://i.ytimg.com/vi/r-LSjE5c2PY/maxresdefault.jpg	https://www.youtube.com/watch?v=r-LSjE5c2PY	Möchtest du dieses Video später noch einmal ansehen? Wenn du bei YouTube angemeldet bist, kannst du dieses Video zu einer Playlist hinzufügen. 	1597	False
1599	DieLinke	32	0	youtube.com	YouTube	Alt und arm: 350 Euro zum Leben	Ursula von der Leyen hat mit dem Vorschlag einer Zuschuss-Rente eine hitzige Diskussion ausgelöst. Dabei gilt es als ungeschriebenes Gesetz, dass die Rente k...	video	https://i.ytimg.com/vi/TcCX9_d73X4/hqdefault.jpg	https://www.youtube.com/watch?v=TcCX9_d73X4	Möchtest du dieses Video später noch einmal ansehen? Wenn du bei YouTube angemeldet bist, kannst du dieses Video zu einer Playlist hinzufügen. 	1599	False
1602	DieLinke	32	890	linksfraktion.de		Fraktion DIE LINKE. im Bundestag - Die Welt von Atomwaffen befreien - Pressemitteilung	Die Welt von Atomwaffen befreien	article	http://medien.linksfraktion.de/bilder/logo-fraktion-linke.jpg	http://www.linksfraktion.de/pressemitteilungen/welt-atomwaffen-befreien/	"Die Welt von Atomwaffen befreien Foto: UN Photo/DB     2015 jähren sich die Atombombenabwürfe auf Hiroshima und Nagasaki zum 70. Mal. Dazu erklärt der Vorsitzende der Fraktion DIE LINKE, Gregor Gysi: ""Am 6. und am 9. August 1945 haben die Abwürfe zweier US-Atombomben auf die japanischen Städte Hiroshima und Nagasaki Hunderttausende getötet und verletzt. Auch 70 Jahre später leiden und sterben Menschen an den Spätfolgen der Explosionen. Wir trauern um die zahlreichen Opfer. Unser tiefes Mitgefühl gilt ihren Angehörigen. Diese schrecklichen Ereignisse sind zugleich Mahnung, die Welt von Atomwaffen zu befreien. Es ist höchste Zeit, dass diese Waffen endgültig geächtet und abgeschafft werden. So wichtig es war, die Atomgespräche mit dem Iran zu einem erfolgreichen Abschluss zu bringen, so sehr versagen die Atommächte bei der eigenen nuklearen Abrüstung. Die USA und Russland bringen ihre Arsenale auf den neuesten technischen Stand, von gemeinsamen Abrüstungsbemühungen kann keine Rede mehr sein. 70 Jahre nach den Atombombenabwürfen bedrohen immer noch mehr als 15.000 Atomwaffen die Menschheit, die mit diesen Waffen vielfach vernichtet werden könnte. Entgegen vergangener Ankündigungen aus der Bundesregierung sollen auch die in Deutschland verbliebenen US-Atomwaffen nicht abgezogen, sondern ab 2017 durch modernere ersetzt werden. Wir können glaubwürdig den Verzicht auf Atomwaffen nur durchsetzen, wenn die Atommächte ihre Atomwaffen ernsthaft abbauen, bis hin zu Null. Andernfalls hört das Bestreben, sich durch den Besitz von Atomwaffen unangreifbar zu machen, in vielen Ländern nicht auf. Auch Deutschland kann einen Beitrag zur nuklearen Abrüstung leisten. Das Erste wäre die Forderung nach einem Abzug der noch vorhandenen US-Atombomben in Deutschland. Zweitens muss die Bundesrepublik gerade vor dem Hintergrund der deutschen Geschichte auf die nukleare Teilhabe in der NATO durch die Bereitstellung von Trägersystemen, von Bundeswehrpersonal oder durch anderweitige Unterstützung verzichten. Griechenland und Kanada haben keine nukleare Teilhabe in der NATO. Sie waren die Ersten, die diesen Weg gegangen sind. Auch Deutschland muss diesen Weg jetzt gehen. Und zum Dritten muss die Bundesregierung den von der österreichischen Regierung entwickelten Plan für einen völkerrechtlich verbindlichen Vertrag zu unterzeichnen, der Atomwaffen verbietet. Hiroshima und Nagasaki mahnen, die Menschheit von der Geißel der Atomwaffen zu befreien. Angesichts der Vielzahl internationaler Konflikte ist diese Mahnung höchst aktuell.""   "	1602	False
1603	DieLinke	32	400	tagesschau.de	tagesschau.de	Ermittlungen gegen kritische Blogger: Ranges Schlag gegen Maas	Generalbundesanwalt Range hat Justizminister Maas heftig attackiert und seinem Ministerium vorgeworfen, Einfluss auf Ermittlungen genommen zu haben. Stimmt der Vorwurf, könnte es eng für Maas werden. Von Alexander Drechsel und Holger Schmidt.	website	https://www.tagesschau.de/multimedia/bilder/range-139~_v-videowebm.jpg	https://www.tagesschau.de/inland/range-137.html	"Hinweis: Falls die Videodatei beim Klicken nicht automatisch gespeichert wird, können Sie mit der rechten Maustaste klicken und ""Ziel speichern unter ..."" auswählen. Erklärung Harald Ranges im Wortlaut ""Zur Wahrung und Sicherung der Objektivität der Ermittlungen habe ich am 19. Juni 2015 ein externes Gutachten in Auftrag gegeben. Der unabhängige Sachverständige sollte klären, ob es sich bei den veröffentlichten Dokumenten um ein Staatsgeheimnis handelt. Der Sachverständige teilte mir gestern mit, dass es sich nach seiner vorläufigen Bewertung bei den am 15. April 2015 veröffentlichten Dokumenten um ein Staatsgeheimnis handelt. Der Sachverständige hat damit die Rechtsauffassung der Bundesanwaltschaft und des Bundesamtes für Verfassungsschutz insoweit vorläufig bestätigt. Die Bewertung des unabhängigen Sachverständigen habe ich dem Bundesministerium der Justiz und für Verbraucherschutz gestern unverzüglich mitgeteilt. Mir wurde die Weisung erteilt, das Gutachten sofort zu stoppen und den Gutachtenauftrag zurückzuziehen. Dieser Weisung habe ich Folge geleistet. Die Presse- und Meinungsfreiheit ist ein hohes Gut. Dieses Freiheitsrecht gilt aber nicht - auch nicht im Internet - schrankenlos. Es entbindet Journalisten nicht von der Einhaltung der Gesetze. Über die Einhaltung der Gesetze zu wachen, ist Aufgabe der Justiz. Diese Aufgabe kann sie nur erfüllen, wenn sie frei von politischer Einflussnahme ist. Daher ist die Unabhängigkeit der Justiz von der Verfassung ebenso geschützt wie die Presse- und Meinungsfreiheit. Auf Ermittlungen Einfluss zu nehmen, weil deren mögliches Ergebnis politisch nicht opportun erscheint, ist ein unerträglicher Eingriff in die Unabhängigkeit der Justiz. Mit Blick auf die im Raum stehenden Vorwürfe habe ich mich gehalten gesehen, die Öffentlichkeit hierüber zu informieren."" Mehr zu diesem Thema: "	1603	False
2939	DieGruenen	32	1	youtube.com	YouTube	Grüne Peinlichkeit EU Abgeordnete beim absahnen in Brüssel. Thema Europawahl	Das Thema passt gerade gut zur Europawahl. Auch wegen dem Wegfall der 3%-Hürde kommen diesmal viel mehr kleine Parteien ins EU-Parlament. Die AfD, Alternativ...	video	https://i.ytimg.com/vi/orNUPpgRP78/hqdefault.jpg	https://www.youtube.com/watch?v=orNUPpgRP78	Möchtest du dieses Video später noch einmal ansehen? Wenn du bei YouTube angemeldet bist, kannst du dieses Video zu einer Playlist hinzufügen. 	2939	False
2942	DieGruenen	32	0	youtube.com	YouTube	Wir BELTRETTER. (Langversion)	Hilf mit, unsere Ostsee und die Zukunft einer ganzen Region zu retten! Mehr Infos hier: http://beltretter.de	video	https://i.ytimg.com/vi/r-LSjE5c2PY/maxresdefault.jpg	https://www.youtube.com/watch?v=r-LSjE5c2PY	Möchtest du dieses Video später noch einmal ansehen? Wenn du bei YouTube angemeldet bist, kannst du dieses Video zu einer Playlist hinzufügen. 	2942	False
2944	DieGruenen	32	0	huffingtonpost.de	The Huffington Post	Grünen-Politiker fordert: 20 Euro am Tag für jeden, der Flüchtlinge bei sich aufnimmt	Der wachsende Flüchtlingsstrom bewegt die Deutschen wie kein anderes Thema. Überfüllte Asylbewerberunterkünfte und überforderte Kommunen machen vielen Menschen Angst. Und ein	article	http://i.huffpost.com/gen/3271166/images/o-FLCHTLINGE-ZUHAUSE-AUFNEHMEN-PRMIE-facebook.jpg	http://www.huffingtonpost.de/2015/08/06/praemie-fur-jeden-der-fluechtlinge-privat-aufnimmt_n_7946536.html	"E-Mail Kommentare Der wachsende Flüchtlingsstrom bewegt die Deutschen wie kein anderes Thema. Überfüllte Asylbewerberunterkünfte und überforderte Kommunen machen vielen Menschen Angst. Und ein Ende der verfahrenen Lage ist nicht in Sicht. Gestern erst sagte Vizekanzler Sigmar Gabriel (SPD) in der Huffington Post, dass die Zahl von Flüchtlingen noch länger auf einem hohen Level bleiben werde . Wahrscheinlich müssen wir völlig neu denken, um das Problem in den Griff zu bekommen. Das versucht jedenfalls Dieter Janecek, der wirtschaftspolitische Sprecher der Grünen im Bundestag mit einem radikalen Vorschlag: Er ist der Meinung, dass viel mehr Deutsche Flüchtlinge zuhause aufnehmen sollten - und dafür vom Staat belohnt werden. ""Ich bin dafür, dass Menschen motiviert werden, Gutes zu tun"", sagte Janecek der Huffington Post. ""Finanzielle Anreize für die private Aufnahme von Flüchtlingen wären wünschenswert. Dies würde insbesondere überforderte Kommunen schnell und wirksam entlasten."" Sein Vorschlag: ""20 Euro am Tag schweben mir vor – für maximal drei Monate."" Das wären 600 Euro im Monat – für eine gute Tat. Eine Idee, die für Aufsehen sorgen dürfte. ""Wenn Flüchtlinge darüber hinaus in einer Privatunterkunft bleiben, sollten danach 100 Euro im Monat an die Vermieter gezahlt werden. Und sinnvoll wäre auch die Übernahme von Risiken bei der Wohnungsvermietung beziehungsweise -abgabe."" Schon heute nehmen Menschen Flüchtlinge bei sich zuhause auf: Der CDU-Politiker Martin Patzelt etwa hat zwei Asylbewerber aus Eritrea bei sich einquartiert und fordert auch von anderen mehr Engagement. Das würde sich auch positiv auf die Integration auswirken. Bislang blieb die Zahl der Freiwilligen allerdings gering. Daher könnte Janeceks Vorschlag tatsächlich etwas bewegen. Umfrage Würdet ihr einen Flüchtling zuhause aufnehmen? Ja ABSTIMMEN Teilen Sie Ihre Stimme auf Facebook, damit Ihre Freunde an dieser Umfrage teilnehmen können. Bislang werden Flüchtlingen Miete und Heizkosten bis zu einer gewissen Höhe von der Kommune erstattet. Für alles andere müssen sie selbst aufkommen – mit dem Geld aus den Sozialleistungen, die sie erhalten . Die Menschen, die sie unterbringen, bekommen bisher nichts dafür. Der Vorschlag hat noch weitere Anhänger: ""Bürgerschaftliches Engagement für Flüchtlinge ist absolut begrüßenswert und sollte staatliche Unterstützung erfahren"", sagte die innenpolitische Sprecherin der Linken, Ulla Jelpke, der HuffPost.  Sie glaubt: ""Es verdient Anerkennung, wenn Menschen ihre Solidarität mit den Flüchtlingen zeigen und bereit sind, diese bei sich aufzunehmen. Grundsätzlich wäre ein finanzieller Ausgleich oder eine finanzielle Entlastung durch den Staat hier durchaus angemessen."" Die Befürworter des Flüchtlings-Bonus kommen aus allen politischen Lagern: “Ich finde, es ist eine gute Sache, Menschen finanzielle Anreize zu bieten, damit sie Flüchtlinge zuhause aufnehmen"", sagt Konstantin Kuhle, der Chef der Jungen Liberalen. ""Wir müssen die Unterbringung sowieso organisieren und bezahlen. Und wenn privater Wohnraum so besser erschlossen werden kann, bin ich dafür.” Doch die Befürworter sehen auch die Probleme einer solchen Idee: Linke-Politikerin Jelpke etwa gibt zu bedenken, dass “immer eine gewisse Missbrauchsgefahr” bestehe, wenn staatliche Pflichten gegen Bezahlung abgegeben werden. Und Jelpke hat Grund für ihre Skepsis. “In Berlin wurden erst kürzlich Fälle bekannt, in denen private Anbieter Profit aus dem Elend von Schutzsuchenden geschlagen haben, in dem sie Flüchtlinge völlig überteuert in Mietwohnungen oder Hostels untergebracht haben”, sagt sie. Auch wenn es sich bei diesen Negativbeispielen um Einzelfälle handele, müsse solcher Missbrauch durch entsprechende Schutz- oder Kontrollmechanismen vermieden werden. Lesen Sie auch: "	2944	False
2948	DieGruenen	32	0	change.org	Change.org	Gerechtigkeit für meine ermordete Tochter #Frederike: Der Mord muss gesühnt werden können	In der Nacht vom 4. November 1981 wurde meine siebzehnjährige Tochter vergewaltigt und brutal ermordet. Frederike war auf dem Weg vom Chor nach Hause und wollte - wie so oft - einige Kilometer nach Hause von Celle nach Hambühren trampen.   Der Angeklagte wurde damals trotz schwerwiegender Indizien freigesprochen....	change-org:petition	http://d22r54gnmuhwmk.cloudfront.net/photos/1/bo/ep/wRbOEPXhayjwuBp-1600x900-noPad.jpg?1449745896	https://www.change.org/p/gerechtigkeit-für-meine-ermordete-tochter-frederike-der-mord-muss-gesühnt-werden-können	103.853 Unterstützer/innen In der Nacht vom 4. November 1981 wurde meine siebzehnjährige Tochter vergewaltigt und brutal ermordet. Frederike war auf dem Weg vom Chor nach Hause und wollte - wie so oft - einige Kilometer nach Hause von Celle nach Hambühren trampen. Der Angeklagte wurde damals trotz schwerwiegender Indizien freigesprochen. Mehr als dreißig Jahre danach wurde der DNA-Test in der Kriminalistik zur Überführung von Straftätern eingesetzt und die DNA-Proben waren eindeutig: Der damalige Täter ist der mutmaßliche Mörder meiner Tochter, aber weiterhin auf freiem Fuß. Das ist unerträglich für mich. Es liegt daran, dass der Mann freigesprochen wurde. Nach bestehendem Gesetz ist es nicht möglich, ihn erneut des Mordes anzuklagen. Das Gesetz sagt: Mord verjährt aber nicht. Deshalb bitte ich Justizminister Heiko Maas und die Damen und Herren Abgeordneten des Deutschen Bundestages, § 362 der Strafprozessordnung zu ergänzen. Es muss möglich sein, ein Verfahren wieder zu eröffnen, wenn neue, vom Bundesgerichtshof anerkannte wissenschaftliche Methoden einen freigesprochenen Täter überführen. Mehrfach wurde mir gegenüber der vielbeschworene Begriff der „Rechtssicherheit” angebracht - wenn jemand in Deutschland freigesprochen ist, dann soll er auch die Sicherheit haben, dass er nicht erneut angeklagt werden kann. Es geht hier aber nur um die ganz wenigen Fälle eines falsch freigesprochenen Mörders. In Österreich, in England, in Finnland, in Norwegen und in Schweden ist in solchwen Fällen eine neue Gerichtsverhandlung bei neuen Beweismitteln vorgesehen. Nicht nur für Frederike, sondern für alle Betroffenen bitte ich Sie, sehr geehrter Herr Maas und alle Abgeordneten des Deutschen Bundestages, diskutieren Sie mit uns die Änderung des § 362 der Strafprozessordnung. ----- Auch nach dem Berufungsverfahren geht der Kampf weiter. Es stehen weitere rechtliche Schritte an. Nach wie vor wäre eine finanzielle Unterstützung für mich als Rentner notwendig. Auch mein Rechtsanwalt, der meine Angelegenheiten pro bono - ohne Bezahlung führt - soll seine Auslagen erstattet bekommen. Wir haben für mich ein sogenanntes Treuhandkonto eingerichtet, auf dem Spenden verbucht werden können. Mit dem hier eingenommenen Geld finanzieren wir ausschließlich die Gerichts- und Anwaltskosten im Mordfall meiner Tochter Frederike. Treuhand-Konto: 	2948	False
2954	DieGruenen	32	0	flickr.com	Flickr - Photo Sharing!	Willfähriger Paragraphenschmied: Ist die BRD ein Rechtsstaat?	Bildunterschrift: „Sag das nochmal, du Nazischwein!“	flickr_photos:photo	https://c2.staticflickr.com/4/3696/18921998565_08a5aa0091_b.jpg	https://www.flickr.com/photos/wiedenroth/18921998565/	Willfähriger Paragraphenschmied: Ist die BRD ein Rechtsstaat? Bildunterschrift: „Sag das nochmal, du Nazischwein!“   	2954	False
