line	page	week	num_likes	domain	outlet	title	description	contenttype	image	url	text	id	right_of_center
348	Pegida	32	596	ostsee-zeitung.de		Heiligendamm – Zoff wegen Gaffern am FKK-Strand / Bad Doberan / Region Rostock - OZ - Ostsee-Zeitung	Immer wieder mischen sich bekleidete Ausländer unter die freizügigen Badegäste an Heiligendamms FKK-Stränden. Die reagieren verärgert.	website	http://www.ostsee-zeitung.de/var/storage/images/oz/region-rostock/bad-doberan/zoff-wegen-gaffern-am-fkk-strand/254539107-3-ger-DE/Zoff-wegen-Gaffern-am-FKK-Strand_ArtikelQuer.jpg	http://www.ostsee-zeitung.de/Region-Rostock/Bad-Doberan/Zoff-wegen-Gaffern-am-FKK-Strand	Heiligendamm – Zoff wegen Gaffern am FKK-Strand Immer wieder mischen sich bekleidete Ausländer unter die freizügigen Badegäste an Heiligendamms FKK-Stränden. Die reagieren verärgert. Voriger Artikel Artikel veröffentlicht: Freitag, 07.08.2015 16:23 Uhr Artikel aktualisiert: Samstag, 08.08.2015 15:21 Uhr Nächster Artikel Zwei FKK-Strände gibt es in Heiligendamm. Die FKK-Fans wollen dort unter sich bleiben. Doch dabei gibt es Probleme. Quelle: Jens Wagner Tweet Heiligendamm. Gedankenlosigkeit, Unverständnis gegenüber einer anderen Kultur oder doch vorsätzliche Gafferei? An den beiden FKK-Stränden von Heiligendamm (Landkreis Rostock) häufen sich die Beschwerden über Flüchtlinge und Asylbewerber. Männer, die dort vollständig bekleidet immer wieder zwischen den nackten Badegästen herumspazieren, sich dabei laut unterhalten und offenbar mit Handys auch Fotos gemacht haben. Wie FKK-Fans, die sich in ihren besonders gekennzeichneten Strandabschnitten tummeln, und Menschen, die dort mehr oder weniger bekleidet vorbeigehen oder gar verweilen, miteinander auskommen, ist eine Sache von gegenseitigem Verständnis, Toleranz und Fingerspitzengefühl. Denn „ein Recht darauf, nackt unter sich am FKK-Strand zu sein, gibt es nicht“, erklärt Gerhart Kukla, Leiter des Bürgeramtes im Bad Doberaner Rathaus und Experte für kommunales Satzungsrecht. Bei nicht hinnehmbaren Belästigungen durch die bekleideten Strandbesucher am FKK wie Gaffen oder Fotografieren solle allerdings Anzeige erstattet werden.   	348	True
349	Pegida	32	1181	welt.de	DIE WELT	Rund 94.000 Asylbewerbern droht Wiedereinreise-Sperre	Deutsche Behörden dürfen nun Wiedereinreise- und Aufenthaltsverbote für abgelehnte Asylbewerber verhängen. Es liegen Fälle vor, in denen Familien vom Balkan viermal nach Deutschland einreisten.	article	http://m.welt.de/img/deutschland/crop144957721/3286933477-ci3x2l-w900/Bundespolizei-auf-der-Suche-nach-Fluechtlingen.jpg	http://m.welt.de/politik/deutschland/article144957722/Rund-94-000-Asylbewerbern-droht-Wiedereinreise-Sperre.html	"Rund 94.000 Asylbewerbern droht Wiedereinreise-Sperre Von Manuel Bewarder und Karsten Kammholz 08.08.15 202 Ein Fehler ist aufgetreten. Bitte laden Sie das Video neu. Hinweis: Bundesliga-Videos sind außerhalb von Deutschland nicht                                                    abspielbar. Das Bundesinnenministerium warnt mit einem Video Menschen aus dem Westbalkan davor, sich nach Deutschland schleusen zu lassen. Wer Schleppern Geld zahle, tausche sein Vermögen gegen Illusionen ein. Quelle: Bundesministerium des Innern Deutsche Behörden dürfen nun Wiedereinreise- und Aufenthaltsverbote für abgelehnte Asylbewerber verhängen. Es liegen Fälle vor, in denen Familien vom Balkan viermal nach Deutschland einreisten. Die Welt: Herr Schmidt, haben Sie so ein turbulentes Jahr als Chef Ihrer Behörde schon einmal erlebt? ""Musterunterkunft"": Der Chef des Bundesamtes für Migration und Flüchtlinge, Manfred Schmidt, in der Landeserstaufnahmestelle in Ellwangen. Seine Behörde ist für die Bearbeitung von Asylanträgen zuständig Foto: dpa Manfred Schmidt: So ein Jahr habe ich noch nicht erlebt, erst recht nicht hier im Bundesamt. Ich kann mich allerdings auch an Ausnahmesituationen als Beamter im Katastrophenschutz erinnern, etwa als vor einigen Jahren die Torffelder vor Moskau brannten. Aber so ein turbulenter Dauerzustand wie beim Asylkomplex ist schon neu für mich. Die Welt: Hadern Sie mit Ihrer Aufgabe? Schmidt: Nein. Trotz aller Probleme ist meine Aufgabe extrem spannend. Wir im BAMF machen ja noch mehr als nur Asylverfahren. Wir sind eine Integrationsbehörde. Mit unserer Arbeit und unseren Ideen verändern wir die Gesellschaft. Gleichwohl müssen wir feststellen: Wir sind im Krisenmodus. Unsere Herausforderungen sind nicht steuerbar. Dennoch sehen wir, dass wir die Herausforderungen meistern. Die Welt: Bund und Länder setzten das BAMF erheblich unter Druck: Die Bearbeitung der Asylverfahren dauert zu lange, rund 250.000 Anträge sind unbearbeitet. Was läuft schief? Schmidt: Klar, wir haben europaweit den größten Antragsstau, aber wir müssen europaweit auch die meisten Anträge bearbeiten. 52 Prozent der anhängigen Verfahren sind jünger als sechs Monate. ""Das System funktioniert gerade nicht mehr"" Ein Fehler ist aufgetreten. Bitte laden Sie das Video neu. Hinweis: Bundesliga-Videos sind außerhalb von Deutschland nicht                                                    abspielbar. Tag für Tag strömen neue Flüchtlinge nach Deutschland, brauchen Unterkunft, Essen, Frieden und eine Perspektive. Vor allem aber die Unterbringung stellt Städte und Gemeinden vor immer größere Probleme. Quelle: N24 Die Welt: Wann ist es zu schaffen, ein Verfahren in drei Monaten abzuschließen? So steht es im Koalitionsvertrag. Schmidt: Der Koalitionsvertrag stammt aus dem Jahr 2013. Damals hatten wir 127.000 Asylanträge. Für 2015 gehen wir derzeit von mehr als einer Verdreifachung aus. Das Ziel der drei Monate ist aber kein utopisches. Es liegt nicht allein an den Personalressourcen im BAMF – die ja derzeit erheblich ausgebaut werden, sondern auch am Personal der Länder. Sie haben ja versprochen, ihre Strukturen auszubauen. Das setzen sie auch um. Wir brauchen auch mehr Erstaufnahmeeinrichtungen in den Bundesländern. Die Welt: 2000 neue Stellen wurden Ihnen bewilligt. Wie schnell können die überhaupt besetzt werden? Schmidt: Der Nachtragshaushalt ist seit Anfang Juli in Kraft. Dieses Jahr kann ich 1000 Stellen besetzen, 2016 noch einmal bis zu 1000. Wir haben derzeit 2500 Bewerbungen, wir führen Hunderte Einstellungsgespräche. Wir erschaffen dabei eine dezentrale Struktur. Das BAMF hatte 2010 noch 22 Dienststellen, jetzt sind es schon 30, Ende des Jahres werden es 40 sein. Wenn alles nach Plan läuft, werden wir 2017 in 58 Dienststellen arbeiten. Für Streitereien um Zuständigkeiten haben die Menschen kein Verständnis Die Welt: Der nächste Flüchtlingsgipfel soll auf September vorgezogen werden. Was gehört auf die Agenda? Schmidt: Was uns wichtig ist, wurde bereits beim ersten Gipfel im Juni auf die richtige Spur gesetzt. Wir brauchen jetzt nochmal die Vergewisserung, dass sich die staatlichen Organe als Verantwortungsgemeinschaft verstehen. Die gegenseitigen Schuldzuweisungen, die wir gegenwärtig hier und da erleben, nützen gar nichts. Wir verstärken damit nur ein Vorurteil in der Bevölkerung, dass Behörden nach dem Motto verfahren: Schuld sind immer die anderen. Das ist vor allem ärgerlich, weil es auf der Arbeitsebene zwischen Bund und Ländern wirklich hervorragend läuft. Für Streitereien um Zuständigkeiten haben die Menschen kein Verständnis. Die Welt: Wie soll die Politik mit Asylbewerbern vom Balkan umgehen? Schmidt: Diese Asylbewerber sollten in den Erstaufnahmeeinrichtungen verbleiben, schnelle Verfahren erhalten und bei Ablehnung des Antrags, was ja hier der Regelfall ist, konsequent zurückgeführt werden. Das Balkan-Problem werden wir nicht nur mit neuen Ressourcen lösen können. Wir brauchen andere Lösungen. Eine können wir seit dieser Woche umsetzen. Wir haben seit 1. August die Befugnis im Aufenthaltsrecht, für Asylbewerber eine Wiedereinreisesperre und ein Aufenthaltsverbot für den gesamten Schengenraum zu verhängen, wenn deren Asylgesuch offensichtlich unbegründet ist. Wir senden ein spürbares Signal an die Menschen in den Herkunftsländern: Wenn du den Weg des Asylverfahren gehst, dann hast du höchstwahrscheinlich keine Chance, ein zweites Mal legal in unser Land zu kommen. Foto: Infografik Die Welt Die Welt: Wie vielen Menschen, die derzeit hier auf deutsches Asyl hoffen, wird die Wiedereinreise verboten? Schmidt: Die meisten Fälle betreffen Asylsuchende vom Balkan. Derzeit haben wir 94.000 Anträge vom Balkan im System. Fast alle von ihnen werden zusammen mit dem ablehnenden Asylbescheid die Mitteilung über die Wiedereinreisesperre und das Aufenthaltsverbot erhalten. Nur 0,1 bis 0,2 Prozent der Antragsteller vom Balkan haben einen tatsächlichen Schutzgrund. Auch Antragsteller aus Georgien oder Tunesien müssen mit Wiedereinreisesperren rechnen. Die Welt: Wäre eine Kürzung des Taschengelds eine wirksame Maßnahme? Schmidt: Es gibt ein Taschengeld über 143 Euro pro Monat für Asylbewerber. Der Betrag gilt eigentlich als Symbol. Aber diese Leistung wirkt anziehend. Wir haben festgestellt, dass die Summe nach einem Aufenthalt von drei bis fünf Monaten in Deutschland reicht, um davon im Herkunftsland dann neun bis zwölf Monate zu leben. Es gibt da möglicherweise einen Zusammenhang, dass 85 Prozent aller Asylbewerber vom Balkan in Deutschland ihren Antrag stellen. Auch mehr als die Hälfte der Folgeanträge kommt vom Balkan. Wir haben inzwischen Familien vom Balkan, die zum vierten Mal in Deutschland sind und um Schutz bitten. Mit den Worten Sozial- oder Asylmissbrauch weckt und verstärkt man Stimmungen. Das ist nicht mein Ziel Die Welt: Was planen Sie denn konkret? Schmidt: Schon jetzt wird im Asylbewerberleistungsgesetz eine Anspruchsminderung erwähnt. Ich würde daher vorschlagen festzuschreiben, dass diese insbesondere für sichere Herkunftsstaaten gilt. Die Bundesländer könnten bei der Versorgung in den Erstaufnahmeeinrichtungen zudem konsequent von Geld- auf Sachleistungen umstellen. Die Welt: Schafft man damit Asylbewerber zweiter Klasse? Schmidt: Nein. Wir haben Asylbewerber nach der Genfer Flüchtlingskonvention. Aber wir haben auch Antragsteller, die ihre Anträge offensichtlich aus anderen Gründen stellen. Die Welt: Mancher spricht von Sozialmissbrauch. Schmidt: Mit den Worten Sozial- oder Asylmissbrauch weckt und verstärkt man Stimmungen. Das ist nicht mein Ziel. Als Behörde müssen wir mit der Situation umgehen und Antworten finden. Die Welt: Der Bund hat den Ländern bereits signalisiert, dass man 2015 mit mehr als 450.000 Asylbewerbern rechnet. Wo landen wir? Schmidt: Das Bundesamt beobachtet die Entwicklungen ständig und passt die Prognose bei Vorliegen neuer Entwicklungen an. Insgesamt ist es sehr schwer, genaue Vorhersagen zu treffen. Die Welt: Die Länder fordern eine Erhöhung der Prognose auf bis zu 600.000 Asylanträge, um die Unterbringung und Versorgung in den Wintermonaten vorzubereiten. Schon jetzt gibt es zahlreiche provisorische Zeltstädte. Schmidt: Angesichts der Situation im Monat Juli ist das eine natürliche Entwicklung. Als Verwaltung haben sie jetzt gar keine andere Möglichkeit, als sich mit Zelten auszuhelfen, wenn so viele Menschen kommen. Die Länder haben derzeit alle Hände voll zu tun, Obdachlosigkeit zu verhindern. Deshalb ist es so wichtig, dass wir beim Balkan aktiv werden und den Zuzug aus dieser Region bremsen. Dann können wir endlich mehr Kapazitäten darauf verwenden, schutzbedürftigen Menschen wie aus Syrien oder dem Nordirak zu helfen. Zeltstädte müsste es dann nicht geben. Die Welt: Was halten Sie von den Plänen für ein Einwanderungsgesetz für qualifizierte Arbeitskräfte? Schmidt: Inhaltlich sehe ich derzeit kaum Nachbesserungsbedarf. Wir haben das liberalste Zuwanderungsrecht der Welt. Ein solches Einwanderungsgesetz könnte uns aber helfen, die notwendige Debatte über unser Selbstverständnis als Einwanderungsland anzustoßen. Um die Fragen ""Wo wollen wir hin?"" und ""Wer sind wir?"". Man kann überlegen, ob man die Höhe der Mindestqualifikation für Zuwanderer herabsetzt. Das Gute ist, dass ein Prominenter wie Til Schweiger der Bevölkerung zeigt: Ich kümmere mich um Flüchtlinge. Das ermuntert viele, sich in dem für sie möglichen Maße einzubringen Die Welt: In der Flüchtlingsdebatte mischt nun auch Til Schweiger mit. Der Schauspieler will eine ""Vorzeige""-Flüchtlingsunterkunft bauen . Wie kommt das bei Ihnen an? Schmidt: Da setzt sich das große ehrenamtliche Engagement fort, das wir überall im Bundesgebiet mitbekommen. Das fehlte Anfang der 90er-Jahre. Heute sammeln die Menschen Kleider, pensionierte Lehrer geben Deutschunterricht. Herr Schweiger ist nun etwas herausgehoben, weil er prominent ist und andere finanzielle Möglichkeiten besitzt, sich einzubringen. Ich muss aber auch sagen, dass es bereits Vorzeigeunterkünfte gibt. In Ellwangen habe ich eine Einrichtung besucht, die ich als Musterunterkunft bezeichnen würde. Die Verwaltung kann das also auch. Die Welt: Andere klingen euphorischer, wenn sie über Schweigers Engagement sprechen. Schmidt: Wenn jemand behauptet, dass er es besser kann, ist die erste Reaktion einer Verwaltung immer zunächst zurückhaltend. Schließlich leisten wir bereits viel und wissen, welche Tücken es gibt. Das Gute ist, dass ein Prominenter wie Til Schweiger der Bevölkerung zeigt: Ich kümmere mich um Flüchtlinge. Das ermuntert viele, sich in dem für sie möglichen Maße einzubringen. Hier soll das Flüchtlingsheim entstehen  ... mehr "	349	True
357	Pegida	32	230	focus.de	FOCUS Online	Gendergerechtes Schreiben - weil ungebildete Ideologen sich beleidigt fühlen!		article	http://p5.focus.de/img/fotos/crop4722695/8522717566-w1200-h627-o-q75-p5/urn-newsml-dpa-com-20090101-150602-99-04362-large-4-3.jpg	http://www.focus.de/finanzen/experten/briehl/saalmikrofoninnen-und-mikrofone-gendergerechtes-schreiben-weil-ungebildete-ideologen-sich-beleidigt-fuehlen_id_4836492.html	"Fehler melden Sie haben einen Fehler gefunden? Bitte markieren Sie die entsprechenden Wörter im Text. Mit nur zwei Klicks melden Sie den Fehler der Redaktion. Teilen und Details dpa/Bernd Weissbrod ""Saalmikrofoninnen und  mikrofone“ - so stand es jüngst, gendergerecht natürlich im Programmheft des Evangelischen Kirchentags in Stuttgart. „Saalmikrofoninnen und -mikrofone“ - so stand es jüngst - gendergerecht natürlich - im Programmheft des Evangelischen Kirchentags in Stuttgart. Überall wird gegendert, was das Zeug hält. FOCUS-Online Experte Ludwig Briehl kann über so viel Unverständnis der Sprache nur resignieren – fast jedenfalls. Wortbedeutungen können sich schon in sehr kurzer Zeit dramatisch verändern. Die Veränderungen erfolgen schleichend und sind von niemandem bewusst gesteuert. Worte wie “man”, “Mannschaft”, “Student” haben im Laufe der Zeit ihre Funktion der Geschlechtsbezeichnung verloren und sich zu überbegrifflichen Gattungsnamen, nämlich zu Bezeichnungen der Gattung Mensch als Ganzes weiterentwickelt. Wer behauptet, dass diese Veränderungen diskriminierend seien, der verkennt die Entwicklung der Sprache. Gendergerechtes Schreiben, definiert von Unfähigen, von vorgeblichen Experten, die sich erdreisten, die wahre Bedeutung von Sprache ignorierend bestimmte Formative als diskriminierend zu diskreditieren, soll mit aller Macht und gegen jede wissenschaftliche Erkenntnis zum Dogma erhoben werden. Als hätte sich die deutsche Sprache über Jahrhunderte in einen Hort der Diskriminierung von Frauen verwandelt, überschlagen sich nun plötzlich Politiker von Berlin bis Brüssel, vorwiegend rot-grüner Couleur, diese falschen Dogmen mit naiver, unkritischer Akzeptanz gehorsam umzusetzen und Bücher jeder Art “gendergerecht” umschreiben zu lassen. “Des Kaisers neue Kleider” sollen in zeitgenössischer Form neu aufgeführt werden. Darüber freut sich nur die Gilde der Buchdrucker. Saalmikrofoninnen auf dem Evangelischen Kirchentag in Stuttgart Auf dem Evangelischen Kirchentag in Stuttgart wurde ein neuer Höhepunkt des gendergerechten Schreibwahns erreicht, als die Teilnehmer des Kirchentags über das offizielle Programmheft eingeladen wurden, bei Diskussionsrunden “mitzureden und ihre Meinung deutlich zu machen über Saalmikrofoninnen und -mikrofone“. Man glaubt es nicht, hätte man es nicht gelesen. Über so viel Unverständnis von Sprache kann man eigentlich nur resignieren - fast jedenfalls. Homonyme - in unterschiedlichem Kontext unterschiedliche Bedeutung Die Sprachwissenschaft benennt als Grundelement der Sprache das Lexem, auch Formativ, als eine sprachliche Bedeutungseinheit beziehungsweise als Grundelement der Schrift. Lexeme, deren Ableitung ohne morphologische Veränderung erfolgt, nennt die Wissenschaft auch Homonyme. Beispiele sind Bank, Band oder umziehen. Nachdem ich mein Geld zur “Bank” gebracht hatte, setzte ich mich auf die “Bank” um auszuruhen. Sie wand sich ein “Band” ins Haar und griff zu einem “Band” moderner Essays. Bevor wir “umziehen”, muss ich mich erst noch “umziehen”. Gleiche Worte, gleiche Morphologie, jedoch ein jeweils gänzlich anderer Kontext. Klar zu erkennen: Allein der Kontext, in dem ein Homonym benutzt wird, bestimmt in völlig eindeutiger Weise, welche der möglichen Bedeutungen dem benutzten Formativ gerade jetzt beigemessen wird. Video: Wenn Siri diesen harmlosen Sprachbefehl hört, wählt sie automatisch den Notruf FOCUS Online/Wochit Wenn Siri diesen harmlosen Sprachbefehl hört, wählt sie automatisch den Notruf   Wer in einer Bäckerei einen “Berliner”, ein in Öl aufgebackenes Gebäck aus Hefeteig bestellt, erwartet bestimmt nicht, einen Menschen aus Berlin über die Ladentheke gereicht zu bekommen. Und kein Berliner fühlt sich beleidigt darüber, dass es ein Gebäck gleichen Namens gibt. So wie Berliner (zum Essen) phonetisch gleich klingt und doch nicht gleich Berliner (Einwohner der Stadt Berlin) ist, um noch viel weniger ist Mann (ein Mann) gleich man (jeder), da man ohnedies nicht morphologisch, sondern nur phonetisch gleich ist. Wenn Namen zu Gattungsbegriffen mutieren Panta rhei - alles fließt, erkannte schon der griechische Philosoph Heraklit. Dieser Satz gilt prinzipiell für das ganze Weltgeschehen, vor allem auch für die Sprache und die Bedeutungsinhalte von Formativen, von Worten, von Lexemen. Veränderungen von Bedeutungen erfolgen schleichend, von niemandem bewusst gesteuert, sie geschehen und schleichen sich in das Bewusstsein der Menschen allmählich ein. Die Formative “Tempo”- Papiertaschentuch, “Tesa” - Klebestreifen, “Uhu” - Klebstoff, “Fön” - Haartrockner sind einige Beispiele für ehemalige Markennamen. Zur Person Ludwig Briehl ist Persönlichkeitstrainer und Coach mit Sitz in Immendingen. Seine Trainings- und Coachingziele orientieren sich am Leitbild einer sozial verträglich handelnden Persönlichkeit. Sie hatten die ursprüngliche Bedeutung, ein Einzelprodukt mit erkennbarem Markennamen zu versehen, um es wiedererkennen zu können, und nichts anderes. Diese eindeutige Bedeutung haben sie jedoch allesamt schleichend verloren, denn sie haben sich jeweils zur Kennzeichnung einer ganzen Warengattung weiterentwickelt. Wer seine Haare “föhnen” will, kauft irgendeinen Haartrockner. Den Fön, eine ursprüngliche Marke der AEG, gibt es, wie die Firma selbst, längst nicht mehr. Er ist längst aus der Erinnerung gestrichen und hat als Kennzeichnung genau eines Produktes keine Bedeutung mehr. Nur als Gattungsname hat “Fön” nach wie vor Bestand. Marketing fürchtet die generalisierten Markennamen Im Marketing spricht man, wenn diese Weiterentwicklung eintritt, vom generalisierten Markennamen (GM), auch generischer Markenname genannt. Die Unternehmen hassen diesen Wandel, denn Werbung , für die eigene Marke bezahlt, wird auf diese Weise, ohne dass man etwas dagegen unternehmen könnte, zur Werbung für die ganze Gattung, also auch für die Produkte der Konkurrenz. Dieses Phänomen, dass bei Kampagnen des Marktführers auch die Umsätze der Konkurrenten steigen, ist sehr gut untersucht. Wenn ein Markenname eine solche generalisierende Funktion annimmt, verliert er sogar seinen Markenschutz, da die „Herkunftsfunktion” der Marke nicht mehr erfüllt ist. Sie wollen FOCUS-Online-Experte werden? Die Texte und Videos auf FOCUS Online entstehen in einem Team aus Redakteuren und Technikern. Daneben gibt es aber eine wachsende Gruppe von Menschen, die Inhalte beisteuern - und so wiederum sich selbst bekannt machen: die FOCUS-Online-Experten. Sie kennen sich besonders gut in einem Thema aus und wollen als regelmäßiger Gastautor eine große Leserschaft erreichen? Dann bewerben Sie sich unter experten@focus.de ! Übrigens: Sie dürfen auch gerne ein Video drehen. "	357	True
361	Pegida	32	534	merkur.de	http://www.merkur.de	CSU-Stadtrat will Flüchtlinge im Schloss Nymphenburg unterbringen	München - Das Münchner CSU-Stadtratsmitglied Marian Offman platzt mit einer ungewöhnlichen Idee in die Bemühungen um mehr Asyl-Unterkünfte: Er will Flüchtlinge im Schloss Nymphenburg unterbringen.	article	http://www.merkur.de/bilder/2015/08/05/5323033/922075699-schloss-nymphenburg-muenchen-Mo7p0qBbyef.jpg	http://www.merkur.de/lokales/muenchen/west/schloss-nymphenburg-fluechtlinge-vorschlag-csu-5323033.html	Ungewöhnliche Idee CSU-Stadtrat will Flüchtlinge im Schloss Nymphenburg unterbringen München - Das Münchner CSU-Stadtratsmitglied Marian Offman platzt mit einer ungewöhnlichen Idee in die Bemühungen um mehr Asyl-Unterkünfte: Er will Flüchtlinge im Schloss Nymphenburg unterbringen. Die Stadt müht sich ab, den vielen Flüchtlingen eine Schlafstatt zu besorgen – in alten Bürogebäuden, Containern und nun auch Zelten. Da platzt CSU-Stadtrat Marian Offman mit einer ungewöhnlichen Idee herein: Er schlägt vor, Asylbewerber möglicherweise im Schloss Nymphenburg unterzubringen. Konkret geht es ihm um den nördlichsten Teil des königlichen Prachtschlosses, das jährlich 300 000 Besucher anlockt: Der Trakt an der Maria-Ward-Straße 1a-k, zwischen dem Museum Mensch und Natur und dem Maria-Ward-Gymnasium, „steht offensichtlich schon seit Jahren leer“. Dies belegt Offman mit Fotos, die er seiner Stadtratsanfrage beigefügt hat. Darauf zu sehen sind Fenster, hinter denen offenbar niemand wohnt, und leicht heruntergekommene Fassaden. Da die Unterbringung von Asylbewerbern derzeit „außerordentlich problematisch“ sei, sollte „jeder freistehende Raum auf seine Eignung“ überprüft werden, findet Offman. Wöchentlich hat München zurzeit 225 Neuankömmlinge unterzubringen. Darum stelle sich auch die „dringende Frage“ nach der möglichen Nutzung des leerstehenden Maria-Ward-Trakts, schreibt der CSU-Stadtrat. Offman hat auch eine Idee, wer vorrangig ins Schloss ziehen könnte: alleinstehende Frauen mit Kindern, die aus Kriegsgebieten kommen. Für diese Familien würden sich die Räume an der Maria-Ward-Straße „besonders eignen“ – wegen der nahe liegenden Schulen. Nun will Offman prüfen lassen, wer über die Räumlichkeiten verfügt, welche Nutzungen dafür geplant sind und ob die Räume „kurzfristig temporär“ für Frauen mit Kindern oder unbegleitete Mädchen im Asylverfahren genutzt werden können. chu 	361	True
