line	page	week	num_likes	domain	outlet	title	description	contenttype	image	url	text	id	right_of_center
2633	DieGruenen	20	0	spiegel.de	SPIEGEL ONLINE	S.P.O.N. - Die Mensch-Maschine: Die Leute lieben die Macht und verabscheuen die Medien - SPIEGEL ONLINE	Angela Merkel hat in Sachen NSA und BND nicht die Wahrheit gesagt. Konsequenzen hat es keine. Skandalöse Enthüllungen werden gefahrlos ignoriert. Aber wer kontrolliert dann die Mächtigen?	article	http://cdn1.spiegel.de/images/image-848220-galleryV9-wmyd-848220.jpg	http://www.spiegel.de/netzwelt/netzpolitik/angela-merkel-luegt-dem-volk-ist-es-egal-lobo-kolumne-a-1033577.html	"Eine Kolumne von Sascha Lobo AP Kanzlerin Merkel: Die am wenigsten naive Frau der Welt Angela Merkel hat in Sachen NSA und BND nicht die Wahrheit gesagt. Konsequenzen hat es keine. Skandalöse Enthüllungen werden gefahrlos ignoriert. Aber wer kontrolliert dann die Mächtigen? Kolumne ""die Amerikaner sind auch bereit, mit uns ein so genanntes No-Spy-Abkommen zu verhandeln"". Das hat Angela Merkel im Bundestagswahlkampf am 11. September 2013 wörtlich gesagt . Es war gelogen. Schon Mitte August hatte der damalige Innenminister Hans-Peter Friedrich in einem Interview erklärt: ""Wir haben die Zusage, dass ein solches Abkommen bald abgeschlossen werden kann."" Der stellvertretende Chef der US-Botschaft schrieb daraufhin in einer E-Mail an Merkels engsten außenpolitischen Berater im Kanzleramt: ""Ich habe mich über die Äußerungen von Friedrich in der 'Rheinischen Post' gewundert. Das wird Washington noch mehr verwirren."" Zu diesem Zeitpunkt war Angela Merkel schon acht Jahre lang die mächtigste Frau der Welt. Sie hatte Dutzende Kontrahenten fachfrauisch zerlegt. Sie musste als politisch maximal erfahren gelten. Es ist ausgeschlossen, dass eine solche Person nicht den Sinngehalt dieser Diplomaten-Äußerungen versteht. Es ist ausgeschlossen, dass derart wesentliche Informationen wie die wiederholte Ablehnung eines No-Spy-Abkommens durch viele verschiedene amerikanische Stellen nicht an Merkels Ohr gelangten oder sie diese gar aus Naivität fehlinterpretierte. Angela Merkel ist nicht nur die mächtigste, sondern auch die am wenigsten naive Frau der Welt. Also hat Angela Merkel persönlich am 11. September 2013 gelogen. Aber was nun? Die Krise der entpolitisierten Öffentlichkeit ""Haha, Politiker lügen, irre Neuigkeit"", tönt es aus den Mündern der Blitzbirnen landesweit. Diese Mischung aus Zynismus und vermeintlicher Abgeklärtheit ist ein fatales Gift für die Demokratie - und zwar genau dann, wenn es bedeutet, sich mit der bloßen Feststellung zufrieden zu geben. Zweimal schon lag die Wahlbeteiligung bei Landtagswahlen unter 50%, und das scheint schlimm. Andererseits möchte man vielleicht gar nicht herausfinden, was die Nichtwähler angekreuzt hätten, wenn sie hätten wählen müssen. Es ist nicht klar, ob das Nichtwählen auf mangelndem politischem Interesse oder eher auf - durchaus nachvollziehbarer - Resignation beruht. Aber hinter beidem verbirgt sich ein weiteres, gravierendes Problem: eine Krise der entpolitisierten Öffentlichkeit. Anhand von Angela Merkels Lüge um NSA und BND offenbart sich diese Krise stärker als je zuvor. Da ist ein Problem-Elefant im Raum: Was, wenn trotz aller Enthüllungen genau nichts passiert? Was, wenn ein mediales Potpourri an beweisbaren Vorwürfen Angela Merkel einfach nicht dazu bringen kann, irgendwelche Konsequenzen zu ziehen? Merkels Macht wird größer, wenn nur wenige wählen Bleischwer fällt dann das geringe Politikinteresse der Bevölkerung zurück auf die Kontrollfunktion der Medien. Eigentlich absurd und kontraintuitiv, dass Merkels Macht größer wird, wenn weniger Leute wählen. Aber genau das geschieht. Das leider nicht unwahrscheinliche Szenario: Die Presse der Bundesrepublik schießt aus allen Rohren, trifft Merkel, offenbart ihr undemokratisches, katastrophales Verhalten - aber die verbleibenden Wähler wählen sie einfach trotzdem. Wenn Merkel schlicht so beliebt wäre, dass eine entpolitisierte Bevölkerung alle Verfehlungen abtropfen lässt, für unwichtig hält, für das kleinere Übel. Und der Rest am Wahltag enttäuscht zu Hause bleibt. Was angesichts der Alternativkanzlersituation nicht einmal unverständlich wäre. Das größtmögliche Begriffsgeschütz der Demokratie: ""Vierte Gewalt"" , so wirkmächtig stellt man sich die von der Verfassung geschützten, redaktionellen Medien vor. Das liest sich derart gut, dass bei praktisch allen Gelegenheiten von praktisch allen darauf verwiesen wird. Eine freie Presselandschaft schmückt ja auch ungemein. Aber faktisch hängt die Kontrollfunktion direkt und unmittelbar von der Mobilisierbarkeit der Wähler ab. Die Kontrolle der Politik durch die Redaktionen ist nichts wert, wenn eine Veröffentlichung keine Folgen hat. Denn die Kontrolle besteht im Wesenskern aus der Furcht der Politik, bei den nächsten Wahlen schlecht abzuschneiden. ""Politiker lügen halt, so what"" Mit einem Mal bekommen Begriffe wie ""Lügenpresse"" einen weiteren, schalen Beigeschmack. Die - zum Teil selbstprovozierte - Glaubwürdigkeitskrise der Medien bei der Bevölkerung kann die Kontrollfunktion bis zu dem Punkt schwächen, an dem der Bundesregierung im Ernstfall egal ist, was in der Presse steht. Da braucht es noch nicht einmal die FroMs, die ""Friends of Merkel"", also diejenigen Journalisten, die quer durch die Redaktionen selbst Fans von Angela Merkel sind. Ein gefährliches Ungleichgewicht ist entstanden: die Macht ist beliebt, die kontrollierenden Medien unbeliebt. Zusätzlich zur ohnehin bestehenden Refinanzierungskrise der professionellen Medien. Für die Leute in der Fußgängerzone mag sich das anfühlen wie ein uninteressanter Nebenschauplatz der ohnehin wenig interessanten Spähkatastrophe von BND bis NSA . Tatsächlich ist diese längst zu einem Kampf der Medien selbst geworden: Welche Macht hat die ""Vierte Gewalt"" überhaupt noch in ihrer Eigenschaft als demokratische Kontrolle? Es geht dabei nicht mehr um das klassische Kohlsche Aussitzen; sondern um das Merkelsche Aussitzen auf Speed, getrieben von der schieren, unerschütterlichen Beliebtheit der Kanzlerin. Gestärkt durch achselzuckendes Geplapper wie ""Politiker lügen halt, so what"". Im Raum steht die Ignorierbarkeit der Enthüllungen einer Medienlandschaft, die sich selbst immer als Korrektiv begreifen wollte. Und die vielleicht erkennen wird müssen, dass sie einer Illusion aufsaß - wenn derart substanzielle Lügen keine Konsequenzen mehr haben. tl;dr Der Kampf um BND und NSA ist auch ein Kampf um die Kontrollfunktion der Medien in der Demokratie. Können so große Lügen folgenlos bleiben? Newsletter Kolumne - Die Mensch-Maschine Ja, ich wünsche unverbindliche Angebote des SPIEGEL-Verlages und der manager magazin Verlagsgesellschaft (zu Zeitschriften, Büchern, Abonnements, Online-Produkten und Veranstaltungen) per E-Mail. Mein Einverständnis hierzu kann ich jederzeit widerrufen. "	2633	False
2643	DieGruenen	20	0	taz.de		Kommentar Deutsche Nichtwähler: Erosion der Demokratie	Die sinkende Wahlbeteiligung ist ein Warnsignal: Denn wenn die Politik die Wähler nicht mehr mitnimmt, dann entsteht ein gefährliches Gemenge.	article	http://www.taz.de/picture/42956/948/bremen_stadtmusikanten_wahlbeteiligung_2015_dpa.jpg	http://www.taz.de/!5008495/	Kommentar Deutsche Nichtwähler Erosion der Demokratie Die sinkende Wahlbeteiligung ist ein Warnsignal: Denn wenn die Politik die Wähler nicht mehr mitnimmt, dann entsteht ein gefährliches Gemenge. Schon die Bremer Stadtmusikanten meuterten, weil sie schlecht behandelt wurden.  Bild:      dpa Eine wirkliche Wahl hat nur, wer aus unterschiedlichen Angeboten aussuchen kann. In einer politischen Landschaft, in der relevante Unterschiede zwischen Parteien kaum noch auszumachen sind, gibt es diesen Begründungszusammenhang nicht mehr. Und es wundert kaum, dass immer weniger Menschen von ihrem Recht, frei und geheim zu wählen, Gebrauch machen. Seitdem CDU, SPD und Teile der Grünen immer ununterscheidbarer in die Mitte rücken, scheint es, als wäre Demokratie ein Geschäft geworden, bei dem in erster Linie Marktpotenziale über die Programme entscheiden. Schwerpunkte werden so gesetzt, dass möglichst viele jener Menschen erreicht werden, die sich von ihrer demokratischen Pflichtübung noch etwas versprechen. So entsteht eine gefährliche Spirale. Die Schichten, die traditionell sowieso eher politikfern sind, fühlen sich noch weniger repräsentiert und immer weiter abgekoppelt. Mit dem Effekt, dass sich noch weniger Politiker um die Armen, die Ausgegrenzten, die Unterprivilegierten bemühen. Theoretisch muss diese Entwicklung alle demokratischen Parteien beunruhigen. Denn die explosive Gemengelage, die entsteht, wenn sich weite Teile der Bevölkerung aus dem demokratischen Gefüge verabschieden, liegt auf der Hand: So entstehen Parallelgesellschaften, die ihren eigenen Regeln folgen, weil sie in den Regierungen und Parlamenten ja in der Tat keine Repräsentanten mehr haben. Praktisch ist natürlich besonders die SPD betroffen. Seit spürbar wird, welche Auswirkungen die Agenda 2010 hat und dass diese Reform dafür verantwortlich ist, dass es für die Unterschicht kaum mehr eine Möglichkeit gibt, einen gesellschaftlichen Aufstieg zu erreichen, hat sich ein wichtiger Teil der ehemals verlässlichen Stammwählerschaft endgültig verabschiedet. Diese ehemaligen Sozialdemokraten sind zu den Nichtwählern abgewandert, zu den Linken oder extremen Parteien wie der AfD. Es wird für die Sozialdemokratie existenziell sein, ob sie die Frage beantworten kann, warum man eigentlich noch SPD wählen soll. Allemal, wo es mittlerweile eine CDU gibt, die in den Merkel-Jahren viel Gutes von den Sozialdemokraten gelernt, kopiert und schließlich auch umgesetzt hat. Dabei geht es nicht nur um das Überleben einer Partei, sondern darum, wie repräsentativ unsere Demokratie tatsächlich noch ist.   	2643	False
2644	DieGruenen	20	0	youtube.com	YouTube	Heile Welt - Kindertraum (Heal the World) von Irena und die Regenbogenkids	Irena & die Regenbogenkids singen die 1.deutsche Coverversion zu Michael Jackson`s Earth-Song „ Heal the world „Heile Welt Kindertraum so heißt die deutsche ...	video	https://i.ytimg.com/vi/m4Qfpfz0RXM/hqdefault.jpg	https://www.youtube.com/watch?v=m4Qfpfz0RXM	Möchtest du dieses Video später noch einmal ansehen? Wenn du bei YouTube angemeldet bist, kannst du dieses Video zu einer Playlist hinzufügen. 	2644	False
3992	NPD	20	357	deutsche-wirtschafts-nachrichten.de	DEUTSCHE WIRTSCHAFTS NACHRICHTEN	Blamage für Merkel: US-Regierung führt Kanzlerin mit peinlichen Emails vor	Die öffentliche Demontage von Bundeskanzlerin Angela Merkel nimmt Fahrt auf. Nun wurden E-Mails bekannt, die zeigen, wie die Amerikaner die Kanzlerin knallhart auflaufen ließen. Die Dokumente werfen ein bemerkenswertes Licht auf die offenbar ziemlich hilflose deutsche Außenpolitik. Die Deutschen wurden von der US-Regierung behandelt wie kleine Schuljungen – und reagierten nicht zornig, sondern mit überraschender Unterwürfigkeit.	article	h	http://deutsche-wirtschafts-nachrichten.de/2015/05/10/blamage-fuer-merkel-us-regierung-fuehrt-kanzlerin-mit-peinlichen-emails-vor/	In einer gemeinsamen Erklärung haben Deutschland, Frankreich und Italien die Zukunft der EU beschworen. Angesichts der konkreten Probleme bleibt die Erklärung der drei EU-Staaten sehr allgemein. Wir dokumentieren die Erklärung im Wortlaut. Francois Hollande, Angela Merkel und Matteo Renzi am Montag in Berlin. (Foto: dpa) Gemeinsame Erklärung der Bundeskanzlerin der Bundesrepublik Deutschland, des Präsidenten der Französischen Republik und des Ministerpräsidenten der Italienischen Republik: Die britische Bevölkerung hat am 23. Juni 2016 mehrheitlich ihren Wunsch zum Ausdruck gebracht, die Europäische Union zu verlassen. Deutschland, Frankreich und Italien respektieren diese Entscheidung. Wir bedauern, dass das Vereinigte Königreich nicht länger unser Partner innerhalb der Europäischen Union sein wird. Wir sind voller Zuversicht, dass die Europäische Union stark genug ist, um die richtigen Antworten zu geben. Wir haben keine Zeit zu verlieren. Heute geben wir ein starkes Bekenntnis zur europäischen Einigung ab. Wir sind fest davon überzeugt, dass die Europäische Union unerlässlich ist, um unsere Staaten durch gemeinsames Handeln zu stärken, zusammen mit unseren gemeinsamen Institutionen, um den wirtschaftlichen und sozialen Fortschritt für unsere Bevölkerung sicherzustellen, und um Europas Rolle in der Welt zu behaupten. Seit fast 60 Jahren bildet die EU eine einzigartige Gemeinschaft der Rechtstaatlichkeit, der Freiheiten und Rechte sowie der gemeinsamen Werte. Die EU versetzt uns in die Lage, unser europäisches Gesellschaftsmodell zu behaupten, das wirtschaftlichen Erfolg mit sozialer Verantwortung vereint. Die EU ermöglicht es uns, unsere kulturelle Vielfalt zu bewahren. Der Binnenmarkt, unsere Gemeinschaftspolitiken und der Euro sind weltweit einzigartig. Diese Errungenschaften sind die Grundlage unseres Wohlstands. Gemeinsam fördern wir unsere Interessen mit dem Ziel, freien und fairen Handel in der Welt zu gewährleisten. Gemeinsam schreiten wir in unserer Energiepolitik voran und leisten unseren Beitrag für den weltweiten Klimaschutz. Gemeinsam tragen wir in der Welt zu Stabilität und Entwicklung bei und fördern den Frieden. Es ist ebenso unsere Überzeugung, dass die Europäische Union nur dann wieder vorangebracht werden kann, wenn sie weiterhin von ihren Bürgerinnen und Bürgern getragen wird. Die Europäische Union muss sich daher den Sorgen widmen, die ihre Bürgerinnen und Bürger zum Ausdruck bringen, indem sie ihre Ziele und ihre Funktionsweise klarstellt. Sie sollte stärker sein bei den wesentlichen Prioritäten, bei denen die Europäer ihre Kräfte bündeln müssen, und sich dort zurücknehmen, wo die Mitgliedstaaten besser handeln können. Sie bleibt unter der demokratischen Kontrolle ihrer Bürgerinnen und Bürger und muss verständlicher werden. Sie muss schneller handeln, insbesondere bei der Umsetzung von Programmen und Projekten, von denen die Bürgerinnen und Bürger direkt profitieren. In einer sich wandelnden Welt sollte die Europäische Union ihre wesentlichen Errungenschaften erhalten und sich auf die aktuellen Herausforderungen konzentrieren. Dazu gehören die weltweiten Migrationsbewegungen und neue Bedrohungen, wie insbesondere der internationale Terrorismus, den kein einzelner Mitgliedstaat alleine bewältigen kann. Sie muss ebenso die Fähigkeit der Europäer stärken, im zunehmenden internationalen Wettbewerb zu bestehen, und gleichzeitig die europäische soziale Marktwirtschaft stärken. Wir schlagen daher drei prioritäre Bereiche für ein vertieftes gemeinsames Handeln vor, basierend auf konkreten Zielen: Innere und äußere Sicherheit: Europa ist großen Herausforderungen ausgesetzt. Diese erfordern eine Stärkung der gemeinsamen Maßnahmen zum Schutz unserer Außengrenzen und für Frieden und Stabilität in unserer Nachbarschaft, insbesondere im Mittelmeerraum, in Afrika und im Nahen und Mittleren Osten. Wir werden im Kampf gegen den Terrorismus in Europa nur dann erfolgreich sein, wenn wir gemeinsam handeln. Wir werden den Terrorismus nur dann bezwingen, wenn wir uns der Aufgabe gewachsen zeigen, das Gemeinschaftsgefühl wieder aufzubauen und in unseren Städten gegen soziale Ausgrenzung vorzugehen. Wir werden unserer Verantwortung gerecht, wenn wir unsere europäische Verteidigung weiterentwickeln und für unsere gemeinsamen Operationen, unsere militärischen Fähigkeiten und unsere Industrie die notwendigen Verpflichtungen eingehen. Das Potenzial einer echten gemeinsamen Außen-, Sicherheits- und Verteidigungspolitik wurde bisher nicht voll ausgeschöpft. Starke Wirtschaft und starker sozialer Zusammenhalt: Europa muss sein Wohlstandsversprechen an seine Bevölkerung halten. Wir brauchen mehr Wachstum, um Arbeitslosigkeit zu bekämpfen und Arbeitsplätze zu schaffen, insbesondere für junge Menschen. Wir brauchen mehr Investitionen, um die Stärke unserer Wirtschaft im globalen Wettbewerb zu sichern. Für den Erfolg unseres Sozial- und Wirtschaftsmodells, das wirtschaftliche Stärke mit sozialer Verantwortung vereint, brauchen wir die richtigen Rahmenbedingungen; bessere Politiken für Unternehmertum und Beteiligung am Arbeitsleben; eine Stärkung von Forschung, Innovation, Aus- und Weiterbildung, die aufgrund des auf Wissen und den Fähigkeiten der Bürgerinnen und Bürger basierenden Wohlstands Europas eine Schlüsselrolle spielen; die Entwicklung der digitalen Wirtschaft in Europa für bessere Dienstleistungen, eine modernisierte Industrie und Beschäftigung; die Nutzung des vollen Potenzials der Energie- und Klimapolitik zum Schutz der Umwelt. Für die Länder, die den Euro als Währung nutzen, werden weitere Schritte nötig sein, um Wachstum, Wettbewerbsfähigkeit, Beschäftigung und Konvergenz zu stärken, einschließlich im Bereich der Sozial- und der Steuerpolitik. Ambitionierte Programme für die Jugend: Europa wird nur dann erfolgreich sein, wenn es seinen jungen Menschen Hoffnung gibt. Wir müssen die europäischen Initiativen für Fort- und Weiterbildung, Unternehmertum und europaweiten Zugang zu Arbeitsplätzen stärken. Dazu zählen etwa die Jugendbeschäftigungsinitiative und das Erasmus-Programm für Studierende, Auszubildende und junge Berufstätige. Die Europäische Union verkörpert unsere gemeinsamen Werte: Wir streben nach Frieden und Freiheit, nach Demokratie und Rechtsstaatlichkeit, nach gegenseitigem Respekt und Verantwortung, nach Toleranz und Partizipation, nach Gerechtigkeit und Solidarität. Heute ist der Tag, diese Werte zu bekräftigen. Wir werden morgen den Staats- und Regierungschefs und den europäischen Institutionen vorschlagen, einen Prozess in Gang zu setzen auf Grundlage eines konkreten Zeitplans und präziser Verpflichtungen, um Antworten auf die Herausforderungen zu finden, die sich aus dem Ergebnis des Referendums im Vereinigten Königreich ergeben, und um konkrete Lösungen für eine gute Zukunft der EU und ihrer Bürgerinnen und Bürger zu entwickeln. Auf dieser Grundlage sollten die Staats- und Regierungschefs im September die gemeinsamen Herausforderungen diskutieren, vor denen die 27 Mitgliedstaaten stehen, sowie die wesentlichen Prioritäten, über die sie entscheiden müssen. Sie sollten sich auf konkrete Projekte verständigen, die in Europa in den nächsten sechs Monaten für Wachstum und Sicherheit umgesetzt werden. Die Arbeit an der Umsetzung der notwendigen Initiativen sollte unmittelbar beginnen. Beiträge von internationalen Persönlichkeiten können die Diskussionen der Staats- und Regierungschefs über die europäischen Perspektiven im globalen Kontext befruchten. Die Treffen des Europäischen Rates im Oktober 2016 und Dezember 2016 werden uns die Gelegenheit geben, den diesbezüglichen Fortschritt festzustellen und die notwendigen Leitlinien festzulegen. Der 60. Jahrestag der Unterzeichnung der Römischen Verträge am 25. März 2017 wird ein wichtiger Moment sein, um die Einheit Europas und unser gemeinsames Bekenntnis zum europäischen Projekt zu bekräftigen. 	3992	True
5658	AfD	20	0	change.org	Change.org	Deutscher Bundestag: Einführung von Volksabstimmungen auf Bundesebene als Ergänzung zur repräsentativen Demokratie!	Die repräsentative Demokratie hat sich in der Bundesrepublik Deutschland bewährt. Doch auch der Wunsch nach mehr direkter Demokratie (in Form von Volksabstimmungen) wächst in der Bevölkerung. Laut einer aktuellen Bertelsmann-Studie wünschen sich 80% der Deutschen mehr Bürgerbeteiligung auf Bundesebene,...	change-org:petition	http://d22r54gnmuhwmk.cloudfront.net/photos/7/uj/no/joUJNooeCJYsroi-1600x900-noPad.jpg?1431816526	https://www.change.org/p/deutscher-bundestag-einführung-von-volksabstimmungen-auf-bundesebene-als-ergänzung-zur-repräsentativen-demokratie	Liebe Change.org-Nutzerinnen und -Nutzer, wir setzen auf Change.org Cookies ein, um Ihnen möglichst viele interessante Inhalte anzuzeigen. Weitere Informationen. OK, das habe ich verstanden Zum Hauptinhalt wechseln 	5658	True
5660	AfD	20	1	rundschau-online.de	Kölnische Rundschau	Wohnheim in Lindlar: Flüchtlinge schlachten Ziege	Ein unappetitlicher Vorfall hat sich Dienstagnacht in der Unterkunft für Asylbewerber im alten Pfarrer-Braun-Haus abgespielt. Bewohner haben eine Ziege geschlachtet. Woher das Tier kommt, ist unbekannt. Die Polizei ermittelt. Eine Sprecherin der Kreispolizei berichtet, dass die Beamten Zeugen vernommen ...	article	http://www.rundschau-online.de/image/1629646/2x1/940/470/787380b81c68c04da668779f8afa9c55/hw/pfarrer-braun-haus2.jpg	http://www.rundschau-online.de/region/oberberg/wohnheim-in-lindlar-fluechtlinge-schlachten-ziege-1096456	Das alte Pfarrer-Braun-Haus in Lindlar wird teilweise als Unterkunft für Asylbewerber genutzt. Das frühere Alten- und Pflegeheim steht ansonsten leer. (Archivfoto) Foto: Schmitz Lindlar - Ein unappetitlicher Vorfall hat sich Dienstagnacht in der Unterkunft für Asylbewerber im alten Pfarrer-Braun-Haus abgespielt. Bewohner haben eine Ziege geschlachtet. Woher das Tier kommt, ist unbekannt. Die Polizei ermittelt. Eine Sprecherin der Kreispolizei berichtet, dass die Beamten Zeugen vernommen haben. Die Ermittler wollen herausfinden, wer von den rund 30 Bewohnern der Unterkunft für den Zwischenfall verantwortlich ist. Diverse Anzeigen liegen wegen Sachbeschädigung und Verstößen gegen das Tierschutzgesetz vor. Auch das Kreisveterinäramt war vor Ort und hat die „Bunte Deutsche Edelziege“ untersucht, bevor der Kadaver entsorgt wurde. Es ist nicht der erste Zwischenfall in der Unterkunft, die seit Anfang des Jahres von der Gemeinde genutzt wird. Von dem früheren Seniorenheim an der Breslauer Straße ist nur ein Teilbereich hin zur Berliner Straße mit Flüchtlingen belegt. Anwohner berichten seit Wochen, dass es Probleme gebe. Von Pöbeleien bis hin zur Müll in der Nachbarschaft. Das könnte Sie auch interessieren Wohnheim für Asylbewerber: Nachbarschaftsfest mit den Flüchtlingen Hausherr ist die Gemeinde Lindlar, die den Zwischenfall ebenfalls auf Anfrage bestätigt hat. Derzeit verschafft sich die Verwaltung einen Überblick über das Geschehen. „Es gibt diverse Tatbestände“, bestätigt Bürgermeister Dr. Georg Ludwig. Mit dem Töten der Ziege sei allerdings „eine Grenze überschritten“ worden. Welche Konsequenzen die Verwaltung ziehen wird, steht noch nicht fest. Ludwig betonte, dass es bereits permanente Kontrollen vor Ort gebe. Die Unterkunft werde täglich von Mitarbeitern der Gemeinde besucht. „Insbesondere auch wegen sozialer Belange“, so Ludwig. Nun sollen die Kontrollen in der Unterkunft verstärkt werden, damit „sich solche Vorfälle nicht wiederholen“, bekräftigt der Bürgermeister. Zuerst will die Verwaltung nun begutachten, welche Sachschäden genau entstanden sind und diese dann beseitigen. Wie es weitergehe, hänge auch von den Ermittlungen der Polizei ab. Denkbar sei, einzelne Bewohner in andere Unterkünfte zu verlegen. Ab Ende Mai will die Verwaltung die Betreuung der Asylbewerber personell aufstocken. Dann soll ein Sozialarbeiter eingestellt werden. Die halbe Stelle ist noch bis zum 24. Mai ausgeschrieben und wird laut Verwaltung nach Ende der Bewerbungsfrist schnellstmöglich besetzt. (lb) Kommentare Bitte Javascript einschalten um Kommentare anzuzeigen. Inhalt teilen 	5660	True
