line	page	week	num_likes	domain	outlet	title	description	contenttype	image	url	text	id	right_of_center
7482	AfD	40	1	handelsblatt.com		Flüchtlingsdebatte: „Ich habe Angst, dass Bürger gegen uns marschieren“	In Sachsen droht ein Asylbewerber einer Angestellten mit Enthauptung. Nun reagiert der Innenminister des Landes.	Article	http://www.handelsblatt.com/images/sachsen-spenden-fuer-fluechtlinge-/12380244/2-format2010.jpg	http://www.handelsblatt.com/politik/deutschland/fluechtlingsdebatte-ich-habe-angst-dass-buerger-gegen-uns-marschieren/12380020.html	12.000.000 Offiziellen Schätzungen zufolge sind zwölf Millionen Syrer auf der Flucht vor dem Bürgerkrieg in ihrer Heimat. Davon gelten acht Millionen als im eigenen Land vertrieben, weitere vier Millionen flüchteten ins Ausland. Mehr als 250.000 Menschen wurden seit Ausbruch des Konflikts 2011 getötet. Dem UNHCR zufolge sind die Hälfte der über das Mittelmeer kommenden Flüchtlinge Syrer. Die zweitgrößte Gruppe sind demnach Afghanen mit 13 Prozent, gefolgt von Eritreern mit acht Prozent. In Griechenland sind 70 Prozent der ankommenden Flüchtlinge Syrer und 19 Prozent Afghanen. Nach der geltenden Rechtslage sind den Behörden jedoch die Hände gebunden. „Grundsätzlich haben Straftaten und Gerichtsverfahren keine Auswirkungen auf das laufende Asylverfahren“, sagte der Sprecher des Bundesamts für Migration und Flüchtlinge (BAMF), Mehmet Ata, dem Handelsblatt. Gleichwohl gebe es im Asylverfahren „verschiedene Ausschlussklauseln, bei deren Vorliegen die Gewährung von Asyl, Flüchtlingsschutz oder subsidiärem Schutz ausscheidet“.   Eine Flüchtlingsanerkennung ist beispielsweise ausgeschlossen, wenn ein Ausländer rechtskräftig zu einer Freiheitsstrafe von mindestens drei Jahren verurteilt worden ist. Allerdings wird dann immer noch geprüft, ob tatsächlich abgeschoben werden kann. Gilt der Herkunftsstaat als nicht sicher, bleiben auch Straftäter in Deutschland. Der Sozialdemokrat hat für diese, wie er schreibt, „sinnlose Gesetzeslage“ kein Verständnis. „Bezüglich Flüchtlingen habe ich echt Angst, dass eine markante Zahl an Bürgern bald gegen uns marschiert. Entweder wir kriegen die Kurve oder unserer Gesellschaft droht ein sehr negativer Wandel“, warnt er. Die gegenwärtige Rechtspraxis nutzte den „braunen Zellen“. Sie schadeten aber insbesondere auch der überwiegenden Anzahl der Asylbewerber, die friedlich hier lebten und dankbar seien, in der Bundesrepublik Schutz gefunden zu haben. „Denn auf sie fällt nun bei vielen Leuten ein Generalverdacht.“ Hunderttausende von Flüchtlingen werden dieses Jahr in Deutschland Asyl beantragen. Was denken sie? Was wollen sie? Weil die Neuankömmlinge noch immer vielsprachig sprachlos sind, will das Handelsblatt ihnen eine Stimme geben: Auf 50 Seiten sprechen und schreiben Künstler und Unternehmer, Schriftsteller, Ärzte und Ingenieure, Männer und Frauen aus Afghanistan, Iran und und Irak, Syrien, Eritrea aber auch dem Kosovo über Merkel und Europa, Heidenau und das Schleppergeschäft – aber auch die Sorgen der Deutschen, mit denen sie nun konfrontiert werden. Sie erhalten das komplette Dossier als PDF zum Download für Digitalpassnutzer oder im Einzelverkauf im Kaufhaus der Weltwirtschaft. Freibergs Bürgermeister Sven Krüger (SPD) hatte sich schon kurz nach dem Überfall aufgeregt. Er habe kein Verständnis für die Justiz, die den Täter nicht in Haft behalte, wird Krüger in verschiedenen Medien zitiert. „So werden wir unsere Bürgerinnen und Bürger nicht schützen und die Arbeit der Polizei verpufft.“ Krügers Parteifreund Greysinger fordert ein härteres Vorgehen. „Wir müssen nicht Gesetze haben wie zum Beispiel in Dubai, wo schon ein schwererer Verkehrsverstoß, zum Beispiel eine erhebliche Geschwindigkeitsübertretung, eines Gastarbeiters genügt, um ihn auszuweisen. Aber ein Stück weit in diese Richtung sollten wir uns bewegen.“ Seite 1: 	7482	True
7483	AfD	40	2	spiegel.de	SPIEGEL ONLINE	Plan der Bundesregierung: Sonderzüge sollen Flüchtlinge aus Österreich abholen - SPIEGEL ONLINE	Die Bundesregierung will Sonderzüge einsetzen, um Flüchtlinge direkt aus Salzburg zu holen. Täglich sollen Tausende Menschen in die deutschen Aufnahmelager gebracht werden. Damit soll die Grenzregion entlastet werden.	article	http://cdn2.spiegel.de/images/image-902671-galleryV9-mdly-902671.jpg	http://www.spiegel.de/politik/deutschland/sonderzuege-sollen-fluechtlinge-aus-oesterreich-abholen-a-1055139.html	Plan der Bundesregierung: Sonderzüge sollen Flüchtlinge aus Österreich abholen Von Andreas Ulrich AFP Flüchtling im Zug: Täglich acht Fahrten Die Bundesregierung will Sonderzüge einsetzen, um Flüchtlinge direkt aus Salzburg zu holen. Täglich sollen Tausende Menschen in die deutschen Aufnahmelager gebracht werden. Damit soll die Grenzregion entlastet werden. Der Andrang der Flüchtlinge auf Deutschland lässt nicht nach. Nach Informationen von SPIEGEL ONLINE plant die Bundesregierung deshalb, in den kommenden Tagen Sonderzüge einzusetzen, die aus dem österreichischen Salzburg direkt in die Erstaufnahmelager nach Deutschland fahren. Geplant sind demnach acht Züge täglich, die jeweils rund 500 Menschen transportieren, also etwa 4000 pro Tag. Eine offizielle Stellungnahme aus dem Innenministerium gibt es bislang nicht. Ziel ist, den Druck auf Österreich und die deutschen Grenzen zu mildern. Es ist der hilflose Versuch, zu einem noch halbwegs geordneten Verfahren der Einreise zu kommen. Und es ist die Kapitulation vor der Masse. Denn kaum ein Flüchtling wird dann noch an der Grenze oder grenznah registriert. Das soll dann erst in den Aufnahmelagern geschehen. Die österreichischen Behörden sind schon länger dazu übergegangen, Züge mit Flüchtlingen nach Deutschland zu schicken, vornehmlich nach Freilassing. Deutschland hat sich laut einem internen Papier aus dem österreichischen Innenministerium bereit erklärt, keine Flüchtlinge zurück ins Nachbarland zu schicken. Salzburg ist dort einer der zentralen Knotenpunkte. Zu Hunderten stehen Ausländer auf der Saalbrücke, die über den Grenzfluss Saalach führt und von der Bundespolizei abgeriegelt wird, manche campieren sogar am Ufer. Die Tiefgarage unter dem Salzburger Hauptbahnhof ist voller Flüchtlinge, Journalisten haben dort keinen Zutritt. Immer wenn der Druck zu groß ist, werde ein neuer Zug nach Deutschland geschickt, sagte ein Beamter, der an der Grenze seinen Dienst versieht. Am vergangenen Wochenende stellte allein die Bundespolizei rund 10.000 sogenannte unerlaubte Einreisen fest, die tatsächliche Zahl dürfte das Dreifache betragen. Denn die Züge, die etwa aus Salzburg über die deutsche Grenze fahren, werden von der Bundespolizei, die eigentlich für die Grenzsicherung zuständig ist, schon jetzt nicht mehr kontrolliert. Das übernimmt, zumindest teilweise, die Landespolizei. AP 	7483	True
7486	AfD	40	1006	focus.de	FOCUS Online	Polizei warnt vor knallharten kriminellen Strukturen in deutschen Flüchtlingscamps		article	http://p5.focus.de/img/incoming/crop4610563/479271331-w1200-h627-o-q75-p5/148d1600a3740625.jpg	http://www.focus.de/politik/deutschland/sunniten-gegen-schiiten-polizei-warnt-vor-knallharten-kriminellen-strukturen-in-deutschen-fluechtlingscamps_id_4978575.html	von Jochen Wollog als ob es unter den Flüchtlingen sehr viel Erkentnissbedarf hinsichtlich eines friedvollen Miteinander gibt. Sie fliehen vor der Zerrissenheit und dem Kampf den ihnen ihr Glauben liefert, und sie setzen diesen Krampf hier munter fort. Sie müssten doch froh sein endlich in Frieden leben zu dürfen. Tja leider geht es nicht von heute auf morgen, eine gelernte und gelebte Vergangenheit aus dem Kopf zu bekommen. Es braucht seine Zeit. Wir sollten die Augen aufmachen und der Tatsache ins Auge sehen, dass sie unter uns weilen und viele von ihnen bleiben werden. Wir sind gefordert diese Mensche zu unterstützen um ein einander verstehen zu schaffen. Nur wenn wir uns gegenseitig in die Augen sehen können, kann es geschaffen werden. Sonst droht die Gefahr, dass wir uns selbst ausgemerkeln. Wäre Schad Antwort schreiben 10.10.2015 von Dorothee Kallenberg Dank Merkel reisen Abertausende aus terrorgeprägten Regionen ohne Kontrolle ein- was ist da anderes zu erwarten? Die Lage ist rundum außer Kontrolle! Das Asylrecht bedarf dringendst einer Ergänzung um eine Asylunwürdigkeit bei schwerer Delinquenz! Aber das beste Gesetz nützt nichts, wenn es nicht angewandt wird- und in D´land herrschen seit Jahren gewaltige Vollzugsdefizite. Die kaputtgesparte Polizei ist zudem personell nicht in der Lage, die Bevölkerung und die tatsächlichen Flüchtlinge wirksam zu schützen. Die Urheber des GG haben nicht vorhergesehen, dass das Schicksal der Nation einmal von einer einzigen irrationalen Person an der Regierungsspitze abhängen würde- sonst wäre deren Macht begrenzter. So stehen wir vor einem Staatsversagen mit unabsehbaren Folgen! Antwort schreiben 06.10.2015 von Gerd Güßgen unser geliebter Rechtsstaat versagt immer mehr. Gewalttäter dürfen weiter Ihrem Asylantrag nachgehen. Ich möchte jedenfalls nicht in einem Staat leben wo ich alleine nach 8 Uhr nicht mehr auf die Straße gehen kann, um nicht in Gefahr zu laufen, angepöbelt zu werden oder mir vielleicht noch Schlimmeres. passieren kann. Den diese Leute haben ein anderes Verständnis wie man mit dem Anderen umgeht. Anpassung zu fordern aber nichts dafür tun kann jeder. Auf dem besten Wege dahin sind wir jedenfalls. Spätestens dann ziehe ich mit der Familie weg aus Deutschland und mache den Weg frei für die Stärkeren. Antwort schreiben 06.10.2015 von Klaus Röther Es kommen noch Millionen nach . Warum handelt die Regierung nicht ist der Untergang Deutschlands selbst von unseren Politiker gewollt ?? Ich stelle immer wieder fest das Unsere Politiker für nichts zu gebrauchen ist aber so blöd kann selbst ein Politiker nicht sein zu sehen das dies nicht funktionieren kann . Arbeitslosen werden steigen min 15 Milionen , die Krankenkassen werden zusammenbrechen usw. Und die Merkel stellt sich hin und sagt es werden noch mehr kommen stoppt diese Frau sie ist nicht mehr zurechnungsfähig. So könnte die moderne DDR aussehen das voll muss alles schlucken Antwort schreiben 02.10.2015 von Alen Sedic Das hat so alles keinen Sinn mehr, das hinterfragen und beschönigen hat irgendwann ein Ende! Diese arabischen Immigranten tanzen uns, und vor allem der Polizei, auf der Nase herum und das wird von der Politik und den Medien noch gefördert und beschönigt! Nicht mehr lange und es gibt kein D mehr wie bisher, also muß jetzt gehandelt werden, nicht erst 2017; D, Europa, brauchen eine neue Politik und vor allem, eine neue Regierung! Antwort schreiben 02.10.2015 von Richard Monster Als ich diesen Spruch hörte, fiel mir das Gespräch zweier DDR-Bürger auf Hofer Hauptbahnhof nach der Grenzöffnung wieder ein. Die sagten doch damals tatsächlich: Für die DDR brauchten wir 40Jahre um sie zugrunde zu richten, für die BRD wesentlich weniger. Frau Merkel muß das auch gehört haben, sie ist gerade dabei unser schönes Deutschland in den Abgrund zu reissen. Antwort schreiben 02.10.2015 1 Antwort von Hinrich Rah ist alles so eingetreten wie das Pack vom Stammtisch es vorausgesagt hat. Und es kommt noch schlimmer. Doch wir Deutschen leiden wahrscheinlich gerne, fühlen uns wohl in der Rolle der Lämmer. Anders kann ich mir die Umfrage Werte für CDU und die anderen Volksverräter linkpopulistischen Volksverräter nicht erklären. Antwort schreiben Glaube nur der Statistik(alternativ Umfrage) die du selber gefälscht hast. Wird im allgemeinen Churchill zugeschreiben. 01.10.2015 	7486	True
7494	AfD	40	1	faz.net	FAZ.NET	Großeinsatz in Thüringen: Mehrere Flüchtlinge nach Krawallen in Suhl festgenommen	Schwerer Landfriedensbruch, versuchter Totschlag, Körperverletzung, Sachbeschädigung: So lauten die Vorwürfe gegen rund 50 Personen, die jetzt nach schweren Ausschreitungen in einer Asylbewerberunterkunft in Suhl festgenommen worden sind.		http://media0.faz.net/ppmedia/aktuell/politik/fluechtlingskrise/1473290743/1.3829438/article_multimedia_overview/pure-lust-an-der-gewalt-ein.jpg	http://www.faz.net/aktuell/politik/fluechtlingskrise/viele-fluechtlinge-nach-krawallen-in-suhl-verhaftet-13829436.html	Viele Flüchtlinge nach Krawallen in Suhl verhaftet   Beitrag per E-Mail versenden Viele Flüchtlinge nach Krawallen in Suhl verhaftet Großeinsatz in Thüringen Mehrere Flüchtlinge nach Krawallen in Suhl festgenommen Von Schwerer Landfriedensbruch, versuchter Totschlag, Körperverletzung, Sachbeschädigung: So lauten die Vorwürfe gegen rund 50 Personen, die jetzt nach schweren Ausschreitungen in einer Asylbewerberunterkunft in Suhl festgenommen worden sind. Ein Fehler ist aufgetreten. Bitte überprüfen Sie Ihre Eingaben. E-Mail-Adresse des Empfängers (Mehrere Adressen durch Kommas trennen) Ihre E-Mail Adresse Ihre Nachricht (optional) Sicherheitscode Um einen neuen Sicherheitscode zu erzeugen, klicken Sie bitte auf das Bild. Bitte geben Sie hier den oben gezeigten Sicherheitscode ein. Veröffentlicht: 29.09.2015, 09:08 Uhr Großeinsatz in Thüringen Mehrere Flüchtlinge nach Krawallen in Suhl festgenommen Schwerer Landfriedensbruch, versuchter Totschlag, Körperverletzung, Sachbeschädigung: So lauten die Vorwürfe gegen rund 50 Personen, die jetzt nach schweren Ausschreitungen in einer Asylbewerberunterkunft in Suhl festgenommen worden sind. 29.09.2015 © dpa Pure Lust an der Gewalt: ein zerstörtes Büro der Flüchtlingsunterkunft in Suhl, aufgenommen am Tag nach den Ausschreitungen © dpa Pure Lust an der Gewalt: ein zerstörtes Büro der Flüchtlingsunterkunft in Suhl, aufgenommen am Tag nach den Ausschreitungen Rund sechs Wochen nach schweren Ausschreitungen in einer Asylbewerberunterkunft im thüringischen Suhl hat es jetzt zahlreiche Festnahmen gegeben. Im Zuge einer landesweiten Polizeiaktion seien am Dienstagmorgen in mehreren Flüchtlingsunterkünften bislang 14 Tatverdächtige festgenommen worden, sagte ein Polizeisprecher in Suhl. Insgesamt sollten 16 Haftbefehle vollstreckt werden. Den Tatverdächtigen werde schwerer Landfriedensbruch, versuchter Totschlag, Körperverletzung und Sachbeschädigung vorgeworfen. Bei Auseinandersetzungen zwischen Flüchtlingen in der Unterkunft in Suhl und anschließenden Krawallen waren im August 17 Personen verletzt worden, unter ihnen sechs Polizeibeamte. Dutzende Flüchtlinge hatten die Beamten mit Steinen und Eisenstangen angegriffen und Mobiliar und Streifenwagen beschädigt. Zuvor war ein Streit zwischen Flüchtlingen eskaliert, nachdem ein Heimbewohner einige Seiten aus einem Koran herausgerissen haben soll. Den nun festgenommenen Flüchtlingen werde vorgeworfen, an den Auseinandersetzungen beteiligt gewesen zu sein. Am Montag seien deshalb Polizisten in Unterkünften in Suhl, Erfurt und Obermehler im Unstrut-Hainich-Kreis im Einsatz gewesen. Justizminister Lauinger: „Zu diesem Land gehört Religionsfreiheit“ Nach Informationen des MDR Thüringen hatte die Kriminalpolizei Suhl zuvor wochenlang Videobänder und Fernsehbilder ausgewertet, um die mutmaßlichen Täter zu identifizieren. Darunter war demnach auch ein knapp 30 Minuten langes Video, das offenbar von einem Flüchtling in der Erstaufnahmestelle Suhl gedreht worden war. Darin sei unter anderem zu sehen, wie Flüchtlinge die Wachräume in dem Gebäude angreifen und auf die Wachleute losgehen. Mehr zum Thema Rückblick: Koranschändung löst massive Krawalle in Flüchtlingsheim aus Der thüringische Integrations- und Justizminister Dieter Lauinger (Grüne) bezeichnete die Gewaltausbrüche in Flüchtlingsunterkünften als „nicht hinnehmbar“. Man müsse hier auch den Flüchtlingen gegenüber klare Grenzen ziehen. „Zu diesem Land gehört Religionsfreiheit. Und das bedeutet: auch wenn man sich gekränkt fühlt, kann man nicht jemand, der einen gekränkt hat, ans Leben gehen wollen“, sagte Lauinger am Dienstag im Bayerischen Rundfunk. Bundesweit hat es mittlerweile wiederholt Auseinandersetzungen in Flüchtlingsunterkünften gegeben, zuletzt am Wochenende eine Massenschlägerei in einer Unterkunft in Kassel-Calden mit 14 Verletzten. In Rheinland-Pfalz war es Ende Juli in einer Asylbewerberunterkunft in Trier zu einer Schlägerei mit Dutzenden Beteiligten gekommen. Beim Streit während eines Fußballspiels zwischen Syrern und Albanern wurde ein syrischer Flüchtling verletzt. Deshalb waren unter anderem von der Polizeigewerkschaft Forderungen laut geworden, Flüchtlinge künftig nach Religionen getrennt unterzubringen. $stleKurz To view this video please enable JavaScript, and consider upgrading to a web browser that supports HTML5 video © dpa, reuters Rückblick: Koranschändung löst massive Krawalle in Flüchtlingsheim aus „Aufteilung nach Religion und Ethnie nicht sinnvoll“ Der rheinland-pfälzische Innenminister Roger Lewentz (SPD) sagte dazu, er halte eine Aufteilung von Flüchtlingen zur Vermeidung von Konflikten und Schlägereien nicht für sinnvoll. „Eine Trennung nach Religionen oder gar Ethnien ist bei dem derzeitigen Ansturm kaum praktikabel“, sagte Lewentz der dpa in Mainz. „Dort, wo möglich, wird sehr genau darauf geachtet, dass keine konfliktträchtigen Potentiale entstehen.“ Die wichtigste Aufgabe sei es, geflohenen Menschen ein Dach über dem Kopf zu bieten. Vorfälle wie in Calden habe es in Rheinland-Pfalz zwar noch nicht gegeben, sagte Lewentz weiter. „Wir wissen aber, dass die Menschen in Flüchtlingseinrichtungen häufig zumindest vorübergehend auf sehr engem Raum zusammenleben.“ Darauf habe sich die Polizei vorbereitet. Alle Erstaufnahmen im Land würden regelmäßig von Streifen geschützt. Und in den Haupteinrichtungen Trier und Ingelheim gibt es nach Ministeriumsangaben Ermittlungsgruppen im Tagdienst von Montag bis Freitag von je acht Polizisten und zwei Angestellten. Dazu komme eine enge Zusammenarbeit mit privaten Sicherheitsdiensten. Der stellvertretende SPD-Vorsitzende Ralf Stegner sagte der „Rheinischen Post“  vom Dienstag: „Man muss sensibel bei ethnischen Konflikten agieren, aber eine pauschale religiöse oder ethnische Trennung kann nicht die Lösung sein.“ Der SPD-Abgeordnete Achim Post, Vorsitzender der nordrhein-westfälischen Landesgruppe in der SPD-Bundestagsfraktion, sagte derselben Zeitung: „Das Hauptproblem ist nicht die Ethnie oder die Religion, sondern die Zustände und die beengten Wohnmöglichkeiten.“ Islamwissenschaftlerin: Schlichter in Unterkünfte Die Islamwissenschaftlerin Lamya Kaddor warb unterdessen für den Einsatz von Streitschlichtern in Flüchtlingsunterkünften, um gewaltsame Auseinandersetzungen zu verhindern. Natürlich komme es zu Konflikten, wenn so viele Menschen auf engem Raum zusammenleben müssten, sagte Kaddor am Dienstag im ZDF-„Morgenmagazin“. Die Einschätzung, dass sich in den Unterkünften ein „explosives Gemisch“ zusammenbraue, bezeichnete die Expertin aber als „populistisches Gerede“. An diesem Dienstag soll eine Gesetzesnovelle im Kabinett verabschiedet werden, die neue Bestimmungen über sichere Balkanstaaten enthält. Damit sollen sich Asylverfahren von Bewerbern aus diesen Ländern in Berlin deutlich beschleunigen. Der Berliner Sozialsenator Mario Czaja (CDU) erwarte für diese Personengruppe einen Abschluss von Asylverfahren innerhalb eines Tages, sagte er der „Berliner Morgenpost“ vom Dienstag. Möglich werde dies durch ein spezielles Aufnahmezentrum für Asylbewerber aus Westbalkanstaaten in einer neuen Erstregistrierungsstelle.  Vom 1. November an sollen auch Albanien, das Kosovo und Montenegro als sichere Herkunftsländer gelten, für deren Einwohner es dann grundsätzlich kein Asylrecht mehr gibt. 	7494	True
7496	AfD	40	0	bild.de	BILD.de	200.000 Flüchtlinge kamen in den letzten 3 Wochen	Trotz deutscher Grenzkontrollen hält die Flüchtlingswelle an. In den vergangenen drei Wochen kamen mehr als 200 000 Migranten.	article	http://bilder.bild.de/fotos/in-muenchen-kommen-noch-immer-die-meisten-neuen-fluechtlinge-in-deutschland-an-47767367-42747594/Bild/3.bild.jpg	http://www.bild.de/politik/inland/fluechtlingskrise/zahl-der-fluechtlinge-in-deutschland-steigt-dramatisch-42747548.bild.html	"Die Kanzlerin wird von ihrer eigenen Partei für ihre Flüchtlingspolitik attackiert. Zum ersten Mal gibt es offene Kritik. 10 000 Flüchtlinge kommen pro Tag nach Deutschland Am 5. September hat Bundeskanzlerin Angela Merkel (61, CDU) entschieden, Flüchtlinge aus Syrien in unbegrenzter Zahl aufzunehmen. Am 13. September führte Deutschland als Reaktion auf den danach einsetzenden Flüchtlingsansturm wieder temporäre Grenzkontrollen ein – vor allem an der Grenze zu Österreich, Tschechien und Polen. Doch trotz der Grenzkontrollen sinkt die Zahl der ankommenden Flüchtlinge nicht, sie steigt! Nach BILD-Informationen aus Sicherheitskreisen sind in der Zeit vom 5. September 2015 bis zum 27. September 2015 rund 230 000 Asylsuchende nach Deutschland gekommen. Allein zwei Drittel davon – rund 150 000 –  sind nach den eingeführten Grenzkontrollen in Deutschland gelandet. Die Wahrheit ist: Täglich kommen im Schnitt rund 10 000 Flüchtlinge ins Land! Kapitulation des Staates vor der Flüchtlingswelle Der Unmut in der Union über Merkels Flüchtlingspolitik ist inzwischen groß. Außenexperte Hans-Peter Uhl (71, CSU) wirft Merkel vor, dass nach ihrer spontanen Entscheidung, alle Syrien-Flüchtlinge aufzunehmen, der „Rechts- und Sozialstaat vor den Flüchtlingen kapituliert haben“. Uhl zu BILD: „In Deutschland bestimmen nicht mehr die Sicherheitsbehörden, wer über die Grenze kommen darf, sondern kriminelle Schlepper-Banden. Und anstatt das Gesundheitssystem zu schützen und zu sanieren will der Bund jetzt jedem alles geben. Das ist die Kapitulation des Rechts- und Sozialstaats.“ Vergrößern Bei der Registrierung von Flüchtlingen werden die persönlichen Daten und die Fingerabdrücke aufgenommen Foto: dpa Fest steht: Der Ansturm ist noch nicht vorbei. Obwohl Ungarn seine Grenze zu Serbien mit einem Stacheldrahtzaun weitgehend geschlossen hat, ist die so gennante Balkan-Route noch immer stark frequentiert. Zehntausende Flüchtlinge haben sich in den vergangenen Wochen ihren Weg aus Kriegsregionen wie Syrien über Griechenland, Mazedonien, Serbien und Ungarn nach Österreich gebahnt. Nach neuesten Angaben der Bundespolizei steigt die Zahl der nach Deutschland kommenden Flüchtlinge aktuell wieder. ►Die Bundespolizei registrierte am Montag 5380 illegale Einreisen, wie ein Sprecher am Dienstag mitteilte. Am Sonntag waren es demnach 4160 und am Samstag 3600. Die wirklichen Flüchtlingszahlen dürften nach Angaben aus Behördenkreisen um bis das Dreifache höher sein. Der überwiegende Teil der Menschen kommt nach wie vor über Österreich nach Deutschland. Täglich werden nach Angaben von mit den Zahlen Vertrauten zwischen 2000 und 3000 Menschen mit Sonderzügen direkt in deutsche Aufnahme-Einrichtungen gefahren. Demnach rollen bis auf weiteres jeden Tag vier bis fünf Sonderzüge meist von Salzburg ohne Kontrollen über die Grenze und bringen die Flüchtlinge Nonstop etwa nach Düsseldorf oder nach Lehrte bei Hannover. Erst dort würden sie dann registriert, da die Bundespolizei mit der Kontrolle an der Grenze überfordert sei, hieß es. Wieso gibt es keine einheitlichen Zahlen in Deutschland? Allerdings: Die Behörden haben zunehmend Schwierigkeiten die Migranten einheitlich zu registrieren. Verschiedene Zuständigkeiten, unterschiedliche Arten einzureisen und fehlende Strukturen machen es unmöglich, klare Aussagen über Flüchtlingszahlen zu treffen. Vergrößern Am deutsch-österreichischen Grenzübergang in Freilassing warten immer wieder große Flüchtlings-Gruppen auf die Einreise in die Bundesrepublik Foto: dpa Eine Sprecherin der Bundespolizei bestätigte gegenüber BILD, dass ihre Behörde in den letzen eineinhalb Wochen täglich knapp 3000 Flüchtlinge registriert hat. Da parallel aber auch das Bundesamt für Migration und Flüchtlinge ( BAMF ) und die jeweilige Landespolizei mit der Registrierung beschäftigt seien, liege die Zahl weit unter der der tatsächlichen Zuwanderung: „Es hängt stark davon ab, wie die Migranten ins Land kommen und welche Behörde sie aufgreift"", sagte die Sprecherin zu BILD. Wie viele Menschen sind noch auf dem Weg? ► In Kroatien sind am Freitag fast 10 000 Flüchtlinge eingetroffen – einer neuer Rekord für das Land. In den vergangenen zehn Tagen hätten damit insgesamt 65 000 Migranten die Grenzen zu dem EU-Land überquert, teilte das Innenministerium in Zagreb mit. Nach der Schließung der Grenze zwischen Ungarn und Serbien Mitte September waren tausende Flüchtlinge in das Nachbarland Kroatien ausgewichen. ► Nach Polizeiangaben kamen Ende letzter Woche in Ungarn 8159 Flüchtlinge an. In den vergangenen drei Tagen waren es demnach insgesamt 26 309. Nahezu alle wurden Medienberichten zufolge von Ungarns Behörden zur österreichischen Grenze gebracht. ► Auf der griechischen Insel Lesbos erreichen wieder mehr Flüchtlinge ihr Ziel Europa. In weniger als einer Stunde kamen in der vergangenen Woche in 24 Booten rund 1200 Menschen an, berichtet ein Fotograf der Nachrichtenagentur Reuters. Mehr zur Flüchtlingskrise "	7496	True
